example/20230903_000709.csv
Validator,Stake,Reward,Sortition
1, 1000, 119, 120
2, 1000, 160, 162
3, 1000, 137, 135
4, 1000, 144, 144
5, 1000, 113, 115
6, 1000, 140, 141
7, 1000, 144, 144
8, 1000, 134, 132
9, 1000, 149, 149
10, 1000, 134, 136
11, 1000, 135, 137
12, 1000, 170, 170
13, 1000, 136, 143
14, 1000, 127, 130
15, 1000, 151, 151
16, 1000, 130, 134
17, 1000, 120, 120
18, 1000, 138, 142
19, 1000, 129, 133
20, 1000, 126, 123
21, 1000, 125, 124
22, 1000, 136, 137
23, 1000, 137, 140
24, 1000, 133, 130
25, 1000, 154, 148
26, 1000, 149, 145
27, 1000, 169, 166
28, 1000, 148, 149
29, 1000, 132, 129
30, 1000, 132, 131
31, 1000, 147, 157
32, 1000, 144, 148
33, 1000, 135, 136
34, 1000, 107, 106
35, 1000, 164, 161
36, 1000, 132, 132
37, 1000, 147, 146
38, 1000, 132, 129
39, 1000, 151, 140
40, 1000, 136, 135
41, 1000, 142, 141
42, 1000, 150, 143
43, 1000, 162, 166
44, 1000, 160, 151
45, 1000, 129, 135
46, 1000, 144, 148
47, 1000, 128, 131
48, 1000, 156, 158
49, 1000, 134, 133
50, 1000, 141, 143
51, 1000, 148, 145
52, 1000, 132, 135
53, 1000, 122, 122
54, 1000, 133, 129
55, 1000, 137, 134
56, 1000, 170, 176
57, 1000, 115, 117
58, 1000, 124, 126
59, 1000, 142, 141
60, 1000, 134, 132
61, 1000, 136, 134
62, 1000, 118, 119
63, 1000, 151, 155
64, 1000, 124, 122
65, 1000, 112, 119
66, 1000, 137, 137
67, 1000, 146, 144
68, 1000, 135, 135
69, 1000, 137, 142
70, 1000, 140, 132
71, 1000, 130, 130
72, 1000, 138, 136
73, 1000, 125, 125
74, 1000, 145, 146
75, 1000, 146, 140
76, 1000, 137, 138
77, 1000, 156, 154
78, 1000, 140, 143
79, 1000, 147, 142
80, 1000, 112, 116
81, 1000, 153, 154
82, 1000, 126, 128
83, 1000, 134, 136
84, 1000, 135, 135
85, 1000, 152, 150
86, 1000, 124, 123
87, 1000, 109, 117
88, 1000, 136, 136
89, 1000, 149, 150
90, 1000, 135, 135
91, 1000, 138, 146
92, 1000, 145, 145
93, 1000, 148, 144
94, 1000, 142, 145
95, 1000, 148, 151
96, 1000, 136, 144
97, 1000, 122, 123
98, 1000, 128, 132
99, 1000, 118, 119
100, 1000, 129, 134
101, 1000, 155, 154
102, 1000, 136, 138
103, 1000, 128, 131
104, 1000, 123, 126
105, 1000, 165, 161
106, 1000, 137, 136
107, 1000, 141, 142
108, 1000, 155, 158
109, 1000, 159, 160
110, 1000, 130, 133
111, 1000, 124, 120
112, 1000, 159, 160
113, 1000, 149, 149
114, 1000, 144, 143
115, 1000, 131, 134
116, 1000, 129, 131
117, 1000, 131, 128
118, 1000, 115, 118
119, 1000, 142, 140
120, 1000, 139, 144
121, 1000, 116, 121
122, 1000, 136, 134
123, 1000, 150, 148
124, 1000, 175, 164
125, 1000, 142, 142
126, 1000, 131, 131
127, 1000, 137, 142
128, 1000, 169, 166
129, 1000, 141, 143
130, 1000, 146, 146
131, 1000, 129, 127
132, 1000, 127, 127
133, 1000, 143, 151
134, 1000, 141, 145
135, 1000, 131, 136
136, 1000, 147, 152
137, 1000, 152, 152
138, 1000, 133, 134
139, 1000, 123, 127
140, 1000, 123, 127
141, 1000, 119, 126
142, 1000, 138, 134
143, 1000, 164, 165
144, 1000, 143, 150
145, 1000, 143, 143
146, 1000, 129, 126
147, 1000, 162, 162
148, 1000, 133, 134
149, 1000, 117, 121
150, 1000, 125, 127
151, 1000, 139, 140
152, 1000, 136, 139
153, 1000, 122, 128
154, 1000, 124, 125
155, 1000, 150, 153
156, 1000, 148, 150
157, 1000, 134, 139
158, 1000, 142, 140
159, 1000, 124, 123
160, 1000, 125, 131
161, 1000, 144, 152
162, 1000, 146, 146
163, 1000, 153, 151
164, 1000, 142, 144
165, 1000, 124, 125
166, 1000, 139, 135
167, 1000, 137, 135
168, 1000, 135, 132
169, 1000, 140, 138
170, 1000, 137, 140
171, 1000, 170, 168
172, 1000, 148, 151
173, 1000, 122, 133
174, 1000, 117, 117
175, 1000, 135, 138
176, 1000, 132, 133
177, 1000, 142, 146
178, 1000, 136, 134
179, 1000, 137, 142
180, 1000, 166, 167
181, 1000, 136, 138
182, 1000, 124, 121
183, 1000, 143, 138
184, 1000, 129, 133
185, 1000, 120, 124
186, 1000, 122, 130
187, 1000, 111, 113
188, 1000, 140, 135
189, 1000, 134, 137
190, 1000, 134, 143
191, 1000, 123, 129
192, 1000, 153, 156
193, 1000, 138, 134
194, 1000, 149, 150
195, 1000, 124, 126
196, 1000, 147, 150
197, 1000, 129, 133
198, 1000, 130, 129
199, 1000, 158, 163
200, 1000, 129, 129
201, 1000, 157, 158
202, 1000, 131, 132
203, 1000, 132, 134
204, 1000, 130, 125
205, 1000, 136, 139
206, 1000, 144, 146
207, 1000, 142, 139
208, 1000, 154, 145
209, 1000, 146, 145
210, 1000, 129, 131
211, 1000, 126, 128
212, 1000, 111, 114
213, 1000, 137, 138
214, 1000, 137, 139
215, 1000, 135, 130
216, 1000, 121, 123
217, 1000, 144, 139
218, 1000, 137, 135
219, 1000, 122, 124
220, 1000, 128, 125
221, 1000, 149, 158
222, 1000, 129, 129
223, 1000, 159, 166
224, 1000, 146, 140
225, 1000, 144, 143
226, 1000, 145, 148
227, 1000, 128, 133
228, 1000, 152, 152
229, 1000, 142, 143
230, 1000, 141, 149
231, 1000, 152, 155
232, 1000, 131, 133
233, 1000, 136, 140
234, 1000, 142, 145
235, 1000, 140, 143
236, 1000, 124, 124
237, 1000, 123, 123
238, 1000, 142, 137
239, 1000, 124, 129
240, 1000, 139, 138
241, 1000, 149, 149
242, 1000, 125, 130
243, 1000, 143, 142
244, 1000, 143, 143
245, 1000, 141, 142
246, 1000, 135, 132
247, 1000, 135, 129
248, 1000, 144, 142
249, 1000, 127, 126
250, 1000, 148, 152
251, 1000, 122, 122
252, 1000, 115, 118
253, 1000, 146, 145
254, 1000, 118, 117
255, 1000, 123, 122
256, 1000, 141, 141
257, 1000, 114, 119
258, 1000, 146, 145
259, 1000, 135, 139
260, 1000, 136, 137
261, 1000, 166, 164
262, 1000, 120, 121
263, 1000, 148, 144
264, 1000, 153, 150
265, 1000, 129, 122
266, 1000, 128, 131
267, 1000, 151, 149
268, 1000, 139, 140
269, 1000, 129, 131
270, 1000, 147, 143
271, 1000, 148, 152
272, 1000, 129, 130
273, 1000, 151, 150
274, 1000, 141, 142
275, 1000, 130, 124
276, 1000, 142, 147
277, 1000, 136, 136
278, 1000, 156, 153
279, 1000, 137, 132
280, 1000, 150, 145
281, 1000, 139, 138
282, 1000, 137, 140
283, 1000, 145, 143
284, 1000, 132, 139
285, 1000, 132, 134
286, 1000, 123, 126
287, 1000, 131, 134
288, 1000, 142, 142
289, 1000, 129, 130
290, 1000, 147, 150
291, 1000, 141, 146
292, 1000, 130, 131
293, 1000, 166, 165
294, 1000, 138, 139
295, 1000, 127, 123
296, 1000, 126, 131
297, 1000, 137, 139
298, 1000, 143, 145
299, 1000, 138, 139
300, 1000, 112, 116
301, 1000, 155, 151
302, 1000, 150, 147
303, 1000, 148, 144
304, 1000, 130, 128
305, 1000, 137, 139
306, 1000, 134, 130
307, 1000, 135, 133
308, 1000, 133, 135
309, 1000, 140, 140
310, 1000, 146, 142
311, 1000, 131, 134
312, 1000, 139, 139
313, 1000, 114, 113
314, 1000, 118, 122
315, 1000, 116, 121
316, 1000, 131, 133
317, 1000, 136, 133
318, 1000, 155, 162
319, 1000, 143, 143
320, 1000, 154, 156
321, 1000, 158, 158
322, 1000, 132, 135
323, 1000, 114, 120
324, 1000, 159, 162
325, 1000, 164, 159
326, 1000, 135, 138
327, 1000, 153, 147
328, 1000, 151, 153
329, 1000, 127, 128
330, 1000, 141, 136
331, 1000, 159, 157
332, 1000, 156, 159
333, 1000, 137, 147
334, 1000, 128, 124
335, 1000, 137, 144
336, 1000, 130, 130
337, 1000, 134, 133
338, 1000, 163, 169
339, 1000, 170, 168
340, 1000, 104, 107
341, 1000, 127, 130
342, 1000, 140, 142
343, 1000, 126, 136
344, 1000, 102, 104
345, 1000, 146, 144
346, 1000, 125, 127
347, 1000, 153, 155
348, 1000, 131, 129
349, 1000, 157, 155
350, 1000, 165, 162
351, 1000, 163, 167
352, 1000, 119, 121
353, 1000, 141, 143
354, 1000, 160, 160
355, 1000, 150, 148
356, 1000, 139, 143
357, 1000, 132, 131
358, 1000, 139, 137
359, 1000, 139, 137
360, 1000, 133, 137
361, 1000, 127, 126
362, 1000, 146, 141
363, 1000, 142, 144
364, 1000, 130, 136
365, 1000, 162, 159
366, 1000, 150, 151
367, 1000, 132, 129
368, 1000, 153, 160
369, 1000, 160, 161
370, 1000, 141, 142
371, 1000, 145, 145
372, 1000, 146, 147
373, 1000, 134, 139
374, 1000, 118, 125
375, 1000, 151, 142
376, 1000, 132, 134
377, 1000, 122, 120
378, 1000, 123, 122
379, 1000, 169, 171
380, 1000, 129, 142
381, 1000, 145, 147
382, 1000, 120, 128
383, 1000, 142, 148
384, 1000, 152, 157
385, 1000, 150, 151
386, 1000, 126, 130
387, 1000, 111, 108
388, 1000, 159, 164
389, 1000, 149, 148
390, 1000, 108, 114
391, 1000, 135, 126
392, 1000, 142, 140
393, 1000, 123, 124
394, 1000, 128, 122
395, 1000, 133, 134
396, 1000, 136, 136
397, 1000, 141, 147
398, 1000, 120, 116
399, 1000, 134, 131
400, 1000, 138, 136
401, 1000, 153, 147
402, 1000, 154, 154
403, 1000, 122, 119
404, 1000, 147, 145
405, 1000, 161, 161
406, 1000, 144, 144
407, 1000, 140, 141
408, 1000, 122, 125
409, 1000, 137, 148
410, 1000, 132, 137
411, 1000, 141, 145
412, 1000, 155, 150
413, 1000, 136, 134
414, 1000, 121, 123
415, 1000, 106, 111
416, 1000, 128, 130
417, 1000, 149, 146
418, 1000, 140, 143
419, 1000, 122, 119
420, 1000, 149, 150
421, 1000, 129, 137
422, 1000, 143, 146
423, 1000, 129, 126
424, 1000, 129, 129
425, 1000, 147, 141
426, 1000, 164, 161
427, 1000, 151, 150
428, 1000, 143, 145
429, 1000, 140, 137
430, 1000, 125, 129
431, 1000, 150, 146
432, 1000, 120, 117
433, 1000, 139, 141
434, 1000, 139, 139
435, 1000, 122, 121
436, 1000, 152, 150
437, 1000, 161, 168
438, 1000, 132, 137
439, 1000, 158, 157
440, 1000, 140, 142
441, 1000, 131, 129
442, 1000, 122, 124
443, 1000, 106, 108
444, 1000, 136, 133
445, 1000, 127, 126
446, 1000, 178, 177
447, 1000, 127, 133
448, 1000, 148, 140
449, 1000, 137, 134
450, 1000, 113, 114
451, 1000, 144, 140
452, 1000, 135, 135
453, 1000, 138, 130
454, 1000, 161, 158
455, 1000, 162, 160
456, 1000, 135, 139
457, 1000, 130, 130
458, 1000, 134, 139
459, 1000, 149, 154
460, 1000, 133, 133
461, 1000, 139, 142
462, 1000, 143, 142
463, 1000, 134, 130
464, 1000, 138, 147
465, 1000, 161, 158
466, 1000, 128, 128
467, 1000, 150, 146
468, 1000, 146, 141
469, 1000, 139, 145
470, 1000, 158, 151
471, 1000, 159, 155
472, 1000, 136, 137
473, 1000, 128, 129
474, 1000, 113, 120
475, 1000, 130, 130
476, 1000, 132, 134
477, 1000, 123, 120
478, 1000, 119, 121
479, 1000, 150, 148
480, 1000, 158, 159
481, 1000, 168, 171
482, 1000, 176, 178
483, 1000, 142, 142
484, 1000, 125, 129
485, 1000, 128, 130
486, 1000, 150, 151
487, 1000, 140, 142
488, 1000, 145, 143
489, 1000, 158, 160
490, 1000, 152, 149
491, 1000, 142, 139
492, 1000, 139, 141
493, 1000, 154, 156
494, 1000, 142, 142
495, 1000, 150, 145
496, 1000, 149, 156
497, 1000, 153, 151
498, 1000, 123, 127
499, 1000, 136, 143
500, 1000, 145, 148
501, 1000, 168, 164
502, 1000, 133, 134
503, 1000, 150, 152
504, 1000, 143, 144
505, 1000, 115, 117
506, 1000, 136, 138
507, 1000, 134, 145
508, 1000, 132, 133
509, 1000, 157, 154
510, 1000, 125, 121
511, 1000, 116, 119
512, 1000, 126, 124
513, 1000, 130, 132
514, 1000, 129, 130
515, 1000, 114, 113
516, 1000, 142, 146
517, 1000, 142, 140
518, 1000, 133, 135
519, 1000, 125, 130
520, 1000, 136, 133
521, 1000, 147, 147
522, 1000, 148, 151
523, 1000, 148, 144
524, 1000, 133, 142
525, 1000, 131, 135
526, 1000, 126, 131
527, 1000, 133, 129
528, 1000, 137, 145
529, 1000, 151, 154
530, 1000, 139, 137
531, 1000, 145, 143
532, 1000, 134, 132
533, 1000, 120, 124
534, 1000, 126, 125
535, 1000, 131, 131
536, 1000, 123, 126
537, 1000, 118, 124
538, 1000, 139, 132
539, 1000, 136, 139
540, 1000, 127, 123
541, 1000, 148, 144
542, 1000, 160, 154
543, 1000, 143, 140
544, 1000, 144, 148
545, 1000, 143, 143
546, 1000, 145, 151
547, 1000, 129, 128
548, 1000, 137, 132
549, 1000, 135, 134
550, 1000, 135, 133
551, 1000, 130, 131
552, 1000, 154, 157
553, 1000, 142, 142
554, 1000, 125, 131
555, 1000, 137, 140
556, 1000, 124, 129
557, 1000, 120, 128
558, 1000, 134, 136
559, 1000, 143, 143
560, 1000, 119, 123
561, 1000, 133, 135
562, 1000, 132, 135
563, 1000, 152, 158
564, 1000, 132, 129
565, 1000, 149, 141
566, 1000, 142, 144
567, 1000, 135, 133
568, 1000, 128, 131
569, 1000, 148, 148
570, 1000, 143, 144
571, 1000, 114, 116
572, 1000, 144, 141
573, 1000, 137, 136
574, 1000, 130, 133
575, 1000, 127, 123
576, 1000, 155, 153
577, 1000, 142, 144
578, 1000, 163, 168
579, 1000, 121, 120
580, 1000, 147, 141
581, 1000, 131, 134
582, 1000, 124, 124
583, 1000, 144, 142
584, 1000, 136, 137
585, 1000, 139, 135
586, 1000, 123, 129
587, 1000, 136, 137
588, 1000, 143, 144
589, 1000, 147, 147
590, 1000, 146, 148
591, 1000, 141, 140
592, 1000, 124, 125
593, 1000, 147, 150
594, 1000, 125, 127
595, 1000, 139, 140
596, 1000, 139, 143
597, 1000, 129, 137
598, 1000, 131, 133
599, 1000, 130, 127
600, 1000, 143, 145
601, 1000, 151, 147
602, 1000, 148, 153
603, 1000, 144, 143
604, 1000, 141, 140
605, 1000, 117, 126
606, 1000, 131, 137
607, 1000, 143, 142
608, 1000, 151, 156
609, 1000, 134, 136
610, 1000, 120, 119
611, 1000, 136, 142
612, 1000, 134, 135
613, 1000, 129, 129
614, 1000, 144, 153
615, 1000, 135, 146
616, 1000, 143, 143
617, 1000, 133, 136
618, 1000, 120, 124
619, 1000, 135, 136
620, 1000, 148, 146
621, 1000, 123, 122
622, 1000, 140, 138
623, 1000, 121, 120
624, 1000, 132, 137
625, 1000, 135, 141
626, 1000, 153, 147
627, 1000, 112, 114
628, 1000, 137, 138
629, 1000, 136, 136
630, 1000, 141, 137
631, 1000, 120, 122
632, 1000, 144, 152
633, 1000, 143, 140
634, 1000, 131, 133
635, 1000, 107, 108
636, 1000, 114, 117
637, 1000, 156, 155
638, 1000, 140, 140
639, 1000, 134, 131
640, 1000, 116, 124
641, 1000, 140, 139
642, 1000, 163, 161
643, 1000, 140, 138
644, 1000, 126, 132
645, 1000, 162, 163
646, 1000, 143, 143
647, 1000, 133, 138
648, 1000, 134, 131
649, 1000, 137, 139
650, 1000, 150, 152
651, 1000, 123, 123
652, 1000, 150, 153
653, 1000, 149, 140
654, 1000, 146, 148
655, 1000, 153, 151
656, 1000, 140, 143
657, 1000, 141, 139
658, 1000, 134, 135
659, 1000, 153, 151
660, 1000, 132, 136
661, 1000, 126, 128
662, 1000, 127, 126
663, 1000, 134, 133
664, 1000, 163, 164
665, 1000, 127, 126
666, 1000, 163, 160
667, 1000, 161, 163
668, 1000, 133, 134
669, 1000, 147, 154
670, 1000, 134, 137
671, 1000, 148, 146
672, 1000, 127, 128
673, 1000, 147, 149
674, 1000, 152, 151
675, 1000, 136, 139
676, 1000, 156, 161
677, 1000, 125, 124
678, 1000, 142, 141
679, 1000, 154, 153
680, 1000, 151, 152
681, 1000, 151, 158
682, 1000, 133, 134
683, 1000, 131, 126
684, 1000, 149, 145
685, 1000, 115, 117
686, 1000, 118, 123
687, 1000, 140, 144
688, 1000, 152, 149
689, 1000, 128, 132
690, 1000, 147, 147
691, 1000, 132, 133
692, 1000, 142, 138
693, 1000, 117, 120
694, 1000, 126, 128
695, 1000, 132, 133
696, 1000, 127, 126
697, 1000, 146, 142
698, 1000, 147, 146
699, 1000, 155, 155
700, 1000, 163, 161
701, 1000, 154, 154
702, 1000, 129, 127
703, 1000, 136, 138
704, 1000, 134, 138
705, 1000, 150, 148
706, 1000, 136, 141
707, 1000, 125, 126
708, 1000, 150, 153
709, 1000, 141, 142
710, 1000, 129, 133
711, 1000, 123, 127
712, 1000, 132, 131
713, 1000, 137, 144
714, 1000, 142, 147
715, 1000, 151, 154
716, 1000, 127, 125
717, 1000, 141, 145
718, 1000, 112, 114
719, 1000, 148, 148
720, 1000, 132, 130
721, 1000, 137, 141
722, 1000, 137, 135
723, 1000, 139, 136
724, 1000, 134, 136
725, 1000, 155, 153
726, 1000, 124, 120
727, 1000, 137, 139
728, 1000, 137, 142
729, 1000, 134, 136
730, 1000, 144, 142
731, 1000, 120, 120
732, 1000, 136, 141
733, 1000, 140, 150
734, 1000, 113, 112
735, 1000, 127, 132
736, 1000, 126, 133
737, 1000, 141, 141
738, 1000, 147, 150
739, 1000, 126, 125
740, 1000, 114, 118
741, 1000, 129, 129
742, 1000, 144, 142
743, 1000, 151, 152
744, 1000, 144, 144
745, 1000, 163, 167
746, 1000, 138, 138
747, 1000, 127, 131
748, 1000, 166, 172
749, 1000, 144, 141
750, 1000, 121, 124
751, 1000, 167, 160
752, 1000, 167, 173
753, 1000, 136, 133
754, 1000, 150, 152
755, 1000, 157, 159
756, 1000, 153, 151
757, 1000, 111, 113
758, 1000, 146, 152
759, 1000, 122, 124
760, 1000, 138, 141
761, 1000, 131, 130
762, 1000, 138, 144
763, 1000, 137, 141
764, 1000, 130, 130
765, 1000, 131, 132
766, 1000, 131, 135
767, 1000, 130, 133
768, 1000, 125, 122
769, 1000, 144, 144
770, 1000, 143, 144
771, 1000, 154, 155
772, 1000, 165, 159
773, 1000, 155, 154
774, 1000, 143, 145
775, 1000, 133, 134
776, 1000, 142, 146
777, 1000, 143, 151
778, 1000, 122, 123
779, 1000, 146, 146
780, 1000, 138, 140
781, 1000, 130, 134
782, 1000, 134, 133
783, 1000, 126, 129
784, 1000, 131, 133
785, 1000, 139, 138
786, 1000, 114, 125
787, 1000, 135, 137
788, 1000, 134, 136
789, 1000, 131, 129
790, 1000, 130, 133
791, 1000, 144, 144
792, 1000, 133, 129
793, 1000, 149, 156
794, 1000, 144, 146
795, 1000, 140, 140
796, 1000, 134, 133
797, 1000, 134, 138
798, 1000, 142, 144
799, 1000, 146, 144
800, 1000, 137, 137
801, 1000, 131, 126
802, 1000, 141, 143
803, 1000, 132, 141
804, 1000, 143, 139
805, 1000, 152, 149
806, 1000, 135, 136
807, 1000, 156, 149
808, 1000, 139, 138
809, 1000, 139, 139
810, 1000, 145, 144
811, 1000, 137, 139
812, 1000, 142, 144
813, 1000, 133, 130
814, 1000, 123, 124
815, 1000, 131, 131
816, 1000, 144, 147
817, 1000, 151, 153
818, 1000, 131, 134
819, 1000, 134, 133
820, 1000, 133, 133
821, 1000, 137, 138
822, 1000, 127, 133
823, 1000, 137, 135
824, 1000, 132, 138
825, 1000, 132, 135
826, 1000, 133, 130
827, 1000, 136, 134
828, 1000, 145, 148
829, 1000, 130, 136
830, 1000, 146, 144
831, 1000, 128, 133
832, 1000, 113, 111
833, 1000, 122, 129
834, 1000, 140, 142
835, 1000, 125, 129
836, 1000, 123, 123
837, 1000, 146, 143
838, 1000, 143, 141
839, 1000, 162, 158
840, 1000, 154, 150
841, 1000, 151, 147
842, 1000, 158, 161
843, 1000, 122, 125
844, 1000, 141, 149
845, 1000, 130, 136
846, 1000, 146, 143
847, 1000, 134, 141
848, 1000, 155, 157
849, 1000, 137, 139
850, 1000, 146, 143
851, 1000, 152, 145
852, 1000, 150, 147
853, 1000, 127, 125
854, 1000, 152, 154
855, 1000, 156, 153
856, 1000, 129, 136
857, 1000, 148, 147
858, 1000, 136, 133
859, 1000, 118, 117
860, 1000, 143, 138
861, 1000, 133, 135
862, 1000, 135, 135
863, 1000, 118, 121
864, 1000, 147, 143
865, 1000, 143, 146
866, 1000, 149, 151
867, 1000, 132, 134
868, 1000, 168, 168
869, 1000, 124, 126
870, 1000, 161, 160
871, 1000, 112, 114
872, 1000, 120, 123
873, 1000, 142, 146
874, 1000, 132, 137
875, 1000, 117, 119
876, 1000, 132, 132
877, 1000, 122, 126
878, 1000, 145, 139
879, 1000, 127, 129
880, 1000, 152, 153
881, 1000, 121, 123
882, 1000, 134, 135
883, 1000, 114, 116
884, 1000, 132, 130
885, 1000, 115, 116
886, 1000, 140, 139
887, 1000, 161, 164
888, 1000, 133, 131
889, 1000, 156, 156
890, 1000, 121, 124
891, 1000, 144, 144
892, 1000, 132, 137
893, 1000, 129, 129
894, 1000, 137, 141
895, 1000, 141, 141
896, 1000, 126, 126
897, 1000, 131, 129
898, 1000, 140, 142
899, 1000, 139, 140
900, 1000, 154, 160
901, 1000, 161, 163
902, 1000, 133, 133
903, 1000, 137, 136
904, 1000, 114, 120
905, 1000, 151, 151
906, 1000, 132, 132
907, 1000, 140, 137
908, 1000, 132, 129
909, 1000, 145, 146
910, 1000, 145, 144
911, 1000, 132, 132
912, 1000, 120, 118
913, 1000, 138, 136
914, 1000, 155, 151
915, 1000, 147, 149
916, 1000, 153, 150
917, 1000, 133, 137
918, 1000, 139, 148
919, 1000, 152, 153
920, 1000, 146, 136
921, 1000, 145, 146
922, 1000, 151, 148
923, 1000, 142, 144
924, 1000, 127, 129
925, 1000, 139, 142
926, 1000, 109, 110
927, 1000, 159, 161
928, 1000, 129, 133
929, 1000, 141, 143
930, 1000, 135, 133
931, 1000, 129, 130
932, 1000, 124, 117
933, 1000, 142, 135
934, 1000, 146, 147
935, 1000, 136, 134
936, 1000, 137, 140
937, 1000, 165, 164
938, 1000, 116, 123
939, 1000, 133, 140
940, 1000, 137, 138
941, 1000, 126, 124
942, 1000, 144, 146
943, 1000, 117, 122
944, 1000, 150, 144
945, 1000, 136, 138
946, 1000, 133, 131
947, 1000, 152, 154
948, 1000, 130, 134
949, 1000, 134, 134
950, 1000, 148, 146
951, 1000, 132, 138
952, 1000, 131, 136
953, 1000, 151, 152
954, 1000, 124, 124
955, 1000, 118, 122
956, 1000, 135, 133
957, 1000, 148, 157
958, 1000, 121, 121
959, 1000, 129, 134
960, 1000, 150, 148
961, 1000, 136, 143
962, 1000, 173, 170
963, 1000, 129, 132
964, 1000, 151, 146
965, 1000, 126, 128
966, 1000, 109, 113
967, 1000, 119, 119
968, 1000, 134, 137
969, 1000, 144, 140
970, 1000, 134, 132
971, 1000, 151, 146
972, 1000, 136, 138
973, 1000, 157, 161
974, 1000, 146, 145
975, 1000, 145, 146
976, 1000, 131, 131
977, 1000, 139, 138
978, 1000, 136, 142
979, 1000, 158, 154
980, 1000, 146, 143
981, 1000, 128, 124
982, 1000, 136, 138
983, 1000, 125, 124
984, 1000, 138, 135
985, 1000, 143, 140
986, 1000, 143, 147
987, 1000, 126, 125
988, 1000, 140, 142
989, 1000, 142, 140
990, 1000, 145, 143
991, 1000, 148, 151
992, 1000, 129, 131
993, 1000, 126, 122
994, 1000, 157, 157
995, 1000, 153, 154
996, 1000, 136, 143
997, 1000, 139, 138
998, 1000, 139, 142
999, 1000, 135, 134
1000, 1000, 145, 148
1001, 500, 60, 59
1002, 500, 73, 72
1003, 500, 64, 62
1004, 500, 85, 83
1005, 500, 72, 72
1006, 500, 67, 69
1007, 500, 70, 73
1008, 500, 68, 65
1009, 500, 61, 62
1010, 500, 94, 90
1011, 500, 74, 73
1012, 500, 72, 70
1013, 500, 84, 83
1014, 500, 72, 71
1015, 500, 86, 85
1016, 500, 77, 77
1017, 500, 79, 80
1018, 500, 53, 56
1019, 500, 57, 60
1020, 500, 61, 60
1021, 500, 57, 55
1022, 500, 59, 60
1023, 500, 71, 72
1024, 500, 82, 76
1025, 500, 71, 71
1026, 500, 72, 75
1027, 500, 69, 72
1028, 500, 76, 75
1029, 500, 61, 62
1030, 500, 88, 88
1031, 500, 72, 73
1032, 500, 64, 60
1033, 500, 68, 67
1034, 500, 86, 87
1035, 500, 68, 70
1036, 500, 68, 68
1037, 500, 69, 66
1038, 500, 59, 61
1039, 500, 56, 58
1040, 500, 70, 67
1041, 500, 71, 69
1042, 500, 75, 75
1043, 500, 91, 89
1044, 500, 74, 74
1045, 500, 53, 53
1046, 500, 76, 73
1047, 500, 69, 69
1048, 500, 65, 63
1049, 500, 77, 77
1050, 500, 74, 75
1051, 500, 75, 76
1052, 500, 66, 62
1053, 500, 77, 75
1054, 500, 65, 65
1055, 500, 48, 51
1056, 500, 71, 70
1057, 500, 73, 73
1058, 500, 61, 64
1059, 500, 58, 58
1060, 500, 69, 66
1061, 500, 60, 62
1062, 500, 62, 59
1063, 500, 68, 69
1064, 500, 78, 76
1065, 500, 57, 57
1066, 500, 65, 66
1067, 500, 63, 65
1068, 500, 71, 68
1069, 500, 64, 66
1070, 500, 72, 72
1071, 500, 58, 60
1072, 500, 70, 71
1073, 500, 80, 79
1074, 500, 59, 62
1075, 500, 65, 72
1076, 500, 66, 68
1077, 500, 84, 86
1078, 500, 72, 72
1079, 500, 69, 69
1080, 500, 72, 74
1081, 500, 68, 65
1082, 500, 72, 75
1083, 500, 56, 57
1084, 500, 71, 69
1085, 500, 63, 63
1086, 500, 74, 75
1087, 500, 76, 74
1088, 500, 83, 80
1089, 500, 74, 74
1090, 500, 58, 60
1091, 500, 54, 55
1092, 500, 79, 79
1093, 500, 68, 72
1094, 500, 66, 65
1095, 500, 56, 55
1096, 500, 59, 59
1097, 500, 62, 64
1098, 500, 64, 67
1099, 500, 70, 69
1100, 500, 63, 61
1101, 500, 60, 62
1102, 500, 72, 72
1103, 500, 59, 58
1104, 500, 64, 63
1105, 500, 78, 71
1106, 500, 67, 66
1107, 500, 77, 79
1108, 500, 74, 79
1109, 500, 73, 77
1110, 500, 65, 69
1111, 500, 74, 74
1112, 500, 74, 72
1113, 500, 72, 68
1114, 500, 69, 70
1115, 500, 65, 65
1116, 500, 89, 87
1117, 500, 59, 61
1118, 500, 77, 78
1119, 500, 82, 83
1120, 500, 62, 63
1121, 500, 60, 65
1122, 500, 83, 82
1123, 500, 54, 52
1124, 500, 72, 73
1125, 500, 63, 63
1126, 500, 56, 55
1127, 500, 63, 62
1128, 500, 76, 78
1129, 500, 73, 72
1130, 500, 77, 76
1131, 500, 59, 59
1132, 500, 77, 75
1133, 500, 79, 81
1134, 500, 66, 66
1135, 500, 63, 61
1136, 500, 68, 65
1137, 500, 66, 66
1138, 500, 64, 63
1139, 500, 67, 72
1140, 500, 73, 73
1141, 500, 68, 74
1142, 500, 71, 73
1143, 500, 69, 69
1144, 500, 63, 64
1145, 500, 65, 66
1146, 500, 81, 81
1147, 500, 58, 59
1148, 500, 61, 64
1149, 500, 56, 59
1150, 500, 81, 79
1151, 500, 67, 68
1152, 500, 87, 89
1153, 500, 63, 63
1154, 500, 77, 76
1155, 500, 74, 75
1156, 500, 68, 72
1157, 500, 80, 86
1158, 500, 67, 70
1159, 500, 59, 64
1160, 500, 54, 57
1161, 500, 60, 60
1162, 500, 77, 83
1163, 500, 78, 81
1164, 500, 73, 74
1165, 500, 75, 77
1166, 500, 76, 75
1167, 500, 72, 75
1168, 500, 63, 67
1169, 500, 68, 72
1170, 500, 75, 75
1171, 500, 83, 79
1172, 500, 59, 59
1173, 500, 67, 64
1174, 500, 62, 59
1175, 500, 68, 71
1176, 500, 83, 87
1177, 500, 55, 53
1178, 500, 66, 66
1179, 500, 77, 75
1180, 500, 65, 68
1181, 500, 97, 98
1182, 500, 76, 73
1183, 500, 59, 57
1184, 500, 76, 71
1185, 500, 69, 70
1186, 500, 74, 75
1187, 500, 78, 78
1188, 500, 64, 67
1189, 500, 80, 78
1190, 500, 73, 73
1191, 500, 87, 86
1192, 500, 81, 82
1193, 500, 67, 70
1194, 500, 73, 74
1195, 500, 78, 81
1196, 500, 59, 63
1197, 500, 69, 67
1198, 500, 57, 57
1199, 500, 84, 84
1200, 500, 79, 78
1201, 500, 74, 77
1202, 500, 85, 81
1203, 500, 67, 69
1204, 500, 62, 64
1205, 500, 59, 58
1206, 500, 67, 66
1207, 500, 73, 70
1208, 500, 56, 55
1209, 500, 69, 68
1210, 500, 59, 59
1211, 500, 53, 52
1212, 500, 74, 73
1213, 500, 54, 56
1214, 500, 61, 63
1215, 500, 65, 68
1216, 500, 72, 68
1217, 500, 62, 64
1218, 500, 69, 69
1219, 500, 62, 63
1220, 500, 68, 69
1221, 500, 68, 66
1222, 500, 59, 62
1223, 500, 92, 94
1224, 500, 60, 64
1225, 500, 72, 73
1226, 500, 60, 59
1227, 500, 67, 65
1228, 500, 71, 74
1229, 500, 74, 74
1230, 500, 56, 54
1231, 500, 74, 73
1232, 500, 67, 67
1233, 500, 81, 81
1234, 500, 76, 78
1235, 500, 62, 61
1236, 500, 57, 55
1237, 500, 63, 63
1238, 500, 81, 81
1239, 500, 72, 76
1240, 500, 83, 78
1241, 500, 65, 69
1242, 500, 85, 81
1243, 500, 74, 75
1244, 500, 79, 78
1245, 500, 89, 90
1246, 500, 71, 74
1247, 500, 78, 77
1248, 500, 57, 58
1249, 500, 81, 80
1250, 500, 67, 68
1251, 500, 58, 57
1252, 500, 72, 72
1253, 500, 61, 65
1254, 500, 67, 65
1255, 500, 70, 68
1256, 500, 63, 63
1257, 500, 54, 53
1258, 500, 85, 83
1259, 500, 55, 56
1260, 500, 54, 50
1261, 500, 69, 75
1262, 500, 71, 71
1263, 500, 60, 59
1264, 500, 67, 67
1265, 500, 71, 72
1266, 500, 70, 71
1267, 500, 81, 86
1268, 500, 59, 63
1269, 500, 67, 71
1270, 500, 69, 68
1271, 500, 65, 66
1272, 500, 75, 75
1273, 500, 68, 69
1274, 500, 57, 57
1275, 500, 67, 63
1276, 500, 74, 79
1277, 500, 75, 76
1278, 500, 66, 63
1279, 500, 70, 64
1280, 500, 63, 62
1281, 500, 71, 72
1282, 500, 58, 59
1283, 500, 63, 71
1284, 500, 77, 81
1285, 500, 58, 60
1286, 500, 61, 64
1287, 500, 74, 76
1288, 500, 59, 61
1289, 500, 67, 68
1290, 500, 54, 56
1291, 500, 55, 55
1292, 500, 79, 76
1293, 500, 71, 68
1294, 500, 69, 70
1295, 500, 74, 75
1296, 500, 70, 71
1297, 500, 72, 73
1298, 500, 78, 74
1299, 500, 75, 73
1300, 500, 73, 71
1301, 500, 76, 79
1302, 500, 69, 68
1303, 500, 63, 61
1304, 500, 58, 58
1305, 500, 59, 62
1306, 500, 76, 79
1307, 500, 59, 57
1308, 500, 60, 59
1309, 500, 63, 63
1310, 500, 65, 66
1311, 500, 69, 66
1312, 500, 76, 75
1313, 500, 73, 73
1314, 500, 91, 88
1315, 500, 78, 77
1316, 500, 70, 71
1317, 500, 77, 77
1318, 500, 65, 64
1319, 500, 85, 80
1320, 500, 85, 86
1321, 500, 69, 70
1322, 500, 66, 68
1323, 500, 70, 70
1324, 500, 60, 60
1325, 500, 80, 83
1326, 500, 65, 66
1327, 500, 71, 75
1328, 500, 72, 73
1329, 500, 71, 70
1330, 500, 52, 53
1331, 500, 54, 54
1332, 500, 67, 70
1333, 500, 72, 72
1334, 500, 68, 69
1335, 500, 75, 74
1336, 500, 50, 49
1337, 500, 67, 66
1338, 500, 77, 80
1339, 500, 70, 71
1340, 500, 66, 64
1341, 500, 75, 77
1342, 500, 63, 64
1343, 500, 70, 70
1344, 500, 56, 57
1345, 500, 85, 86
1346, 500, 59, 60
1347, 500, 75, 78
1348, 500, 93, 96
1349, 500, 63, 63
1350, 500, 70, 73
1351, 500, 69, 63
1352, 500, 75, 75
1353, 500, 66, 67
1354, 500, 81, 82
1355, 500, 78, 76
1356, 500, 69, 67
1357, 500, 57, 58
1358, 500, 73, 74
1359, 500, 60, 62
1360, 500, 57, 55
1361, 500, 62, 63
1362, 500, 77, 77
1363, 500, 64, 63
1364, 500, 78, 78
1365, 500, 69, 69
1366, 500, 74, 73
1367, 500, 70, 67
1368, 500, 68, 69
1369, 500, 71, 66
1370, 500, 56, 57
1371, 500, 71, 65
1372, 500, 64, 64
1373, 500, 76, 73
1374, 500, 69, 72
1375, 500, 56, 56
1376, 500, 63, 60
1377, 500, 75, 73
1378, 500, 70, 72
1379, 500, 77, 76
1380, 500, 88, 87
1381, 500, 67, 68
1382, 500, 86, 86
1383, 500, 71, 70
1384, 500, 70, 68
1385, 500, 64, 62
1386, 500, 78, 76
1387, 500, 57, 57
1388, 500, 76, 73
1389, 500, 67, 66
1390, 500, 91, 87
1391, 500, 97, 97
1392, 500, 59, 59
1393, 500, 63, 63
1394, 500, 73, 68
1395, 500, 63, 63
1396, 500, 60, 60
1397, 500, 83, 84
1398, 500, 80, 74
1399, 500, 71, 71
1400, 500, 63, 65
1401, 500, 65, 65
1402, 500, 68, 66
1403, 500, 67, 66
1404, 500, 72, 73
1405, 500, 67, 66
1406, 500, 64, 62
1407, 500, 82, 81
1408, 500, 74, 69
1409, 500, 90, 86
1410, 500, 67, 70
1411, 500, 78, 80
1412, 500, 86, 76
1413, 500, 61, 64
1414, 500, 62, 65
1415, 500, 73, 69
1416, 500, 65, 66
1417, 500, 62, 60
1418, 500, 82, 81
1419, 500, 67, 67
1420, 500, 73, 68
1421, 500, 64, 64
1422, 500, 53, 54
1423, 500, 67, 68
1424, 500, 57, 58
1425, 500, 55, 56
1426, 500, 79, 81
1427, 500, 67, 72
1428, 500, 75, 76
1429, 500, 67, 64
1430, 500, 64, 64
1431, 500, 67, 62
1432, 500, 77, 74
1433, 500, 66, 66
1434, 500, 52, 53
1435, 500, 77, 76
1436, 500, 78, 82
1437, 500, 76, 78
1438, 500, 70, 68
1439, 500, 67, 68
1440, 500, 60, 57
1441, 500, 69, 70
1442, 500, 73, 68
1443, 500, 80, 81
1444, 500, 59, 60
1445, 500, 75, 74
1446, 500, 75, 75
1447, 500, 68, 69
1448, 500, 64, 66
1449, 500, 63, 63
1450, 500, 50, 51
1451, 500, 65, 63
1452, 500, 63, 63
1453, 500, 61, 67
1454, 500, 80, 79
1455, 500, 57, 56
1456, 500, 71, 66
1457, 500, 79, 80
1458, 500, 79, 80
1459, 500, 60, 61
1460, 500, 69, 63
1461, 500, 62, 59
1462, 500, 69, 72
1463, 500, 70, 74
1464, 500, 84, 81
1465, 500, 52, 51
1466, 500, 65, 64
1467, 500, 79, 75
1468, 500, 57, 57
1469, 500, 62, 67
1470, 500, 82, 83
1471, 500, 72, 71
1472, 500, 58, 57
1473, 500, 70, 71
1474, 500, 75, 78
1475, 500, 82, 77
1476, 500, 68, 68
1477, 500, 58, 57
1478, 500, 66, 68
1479, 500, 73, 74
1480, 500, 68, 68
1481, 500, 60, 62
1482, 500, 54, 59
1483, 500, 60, 62
1484, 500, 72, 71
1485, 500, 58, 56
1486, 500, 81, 82
1487, 500, 86, 87
1488, 500, 75, 71
1489, 500, 70, 70
1490, 500, 64, 62
1491, 500, 66, 62
1492, 500, 58, 59
1493, 500, 66, 67
1494, 500, 61, 60
1495, 500, 75, 80
1496, 500, 64, 68
1497, 500, 77, 75
1498, 500, 62, 62
1499, 500, 67, 60
1500, 500, 70, 73
1501, 500, 71, 69
1502, 500, 66, 68
1503, 500, 82, 79
1504, 500, 69, 72
1505, 500, 75, 73
1506, 500, 86, 83
1507, 500, 73, 74
1508, 500, 80, 78
1509, 500, 65, 65
1510, 500, 80, 79
1511, 500, 64, 66
1512, 500, 72, 71
1513, 500, 79, 79
1514, 500, 76, 77
1515, 500, 66, 69
1516, 500, 60, 59
1517, 500, 71, 72
1518, 500, 65, 67
1519, 500, 82, 81
1520, 500, 75, 69
1521, 500, 74, 76
1522, 500, 85, 83
1523, 500, 70, 70
1524, 500, 72, 74
1525, 500, 63, 63
1526, 500, 81, 81
1527, 500, 63, 64
1528, 500, 58, 60
1529, 500, 80, 81
1530, 500, 72, 71
1531, 500, 57, 59
1532, 500, 75, 73
1533, 500, 70, 70
1534, 500, 67, 70
1535, 500, 70, 72
1536, 500, 66, 62
1537, 500, 81, 82
1538, 500, 69, 73
1539, 500, 71, 72
1540, 500, 60, 59
1541, 500, 64, 64
1542, 500, 69, 70
1543, 500, 74, 74
1544, 500, 64, 66
1545, 500, 70, 68
1546, 500, 73, 77
1547, 500, 67, 67
1548, 500, 76, 72
1549, 500, 70, 70
1550, 500, 68, 69
1551, 500, 68, 67
1552, 500, 67, 66
1553, 500, 57, 53
1554, 500, 68, 64
1555, 500, 71, 70
1556, 500, 70, 70
1557, 500, 70, 70
1558, 500, 51, 48
1559, 500, 59, 59
1560, 500, 63, 67
1561, 500, 62, 63
1562, 500, 59, 56
1563, 500, 67, 67
1564, 500, 68, 66
1565, 500, 60, 57
1566, 500, 81, 79
1567, 500, 70, 70
1568, 500, 77, 74
1569, 500, 62, 64
1570, 500, 64, 65
1571, 500, 76, 77
1572, 500, 54, 53
1573, 500, 61, 60
1574, 500, 60, 64
1575, 500, 62, 61
1576, 500, 70, 64
1577, 500, 58, 61
1578, 500, 67, 66
1579, 500, 69, 65
1580, 500, 83, 80
1581, 500, 74, 72
1582, 500, 86, 84
1583, 500, 72, 76
1584, 500, 75, 77
1585, 500, 77, 74
1586, 500, 62, 64
1587, 500, 64, 69
1588, 500, 61, 64
1589, 500, 73, 71
1590, 500, 88, 89
1591, 500, 69, 69
1592, 500, 79, 77
1593, 500, 66, 66
1594, 500, 69, 64
1595, 500, 67, 68
1596, 500, 66, 70
1597, 500, 66, 73
1598, 500, 69, 68
1599, 500, 72, 74
1600, 500, 80, 81
1601, 500, 70, 69
1602, 500, 74, 72
1603, 500, 66, 71
1604, 500, 51, 56
1605, 500, 68, 68
1606, 500, 81, 79
1607, 500, 62, 63
1608, 500, 77, 78
1609, 500, 72, 71
1610, 500, 93, 89
1611, 500, 66, 68
1612, 500, 86, 82
1613, 500, 65, 63
1614, 500, 64, 64
1615, 500, 75, 75
1616, 500, 48, 47
1617, 500, 78, 74
1618, 500, 70, 68
1619, 500, 58, 58
1620, 500, 78, 77
1621, 500, 72, 76
1622, 500, 82, 81
1623, 500, 66, 69
1624, 500, 59, 62
1625, 500, 51, 52
1626, 500, 68, 65
1627, 500, 61, 62
1628, 500, 61, 59
1629, 500, 57, 55
1630, 500, 76, 78
1631, 500, 78, 77
1632, 500, 61, 64
1633, 500, 64, 63
1634, 500, 67, 71
1635, 500, 64, 64
1636, 500, 74, 70
1637, 500, 79, 78
1638, 500, 60, 60
1639, 500, 61, 60
1640, 500, 58, 56
1641, 500, 64, 67
1642, 500, 71, 77
1643, 500, 85, 85
1644, 500, 63, 63
1645, 500, 65, 66
1646, 500, 77, 74
1647, 500, 64, 67
1648, 500, 66, 67
1649, 500, 60, 59
1650, 500, 54, 52
1651, 500, 60, 61
1652, 500, 62, 62
1653, 500, 84, 85
1654, 500, 68, 70
1655, 500, 74, 75
1656, 500, 68, 65
1657, 500, 69, 70
1658, 500, 64, 62
1659, 500, 70, 71
1660, 500, 51, 52
1661, 500, 83, 83
1662, 500, 64, 66
1663, 500, 67, 68
1664, 500, 61, 57
1665, 500, 70, 66
1666, 500, 73, 70
1667, 500, 52, 53
1668, 500, 65, 67
1669, 500, 60, 62
1670, 500, 60, 62
1671, 500, 75, 77
1672, 500, 76, 74
1673, 500, 69, 68
1674, 500, 70, 79
1675, 500, 66, 64
1676, 500, 62, 66
1677, 500, 72, 75
1678, 500, 59, 59
1679, 500, 60, 59
1680, 500, 55, 57
1681, 500, 71, 74
1682, 500, 79, 74
1683, 500, 68, 67
1684, 500, 66, 65
1685, 500, 66, 68
1686, 500, 67, 64
1687, 500, 53, 54
1688, 500, 60, 59
1689, 500, 60, 61
1690, 500, 68, 68
1691, 500, 62, 61
1692, 500, 60, 60
1693, 500, 64, 67
1694, 500, 81, 77
1695, 500, 70, 71
1696, 500, 71, 73
1697, 500, 74, 75
1698, 500, 64, 65
1699, 500, 58, 61
1700, 500, 70, 75
1701, 500, 72, 71
1702, 500, 68, 72
1703, 500, 79, 73
1704, 500, 82, 78
1705, 500, 75, 73
1706, 500, 66, 67
1707, 500, 63, 61
1708, 500, 67, 63
1709, 500, 57, 61
1710, 500, 73, 72
1711, 500, 73, 71
1712, 500, 72, 71
1713, 500, 73, 72
1714, 500, 73, 74
1715, 500, 69, 76
1716, 500, 62, 63
1717, 500, 79, 78
1718, 500, 68, 66
1719, 500, 58, 60
1720, 500, 86, 87
1721, 500, 66, 71
1722, 500, 55, 57
1723, 500, 71, 70
1724, 500, 75, 76
1725, 500, 72, 73
1726, 500, 74, 80
1727, 500, 73, 78
1728, 500, 71, 70
1729, 500, 60, 62
1730, 500, 66, 65
1731, 500, 67, 68
1732, 500, 85, 84
1733, 500, 63, 61
1734, 500, 66, 68
1735, 500, 70, 71
1736, 500, 71, 73
1737, 500, 65, 64
1738, 500, 70, 68
1739, 500, 55, 55
1740, 500, 62, 63
1741, 500, 73, 74
1742, 500, 60, 61
1743, 500, 65, 65
1744, 500, 79, 77
1745, 500, 81, 82
1746, 500, 68, 69
1747, 500, 73, 74
1748, 500, 50, 49
1749, 500, 53, 54
1750, 500, 61, 60
1751, 500, 73, 73
1752, 500, 92, 90
1753, 500, 66, 64
1754, 500, 71, 75
1755, 500, 66, 67
1756, 500, 68, 65
1757, 500, 72, 71
1758, 500, 70, 71
1759, 500, 60, 60
1760, 500, 77, 76
1761, 500, 71, 73
1762, 500, 83, 82
1763, 500, 69, 65
1764, 500, 54, 53
1765, 500, 54, 55
1766, 500, 86, 84
1767, 500, 68, 71
1768, 500, 72, 72
1769, 500, 66, 68
1770, 500, 88, 86
1771, 500, 67, 65
1772, 500, 69, 71
1773, 500, 70, 69
1774, 500, 69, 67
1775, 500, 60, 61
1776, 500, 72, 73
1777, 500, 68, 62
1778, 500, 86, 81
1779, 500, 78, 74
1780, 500, 69, 67
1781, 500, 71, 71
1782, 500, 87, 83
1783, 500, 55, 58
1784, 500, 78, 78
1785, 500, 65, 71
1786, 500, 78, 74
1787, 500, 71, 73
1788, 500, 64, 60
1789, 500, 84, 81
1790, 500, 68, 67
1791, 500, 68, 70
1792, 500, 64, 66
1793, 500, 74, 69
1794, 500, 72, 73
1795, 500, 89, 86
1796, 500, 60, 62
1797, 500, 54, 55
1798, 500, 62, 58
1799, 500, 83, 80
1800, 500, 70, 73
1801, 500, 77, 80
1802, 500, 66, 65
1803, 500, 85, 83
1804, 500, 55, 57
1805, 500, 74, 75
1806, 500, 65, 71
1807, 500, 85, 85
1808, 500, 43, 50
1809, 500, 73, 72
1810, 500, 81, 82
1811, 500, 74, 74
1812, 500, 66, 69
1813, 500, 73, 73
1814, 500, 66, 63
1815, 500, 72, 72
1816, 500, 57, 59
1817, 500, 83, 83
1818, 500, 49, 48
1819, 500, 63, 61
1820, 500, 63, 61
1821, 500, 65, 69
1822, 500, 75, 73
1823, 500, 73, 72
1824, 500, 55, 53
1825, 500, 71, 72
1826, 500, 56, 58
1827, 500, 89, 89
1828, 500, 64, 64
1829, 500, 67, 66
1830, 500, 78, 80
1831, 500, 74, 73
1832, 500, 59, 57
1833, 500, 75, 75
1834, 500, 65, 64
1835, 500, 55, 56
1836, 500, 60, 63
1837, 500, 74, 74
1838, 500, 61, 63
1839, 500, 73, 70
1840, 500, 62, 59
1841, 500, 56, 55
1842, 500, 72, 74
1843, 500, 76, 79
1844, 500, 61, 64
1845, 500, 60, 61
1846, 500, 84, 83
1847, 500, 74, 74
1848, 500, 69, 71
1849, 500, 70, 64
1850, 500, 85, 91
1851, 500, 71, 73
1852, 500, 54, 52
1853, 500, 61, 61
1854, 500, 66, 66
1855, 500, 74, 72
1856, 500, 51, 51
1857, 500, 70, 67
1858, 500, 68, 65
1859, 500, 79, 80
1860, 500, 57, 56
1861, 500, 66, 66
1862, 500, 66, 67
1863, 500, 60, 60
1864, 500, 54, 54
1865, 500, 64, 63
1866, 500, 67, 66
1867, 500, 76, 73
1868, 500, 61, 63
1869, 500, 64, 68
1870, 500, 71, 75
1871, 500, 66, 70
1872, 500, 62, 62
1873, 500, 68, 70
1874, 500, 67, 67
1875, 500, 63, 67
1876, 500, 49, 51
1877, 500, 65, 62
1878, 500, 56, 56
1879, 500, 85, 86
1880, 500, 75, 76
1881, 500, 63, 59
1882, 500, 71, 70
1883, 500, 66, 67
1884, 500, 68, 70
1885, 500, 65, 62
1886, 500, 59, 60
1887, 500, 71, 71
1888, 500, 65, 66
1889, 500, 73, 77
1890, 500, 65, 66
1891, 500, 68, 70
1892, 500, 79, 75
1893, 500, 67, 66
1894, 500, 72, 73
1895, 500, 72, 64
1896, 500, 51, 51
1897, 500, 80, 79
1898, 500, 79, 76
1899, 500, 64, 63
1900, 500, 63, 62
1901, 500, 73, 72
1902, 500, 67, 71
1903, 500, 66, 68
1904, 500, 73, 71
1905, 500, 72, 69
1906, 500, 74, 78
1907, 500, 78, 74
1908, 500, 61, 59
1909, 500, 64, 63
1910, 500, 70, 68
1911, 500, 75, 76
1912, 500, 66, 63
1913, 500, 60, 58
1914, 500, 90, 90
1915, 500, 68, 69
1916, 500, 69, 71
1917, 500, 70, 70
1918, 500, 57, 56
1919, 500, 66, 70
1920, 500, 91, 87
1921, 500, 64, 68
1922, 500, 70, 68
1923, 500, 89, 91
1924, 500, 69, 69
1925, 500, 49, 49
1926, 500, 65, 65
1927, 500, 69, 68
1928, 500, 86, 91
1929, 500, 81, 81
1930, 500, 65, 61
1931, 500, 75, 81
1932, 500, 75, 71
1933, 500, 74, 69
1934, 500, 64, 63
1935, 500, 78, 78
1936, 500, 57, 60
1937, 500, 68, 64
1938, 500, 75, 78
1939, 500, 54, 59
1940, 500, 79, 75
1941, 500, 70, 69
1942, 500, 62, 63
1943, 500, 73, 72
1944, 500, 78, 78
1945, 500, 64, 64
1946, 500, 75, 73
1947, 500, 66, 64
1948, 500, 63, 63
1949, 500, 60, 63
1950, 500, 77, 74
1951, 500, 68, 66
1952, 500, 77, 72
1953, 500, 67, 65
1954, 500, 55, 56
1955, 500, 79, 79
1956, 500, 61, 62
1957, 500, 73, 68
1958, 500, 71, 71
1959, 500, 70, 70
1960, 500, 67, 69
1961, 500, 66, 63
1962, 500, 66, 64
1963, 500, 64, 65
1964, 500, 74, 71
1965, 500, 63, 64
1966, 500, 67, 66
1967, 500, 64, 66
1968, 500, 53, 55
1969, 500, 62, 60
1970, 500, 64, 67
1971, 500, 55, 55
1972, 500, 76, 75
1973, 500, 63, 64
1974, 500, 64, 63
1975, 500, 79, 76
1976, 500, 78, 81
1977, 500, 76, 77
1978, 500, 74, 69
1979, 500, 70, 68
1980, 500, 81, 82
1981, 500, 74, 75
1982, 500, 65, 71
1983, 500, 73, 70
1984, 500, 57, 63
1985, 500, 72, 74
1986, 500, 65, 68
1987, 500, 86, 82
1988, 500, 76, 76
1989, 500, 64, 65
1990, 500, 65, 69
1991, 500, 64, 60
1992, 500, 63, 64
1993, 500, 62, 64
1994, 500, 61, 63
1995, 500, 58, 56
1996, 500, 76, 76
1997, 500, 60, 64
1998, 500, 67, 70
1999, 500, 75, 77
2000, 500, 82, 81
2001, 250, 27, 28
2002, 250, 30, 31
2003, 250, 41, 39
2004, 250, 33, 31
2005, 250, 30, 30
2006, 250, 49, 47
2007, 250, 45, 43
2008, 250, 50, 46
2009, 250, 44, 46
2010, 250, 38, 38
2011, 250, 45, 43
2012, 250, 29, 28
2013, 250, 31, 29
2014, 250, 36, 36
2015, 250, 35, 33
2016, 250, 29, 31
2017, 250, 27, 29
2018, 250, 39, 36
2019, 250, 30, 30
2020, 250, 36, 35
2021, 250, 37, 38
2022, 250, 37, 34
2023, 250, 32, 35
2024, 250, 52, 50
2025, 250, 34, 34
2026, 250, 22, 24
2027, 250, 44, 42
2028, 250, 34, 33
2029, 250, 37, 39
2030, 250, 35, 36
2031, 250, 34, 33
2032, 250, 33, 36
2033, 250, 34, 34
2034, 250, 28, 28
2035, 250, 47, 48
2036, 250, 44, 45
2037, 250, 56, 53
2038, 250, 45, 45
2039, 250, 40, 37
2040, 250, 23, 25
2041, 250, 34, 30
2042, 250, 35, 35
2043, 250, 39, 38
2044, 250, 35, 34
2045, 250, 35, 36
2046, 250, 17, 18
2047, 250, 40, 41
2048, 250, 35, 35
2049, 250, 46, 44
2050, 250, 25, 26
2051, 250, 28, 29
2052, 250, 37, 37
2053, 250, 34, 36
2054, 250, 43, 40
2055, 250, 34, 33
2056, 250, 44, 44
2057, 250, 36, 35
2058, 250, 38, 37
2059, 250, 29, 28
2060, 250, 32, 32
2061, 250, 30, 26
2062, 250, 46, 45
2063, 250, 24, 25
2064, 250, 31, 34
2065, 250, 28, 28
2066, 250, 43, 39
2067, 250, 36, 35
2068, 250, 43, 40
2069, 250, 29, 28
2070, 250, 28, 26
2071, 250, 37, 36
2072, 250, 43, 41
2073, 250, 35, 35
2074, 250, 41, 38
2075, 250, 43, 42
2076, 250, 24, 24
2077, 250, 31, 31
2078, 250, 36, 34
2079, 250, 45, 45
2080, 250, 43, 42
2081, 250, 41, 43
2082, 250, 35, 35
2083, 250, 38, 40
2084, 250, 38, 38
2085, 250, 48, 46
2086, 250, 39, 41
2087, 250, 23, 24
2088, 250, 36, 35
2089, 250, 30, 32
2090, 250, 38, 38
2091, 250, 30, 31
2092, 250, 33, 31
2093, 250, 38, 36
2094, 250, 30, 28
2095, 250, 35, 37
2096, 250, 33, 32
2097, 250, 38, 38
2098, 250, 31, 35
2099, 250, 35, 33
2100, 250, 38, 40
2101, 250, 43, 41
2102, 250, 40, 40
2103, 250, 31, 31
2104, 250, 49, 45
2105, 250, 48, 46
2106, 250, 28, 28
2107, 250, 31, 31
2108, 250, 30, 29
2109, 250, 34, 32
2110, 250, 32, 35
2111, 250, 45, 45
2112, 250, 37, 36
2113, 250, 37, 38
2114, 250, 32, 30
2115, 250, 25, 26
2116, 250, 41, 38
2117, 250, 45, 43
2118, 250, 23, 26
2119, 250, 36, 35
2120, 250, 41, 42
2121, 250, 31, 31
2122, 250, 29, 29
2123, 250, 33, 32
2124, 250, 41, 38
2125, 250, 40, 40
2126, 250, 33, 34
2127, 250, 42, 44
2128, 250, 40, 41
2129, 250, 40, 38
2130, 250, 41, 40
2131, 250, 28, 29
2132, 250, 43, 43
2133, 250, 34, 36
2134, 250, 34, 34
2135, 250, 45, 43
2136, 250, 32, 31
2137, 250, 28, 28
2138, 250, 50, 47
2139, 250, 41, 40
2140, 250, 40, 43
2141, 250, 41, 43
2142, 250, 46, 47
2143, 250, 40, 38
2144, 250, 41, 43
2145, 250, 34, 32
2146, 250, 35, 32
2147, 250, 40, 37
2148, 250, 35, 34
2149, 250, 26, 27
2150, 250, 33, 33
2151, 250, 25, 26
2152, 250, 25, 27
2153, 250, 34, 34
2154, 250, 36, 34
2155, 250, 33, 35
2156, 250, 34, 35
2157, 250, 40, 41
2158, 250, 31, 32
2159, 250, 37, 39
2160, 250, 23, 23
2161, 250, 36, 35
2162, 250, 28, 28
2163, 250, 35, 37
2164, 250, 33, 33
2165, 250, 32, 28
2166, 250, 37, 38
2167, 250, 33, 32
2168, 250, 40, 41
2169, 250, 33, 32
2170, 250, 38, 38
2171, 250, 40, 35
2172, 250, 35, 40
2173, 250, 35, 35
2174, 250, 32, 31
2175, 250, 31, 32
2176, 250, 31, 32
2177, 250, 44, 44
2178, 250, 25, 25
2179, 250, 32, 33
2180, 250, 32, 30
2181, 250, 30, 30
2182, 250, 35, 33
2183, 250, 33, 30
2184, 250, 37, 35
2185, 250, 43, 40
2186, 250, 45, 43
2187, 250, 29, 28
2188, 250, 30, 30
2189, 250, 49, 48
2190, 250, 33, 33
2191, 250, 42, 42
2192, 250, 26, 28
2193, 250, 46, 45
2194, 250, 31, 31
2195, 250, 29, 26
2196, 250, 48, 46
2197, 250, 27, 26
2198, 250, 33, 32
2199, 250, 38, 39
2200, 250, 32, 31
2201, 250, 44, 45
2202, 250, 44, 40
2203, 250, 43, 43
2204, 250, 27, 28
2205, 250, 32, 29
2206, 250, 32, 30
2207, 250, 41, 44
2208, 250, 41, 42
2209, 250, 30, 30
2210, 250, 37, 35
2211, 250, 41, 40
2212, 250, 26, 25
2213, 250, 39, 39
2214, 250, 21, 22
2215, 250, 34, 34
2216, 250, 44, 43
2217, 250, 26, 27
2218, 250, 30, 31
2219, 250, 40, 39
2220, 250, 37, 38
2221, 250, 36, 35
2222, 250, 29, 32
2223, 250, 38, 39
2224, 250, 28, 26
2225, 250, 37, 40
2226, 250, 34, 33
2227, 250, 41, 43
2228, 250, 41, 44
2229, 250, 25, 27
2230, 250, 38, 40
2231, 250, 30, 30
2232, 250, 26, 26
2233, 250, 35, 31
2234, 250, 30, 30
2235, 250, 33, 33
2236, 250, 41, 41
2237, 250, 37, 36
2238, 250, 32, 32
2239, 250, 34, 34
2240, 250, 42, 44
2241, 250, 28, 28
2242, 250, 37, 40
2243, 250, 33, 32
2244, 250, 38, 37
2245, 250, 39, 39
2246, 250, 44, 44
2247, 250, 35, 35
2248, 250, 20, 20
2249, 250, 31, 32
2250, 250, 38, 38
2251, 250, 31, 31
2252, 250, 35, 37
2253, 250, 43, 46
2254, 250, 28, 27
2255, 250, 44, 43
2256, 250, 43, 41
2257, 250, 36, 36
2258, 250, 32, 33
2259, 250, 41, 38
2260, 250, 39, 39
2261, 250, 28, 28
2262, 250, 42, 43
2263, 250, 33, 33
2264, 250, 37, 33
2265, 250, 40, 40
2266, 250, 22, 23
2267, 250, 49, 48
2268, 250, 45, 46
2269, 250, 39, 37
2270, 250, 33, 33
2271, 250, 30, 30
2272, 250, 41, 38
2273, 250, 35, 35
2274, 250, 31, 30
2275, 250, 36, 32
2276, 250, 33, 30
2277, 250, 34, 32
2278, 250, 46, 46
2279, 250, 35, 32
2280, 250, 38, 34
2281, 250, 37, 38
2282, 250, 44, 44
2283, 250, 41, 41
2284, 250, 39, 42
2285, 250, 21, 22
2286, 250, 31, 29
2287, 250, 33, 32
2288, 250, 35, 36
2289, 250, 33, 31
2290, 250, 37, 37
2291, 250, 42, 41
2292, 250, 32, 33
2293, 250, 34, 35
2294, 250, 29, 28
2295, 250, 31, 30
2296, 250, 34, 35
2297, 250, 34, 35
2298, 250, 25, 25
2299, 250, 40, 41
2300, 250, 29, 26
2301, 250, 43, 40
2302, 250, 38, 37
2303, 250, 27, 26
2304, 250, 47, 46
2305, 250, 39, 36
2306, 250, 49, 46
2307, 250, 24, 23
2308, 250, 28, 29
2309, 250, 35, 34
2310, 250, 29, 29
2311, 250, 34, 37
2312, 250, 29, 28
2313, 250, 28, 27
2314, 250, 35, 34
2315, 250, 39, 39
2316, 250, 38, 39
2317, 250, 33, 34
2318, 250, 39, 38
2319, 250, 32, 32
2320, 250, 33, 34
2321, 250, 28, 25
2322, 250, 31, 33
2323, 250, 35, 36
2324, 250, 35, 37
2325, 250, 33, 34
2326, 250, 38, 37
2327, 250, 26, 26
2328, 250, 32, 34
2329, 250, 26, 26
2330, 250, 37, 36
2331, 250, 38, 39
2332, 250, 37, 38
2333, 250, 25, 25
2334, 250, 42, 43
2335, 250, 39, 38
2336, 250, 33, 32
2337, 250, 26, 25
2338, 250, 50, 48
2339, 250, 34, 34
2340, 250, 39, 38
2341, 250, 29, 30
2342, 250, 43, 40
2343, 250, 38, 40
2344, 250, 32, 32
2345, 250, 30, 31
2346, 250, 44, 45
2347, 250, 31, 35
2348, 250, 30, 31
2349, 250, 46, 45
2350, 250, 30, 32
2351, 250, 30, 30
2352, 250, 37, 38
2353, 250, 27, 28
2354, 250, 42, 40
2355, 250, 36, 36
2356, 250, 35, 36
2357, 250, 34, 35
2358, 250, 40, 38
2359, 250, 42, 41
2360, 250, 39, 36
2361, 250, 27, 28
2362, 250, 40, 41
2363, 250, 42, 40
2364, 250, 18, 18
2365, 250, 24, 23
2366, 250, 40, 42
2367, 250, 30, 30
2368, 250, 41, 40
2369, 250, 43, 46
2370, 250, 33, 34
2371, 250, 34, 34
2372, 250, 43, 44
2373, 250, 33, 33
2374, 250, 40, 38
2375, 250, 26, 25
2376, 250, 31, 33
2377, 250, 36, 36
2378, 250, 40, 41
2379, 250, 32, 31
2380, 250, 39, 40
2381, 250, 47, 46
2382, 250, 37, 36
2383, 250, 29, 29
2384, 250, 26, 26
2385, 250, 47, 43
2386, 250, 34, 35
2387, 250, 35, 34
2388, 250, 40, 38
2389, 250, 34, 34
2390, 250, 34, 33
2391, 250, 28, 29
2392, 250, 38, 38
2393, 250, 35, 35
2394, 250, 37, 39
2395, 250, 32, 32
2396, 250, 32, 34
2397, 250, 41, 37
2398, 250, 26, 27
2399, 250, 60, 62
2400, 250, 28, 27
2401, 250, 33, 32
2402, 250, 34, 32
2403, 250, 33, 33
2404, 250, 46, 44
2405, 250, 41, 38
2406, 250, 37, 37
2407, 250, 35, 37
2408, 250, 35, 36
2409, 250, 34, 32
2410, 250, 36, 36
2411, 250, 26, 27
2412, 250, 16, 16
2413, 250, 51, 51
2414, 250, 25, 27
2415, 250, 38, 38
2416, 250, 27, 25
2417, 250, 31, 32
2418, 250, 36, 34
2419, 250, 32, 31
2420, 250, 29, 29
2421, 250, 38, 37
2422, 250, 30, 31
2423, 250, 22, 23
2424, 250, 30, 29
2425, 250, 36, 36
2426, 250, 27, 26
2427, 250, 37, 35
2428, 250, 31, 30
2429, 250, 34, 35
2430, 250, 40, 39
2431, 250, 32, 32
2432, 250, 36, 36
2433, 250, 34, 33
2434, 250, 42, 40
2435, 250, 45, 44
2436, 250, 34, 35
2437, 250, 34, 34
2438, 250, 28, 28
2439, 250, 26, 28
2440, 250, 36, 34
2441, 250, 36, 36
2442, 250, 38, 37
2443, 250, 26, 26
2444, 250, 35, 33
2445, 250, 38, 38
2446, 250, 50, 48
2447, 250, 30, 33
2448, 250, 19, 21
2449, 250, 23, 25
2450, 250, 37, 37
2451, 250, 32, 35
2452, 250, 36, 35
2453, 250, 33, 33
2454, 250, 42, 41
2455, 250, 39, 39
2456, 250, 33, 33
2457, 250, 37, 37
2458, 250, 28, 28
2459, 250, 51, 51
2460, 250, 41, 39
2461, 250, 34, 36
2462, 250, 38, 40
2463, 250, 39, 41
2464, 250, 29, 29
2465, 250, 31, 31
2466, 250, 38, 37
2467, 250, 29, 31
2468, 250, 30, 30
2469, 250, 32, 31
2470, 250, 29, 30
2471, 250, 32, 33
2472, 250, 33, 31
2473, 250, 33, 31
2474, 250, 30, 30
2475, 250, 34, 33
2476, 250, 21, 22
2477, 250, 35, 36
2478, 250, 29, 28
2479, 250, 42, 38
2480, 250, 36, 36
2481, 250, 34, 34
2482, 250, 36, 36
2483, 250, 37, 40
2484, 250, 41, 41
2485, 250, 41, 40
2486, 250, 42, 38
2487, 250, 34, 33
2488, 250, 39, 39
2489, 250, 35, 35
2490, 250, 29, 29
2491, 250, 34, 32
2492, 250, 33, 38
2493, 250, 37, 37
2494, 250, 43, 42
2495, 250, 33, 33
2496, 250, 22, 24
2497, 250, 32, 29
2498, 250, 34, 33
2499, 250, 41, 39
2500, 250, 37, 35
2501, 250, 31, 32
2502, 250, 35, 33
2503, 250, 37, 39
2504, 250, 25, 24
2505, 250, 32, 31
2506, 250, 37, 35
2507, 250, 29, 29
2508, 250, 30, 31
2509, 250, 29, 29
2510, 250, 32, 32
2511, 250, 39, 41
2512, 250, 38, 37
2513, 250, 26, 27
2514, 250, 29, 29
2515, 250, 35, 36
2516, 250, 37, 38
2517, 250, 34, 33
2518, 250, 31, 32
2519, 250, 31, 28
2520, 250, 33, 32
2521, 250, 32, 36
2522, 250, 29, 30
2523, 250, 38, 37
2524, 250, 33, 31
2525, 250, 38, 35
2526, 250, 33, 35
2527, 250, 40, 39
2528, 250, 37, 34
2529, 250, 34, 35
2530, 250, 36, 36
2531, 250, 33, 34
2532, 250, 32, 31
2533, 250, 40, 41
2534, 250, 39, 39
2535, 250, 29, 30
2536, 250, 32, 31
2537, 250, 29, 32
2538, 250, 37, 37
2539, 250, 26, 26
2540, 250, 36, 36
2541, 250, 27, 28
2542, 250, 33, 34
2543, 250, 31, 31
2544, 250, 42, 44
2545, 250, 32, 31
2546, 250, 34, 31
2547, 250, 38, 37
2548, 250, 32, 33
2549, 250, 32, 32
2550, 250, 30, 33
2551, 250, 35, 35
2552, 250, 37, 38
2553, 250, 32, 28
2554, 250, 25, 28
2555, 250, 31, 32
2556, 250, 28, 28
2557, 250, 32, 32
2558, 250, 33, 32
2559, 250, 34, 34
2560, 250, 35, 33
2561, 250, 26, 26
2562, 250, 32, 36
2563, 250, 43, 43
2564, 250, 26, 27
2565, 250, 34, 33
2566, 250, 39, 42
2567, 250, 45, 46
2568, 250, 32, 35
2569, 250, 27, 28
2570, 250, 31, 30
2571, 250, 34, 37
2572, 250, 39, 39
2573, 250, 39, 38
2574, 250, 35, 32
2575, 250, 34, 35
2576, 250, 34, 35
2577, 250, 30, 29
2578, 250, 42, 42
2579, 250, 43, 42
2580, 250, 33, 32
2581, 250, 27, 29
2582, 250, 37, 36
2583, 250, 33, 30
2584, 250, 37, 35
2585, 250, 33, 35
2586, 250, 33, 31
2587, 250, 30, 29
2588, 250, 37, 39
2589, 250, 33, 36
2590, 250, 37, 37
2591, 250, 33, 34
2592, 250, 28, 29
2593, 250, 40, 38
2594, 250, 44, 44
2595, 250, 48, 45
2596, 250, 40, 41
2597, 250, 39, 37
2598, 250, 44, 43
2599, 250, 36, 36
2600, 250, 29, 28
2601, 250, 39, 39
2602, 250, 35, 33
2603, 250, 31, 31
2604, 250, 29, 30
2605, 250, 35, 33
2606, 250, 36, 37
2607, 250, 25, 25
2608, 250, 41, 40
2609, 250, 37, 38
2610, 250, 32, 30
2611, 250, 33, 32
2612, 250, 37, 36
2613, 250, 32, 33
2614, 250, 38, 36
2615, 250, 24, 27
2616, 250, 33, 32
2617, 250, 41, 39
2618, 250, 34, 34
2619, 250, 28, 28
2620, 250, 46, 45
2621, 250, 47, 44
2622, 250, 40, 38
2623, 250, 44, 44
2624, 250, 39, 41
2625, 250, 42, 43
2626, 250, 35, 36
2627, 250, 48, 50
2628, 250, 36, 35
2629, 250, 27, 28
2630, 250, 30, 27
2631, 250, 33, 36
2632, 250, 33, 33
2633, 250, 44, 43
2634, 250, 44, 44
2635, 250, 33, 31
2636, 250, 34, 35
2637, 250, 34, 37
2638, 250, 28, 31
2639, 250, 36, 36
2640, 250, 38, 38
2641, 250, 38, 39
2642, 250, 41, 40
2643, 250, 38, 36
2644, 250, 31, 30
2645, 250, 33, 36
2646, 250, 44, 47
2647, 250, 39, 40
2648, 250, 27, 25
2649, 250, 28, 28
2650, 250, 56, 56
2651, 250, 33, 34
2652, 250, 41, 37
2653, 250, 26, 28
2654, 250, 34, 32
2655, 250, 27, 29
2656, 250, 31, 31
2657, 250, 32, 30
2658, 250, 44, 40
2659, 250, 36, 36
2660, 250, 33, 36
2661, 250, 27, 28
2662, 250, 46, 46
2663, 250, 41, 38
2664, 250, 27, 29
2665, 250, 32, 30
2666, 250, 21, 23
2667, 250, 24, 23
2668, 250, 38, 38
2669, 250, 30, 31
2670, 250, 29, 27
2671, 250, 26, 29
2672, 250, 27, 25
2673, 250, 30, 30
2674, 250, 39, 37
2675, 250, 35, 34
2676, 250, 37, 37
2677, 250, 20, 21
2678, 250, 40, 40
2679, 250, 35, 33
2680, 250, 33, 32
2681, 250, 33, 34
2682, 250, 43, 41
2683, 250, 30, 33
2684, 250, 41, 43
2685, 250, 29, 28
2686, 250, 46, 45
2687, 250, 40, 39
2688, 250, 34, 36
2689, 250, 42, 40
2690, 250, 34, 34
2691, 250, 32, 32
2692, 250, 22, 23
2693, 250, 31, 30
2694, 250, 42, 44
2695, 250, 37, 38
2696, 250, 32, 33
2697, 250, 36, 40
2698, 250, 39, 36
2699, 250, 37, 37
2700, 250, 39, 36
2701, 250, 43, 42
2702, 250, 33, 34
2703, 250, 34, 34
2704, 250, 31, 27
2705, 250, 35, 34
2706, 250, 23, 27
2707, 250, 35, 35
2708, 250, 35, 36
2709, 250, 37, 36
2710, 250, 30, 31
2711, 250, 40, 40
2712, 250, 34, 36
2713, 250, 46, 45
2714, 250, 30, 29
2715, 250, 38, 38
2716, 250, 33, 35
2717, 250, 32, 29
2718, 250, 34, 34
2719, 250, 36, 35
2720, 250, 33, 32
2721, 250, 40, 40
2722, 250, 35, 35
2723, 250, 30, 33
2724, 250, 47, 45
2725, 250, 48, 45
2726, 250, 36, 35
2727, 250, 54, 51
2728, 250, 30, 29
2729, 250, 29, 29
2730, 250, 29, 31
2731, 250, 36, 36
2732, 250, 33, 34
2733, 250, 30, 30
2734, 250, 35, 33
2735, 250, 27, 30
2736, 250, 27, 28
2737, 250, 52, 50
2738, 250, 32, 32
2739, 250, 33, 33
2740, 250, 31, 30
2741, 250, 39, 41
2742, 250, 27, 28
2743, 250, 45, 45
2744, 250, 29, 32
2745, 250, 37, 37
2746, 250, 31, 33
2747, 250, 35, 34
2748, 250, 35, 33
2749, 250, 36, 35
2750, 250, 29, 28
2751, 250, 33, 35
2752, 250, 47, 47
2753, 250, 22, 22
2754, 250, 34, 34
2755, 250, 27, 26
2756, 250, 27, 29
2757, 250, 39, 37
2758, 250, 31, 35
2759, 250, 27, 24
2760, 250, 27, 30
2761, 250, 35, 34
2762, 250, 36, 36
2763, 250, 35, 33
2764, 250, 43, 44
2765, 250, 36, 40
2766, 250, 33, 32
2767, 250, 37, 36
2768, 250, 31, 32
2769, 250, 34, 33
2770, 250, 32, 32
2771, 250, 30, 29
2772, 250, 25, 23
2773, 250, 32, 31
2774, 250, 21, 22
2775, 250, 36, 35
2776, 250, 31, 30
2777, 250, 32, 34
2778, 250, 25, 23
2779, 250, 31, 30
2780, 250, 39, 38
2781, 250, 33, 31
2782, 250, 35, 35
2783, 250, 28, 29
2784, 250, 43, 43
2785, 250, 29, 30
2786, 250, 31, 31
2787, 250, 33, 34
2788, 250, 45, 43
2789, 250, 38, 37
2790, 250, 33, 34
2791, 250, 37, 38
2792, 250, 30, 32
2793, 250, 25, 27
2794, 250, 31, 35
2795, 250, 49, 48
2796, 250, 29, 29
2797, 250, 33, 34
2798, 250, 55, 52
2799, 250, 28, 28
2800, 250, 27, 26
2801, 250, 42, 41
2802, 250, 43, 42
2803, 250, 32, 31
2804, 250, 36, 37
2805, 250, 36, 35
2806, 250, 24, 26
2807, 250, 43, 39
2808, 250, 42, 42
2809, 250, 36, 37
2810, 250, 46, 47
2811, 250, 34, 34
2812, 250, 43, 45
2813, 250, 46, 48
2814, 250, 29, 31
2815, 250, 34, 31
2816, 250, 25, 24
2817, 250, 29, 30
2818, 250, 39, 42
2819, 250, 35, 33
2820, 250, 20, 19
2821, 250, 33, 33
2822, 250, 32, 31
2823, 250, 24, 24
2824, 250, 33, 33
2825, 250, 46, 44
2826, 250, 38, 41
2827, 250, 38, 36
2828, 250, 36, 36
2829, 250, 41, 44
2830, 250, 30, 30
2831, 250, 40, 41
2832, 250, 37, 36
2833, 250, 37, 39
2834, 250, 28, 28
2835, 250, 24, 23
2836, 250, 44, 40
2837, 250, 36, 35
2838, 250, 34, 33
2839, 250, 34, 34
2840, 250, 30, 32
2841, 250, 33, 33
2842, 250, 50, 50
2843, 250, 32, 35
2844, 250, 45, 47
2845, 250, 31, 35
2846, 250, 41, 42
2847, 250, 30, 30
2848, 250, 28, 32
2849, 250, 39, 38
2850, 250, 35, 34
2851, 250, 26, 26
2852, 250, 43, 43
2853, 250, 29, 32
2854, 250, 35, 32
2855, 250, 31, 32
2856, 250, 39, 42
2857, 250, 29, 29
2858, 250, 30, 31
2859, 250, 39, 39
2860, 250, 42, 42
2861, 250, 36, 38
2862, 250, 49, 47
2863, 250, 36, 36
2864, 250, 38, 36
2865, 250, 37, 34
2866, 250, 37, 36
2867, 250, 39, 37
2868, 250, 37, 36
2869, 250, 39, 39
2870, 250, 37, 38
2871, 250, 21, 22
2872, 250, 34, 35
2873, 250, 37, 37
2874, 250, 45, 40
2875, 250, 31, 31
2876, 250, 39, 38
2877, 250, 33, 33
2878, 250, 42, 40
2879, 250, 34, 36
2880, 250, 37, 39
2881, 250, 44, 45
2882, 250, 30, 29
2883, 250, 34, 36
2884, 250, 33, 34
2885, 250, 38, 37
2886, 250, 33, 34
2887, 250, 31, 30
2888, 250, 35, 33
2889, 250, 45, 43
2890, 250, 40, 42
2891, 250, 32, 35
2892, 250, 31, 32
2893, 250, 36, 36
2894, 250, 35, 35
2895, 250, 27, 27
2896, 250, 35, 34
2897, 250, 31, 34
2898, 250, 38, 39
2899, 250, 42, 40
2900, 250, 34, 34
2901, 250, 39, 40
2902, 250, 40, 39
2903, 250, 28, 29
2904, 250, 31, 32
2905, 250, 25, 27
2906, 250, 42, 43
2907, 250, 35, 32
2908, 250, 36, 41
2909, 250, 35, 36
2910, 250, 36, 34
2911, 250, 42, 40
2912, 250, 34, 34
2913, 250, 29, 28
2914, 250, 32, 37
2915, 250, 43, 43
2916, 250, 25, 25
2917, 250, 41, 39
2918, 250, 36, 36
2919, 250, 26, 24
2920, 250, 39, 42
2921, 250, 34, 33
2922, 250, 37, 36
2923, 250, 37, 36
2924, 250, 33, 33
2925, 250, 44, 45
2926, 250, 29, 28
2927, 250, 31, 32
2928, 250, 37, 37
2929, 250, 35, 36
2930, 250, 39, 39
2931, 250, 39, 34
2932, 250, 28, 28
2933, 250, 30, 34
2934, 250, 44, 47
2935, 250, 47, 45
2936, 250, 33, 30
2937, 250, 33, 33
2938, 250, 34, 31
2939, 250, 29, 32
2940, 250, 37, 37
2941, 250, 33, 31
2942, 250, 39, 38
2943, 250, 31, 32
2944, 250, 38, 37
2945, 250, 31, 31
2946, 250, 33, 31
2947, 250, 40, 40
2948, 250, 39, 39
2949, 250, 30, 33
2950, 250, 44, 44
2951, 250, 31, 33
2952, 250, 39, 38
2953, 250, 40, 39
2954, 250, 31, 31
2955, 250, 33, 30
2956, 250, 21, 23
2957, 250, 34, 39
2958, 250, 41, 39
2959, 250, 43, 41
2960, 250, 34, 34
2961, 250, 38, 34
2962, 250, 36, 37
2963, 250, 33, 34
2964, 250, 36, 37
2965, 250, 33, 34
2966, 250, 36, 34
2967, 250, 31, 29
2968, 250, 28, 28
2969, 250, 34, 34
2970, 250, 37, 37
2971, 250, 30, 29
2972, 250, 37, 35
2973, 250, 38, 41
2974, 250, 40, 40
2975, 250, 50, 50
2976, 250, 34, 34
2977, 250, 29, 31
2978, 250, 41, 36
2979, 250, 33, 35
2980, 250, 29, 28
2981, 250, 35, 35
2982, 250, 32, 32
2983, 250, 25, 26
2984, 250, 41, 42
2985, 250, 33, 29
2986, 250, 26, 28
2987, 250, 28, 27
2988, 250, 45, 44
2989, 250, 25, 25
2990, 250, 35, 32
2991, 250, 41, 39
2992, 250, 34, 33
2993, 250, 30, 30
2994, 250, 19, 19
2995, 250, 34, 34
2996, 250, 37, 40
2997, 250, 42, 42
2998, 250, 47, 49
2999, 250, 27, 27
3000, 250, 33, 31
3001, 125, 17, 17
3002, 125, 17, 17
3003, 125, 17, 21
3004, 125, 14, 15
3005, 125, 20, 20
3006, 125, 20, 20
3007, 125, 23, 21
3008, 125, 11, 11
3009, 125, 21, 20
3010, 125, 25, 26
3011, 125, 15, 15
3012, 125, 16, 16
3013, 125, 30, 28
3014, 125, 18, 15
3015, 125, 14, 13
3016, 125, 19, 17
3017, 125, 21, 20
3018, 125, 18, 18
3019, 125, 18, 17
3020, 125, 17, 20
3021, 125, 17, 17
3022, 125, 20, 19
3023, 125, 19, 18
3024, 125, 20, 20
3025, 125, 11, 12
3026, 125, 24, 23
3027, 125, 17, 16
3028, 125, 28, 24
3029, 125, 16, 15
3030, 125, 16, 16
3031, 125, 20, 19
3032, 125, 12, 14
3033, 125, 9, 9
3034, 125, 19, 19
3035, 125, 27, 27
3036, 125, 20, 20
3037, 125, 12, 15
3038, 125, 14, 14
3039, 125, 17, 17
3040, 125, 11, 11
3041, 125, 17, 18
3042, 125, 18, 18
3043, 125, 13, 11
3044, 125, 19, 19
3045, 125, 24, 23
3046, 125, 17, 17
3047, 125, 20, 19
3048, 125, 19, 20
3049, 125, 20, 18
3050, 125, 16, 16
3051, 125, 14, 15
3052, 125, 18, 20
3053, 125, 11, 12
3054, 125, 19, 18
3055, 125, 23, 20
3056, 125, 20, 20
3057, 125, 23, 23
3058, 125, 15, 16
3059, 125, 22, 21
3060, 125, 8, 9
3061, 125, 9, 10
3062, 125, 8, 10
3063, 125, 17, 16
3064, 125, 16, 17
3065, 125, 14, 15
3066, 125, 11, 12
3067, 125, 21, 21
3068, 125, 19, 21
3069, 125, 20, 19
3070, 125, 17, 18
3071, 125, 22, 21
3072, 125, 15, 15
3073, 125, 22, 22
3074, 125, 16, 17
3075, 125, 10, 11
3076, 125, 22, 20
3077, 125, 13, 13
3078, 125, 16, 16
3079, 125, 18, 16
3080, 125, 23, 23
3081, 125, 15, 14
3082, 125, 18, 19
3083, 125, 12, 13
3084, 125, 21, 18
3085, 125, 20, 18
3086, 125, 26, 26
3087, 125, 16, 17
3088, 125, 20, 18
3089, 125, 20, 22
3090, 125, 11, 11
3091, 125, 23, 23
3092, 125, 14, 13
3093, 125, 20, 19
3094, 125, 24, 22
3095, 125, 16, 16
3096, 125, 20, 20
3097, 125, 26, 26
3098, 125, 16, 18
3099, 125, 22, 21
3100, 125, 19, 18
3101, 125, 10, 12
3102, 125, 23, 20
3103, 125, 15, 15
3104, 125, 22, 21
3105, 125, 20, 18
3106, 125, 22, 22
3107, 125, 19, 20
3108, 125, 24, 24
3109, 125, 15, 15
3110, 125, 15, 16
3111, 125, 21, 20
3112, 125, 17, 17
3113, 125, 15, 16
3114, 125, 22, 22
3115, 125, 16, 16
3116, 125, 18, 16
3117, 125, 23, 24
3118, 125, 18, 16
3119, 125, 22, 23
3120, 125, 11, 11
3121, 125, 17, 16
3122, 125, 14, 14
3123, 125, 17, 15
3124, 125, 18, 19
3125, 125, 14, 14
3126, 125, 6, 7
3127, 125, 21, 19
3128, 125, 19, 21
3129, 125, 11, 12
3130, 125, 18, 19
3131, 125, 25, 22
3132, 125, 24, 24
3133, 125, 15, 15
3134, 125, 22, 21
3135, 125, 7, 7
3136, 125, 23, 22
3137, 125, 27, 27
3138, 125, 20, 18
3139, 125, 24, 23
3140, 125, 22, 19
3141, 125, 13, 14
3142, 125, 12, 12
3143, 125, 22, 21
3144, 125, 21, 20
3145, 125, 15, 15
3146, 125, 15, 16
3147, 125, 19, 18
3148, 125, 20, 20
3149, 125, 15, 15
3150, 125, 16, 17
3151, 125, 21, 21
3152, 125, 12, 12
3153, 125, 22, 22
3154, 125, 10, 10
3155, 125, 11, 12
3156, 125, 27, 27
3157, 125, 19, 21
3158, 125, 22, 21
3159, 125, 14, 15
3160, 125, 24, 23
3161, 125, 18, 18
3162, 125, 13, 13
3163, 125, 15, 17
3164, 125, 9, 9
3165, 125, 19, 19
3166, 125, 18, 19
3167, 125, 22, 21
3168, 125, 21, 19
3169, 125, 12, 11
3170, 125, 23, 23
3171, 125, 21, 21
3172, 125, 8, 8
3173, 125, 12, 12
3174, 125, 26, 26
3175, 125, 10, 10
3176, 125, 17, 17
3177, 125, 14, 14
3178, 125, 19, 18
3179, 125, 20, 20
3180, 125, 21, 21
3181, 125, 24, 22
3182, 125, 15, 15
3183, 125, 22, 22
3184, 125, 17, 17
3185, 125, 16, 16
3186, 125, 22, 21
3187, 125, 17, 17
3188, 125, 10, 10
3189, 125, 8, 8
3190, 125, 14, 14
3191, 125, 28, 26
3192, 125, 20, 20
3193, 125, 18, 18
3194, 125, 14, 14
3195, 125, 14, 15
3196, 125, 23, 22
3197, 125, 16, 15
3198, 125, 14, 13
3199, 125, 31, 27
3200, 125, 19, 22
3201, 125, 13, 13
3202, 125, 21, 21
3203, 125, 13, 14
3204, 125, 16, 16
3205, 125, 16, 16
3206, 125, 24, 20
3207, 125, 14, 15
3208, 125, 21, 21
3209, 125, 17, 18
3210, 125, 19, 19
3211, 125, 21, 19
3212, 125, 15, 16
3213, 125, 19, 18
3214, 125, 19, 19
3215, 125, 17, 19
3216, 125, 19, 19
3217, 125, 11, 11
3218, 125, 15, 14
3219, 125, 10, 10
3220, 125, 20, 19
3221, 125, 16, 16
3222, 125, 19, 19
3223, 125, 24, 22
3224, 125, 17, 20
3225, 125, 21, 20
3226, 125, 20, 19
3227, 125, 12, 11
3228, 125, 22, 22
3229, 125, 25, 25
3230, 125, 10, 10
3231, 125, 18, 17
3232, 125, 20, 21
3233, 125, 17, 16
3234, 125, 15, 16
3235, 125, 14, 14
3236, 125, 20, 19
3237, 125, 9, 8
3238, 125, 19, 20
3239, 125, 17, 16
3240, 125, 23, 23
3241, 125, 17, 16
3242, 125, 19, 22
3243, 125, 18, 16
3244, 125, 13, 13
3245, 125, 13, 12
3246, 125, 15, 15
3247, 125, 15, 15
3248, 125, 21, 20
3249, 125, 19, 19
3250, 125, 19, 19
3251, 125, 18, 17
3252, 125, 17, 18
3253, 125, 33, 29
3254, 125, 22, 22
3255, 125, 16, 15
3256, 125, 22, 20
3257, 125, 12, 13
3258, 125, 16, 16
3259, 125, 11, 11
3260, 125, 15, 14
3261, 125, 18, 18
3262, 125, 20, 19
3263, 125, 16, 17
3264, 125, 21, 22
3265, 125, 11, 11
3266, 125, 22, 21
3267, 125, 13, 14
3268, 125, 20, 19
3269, 125, 20, 20
3270, 125, 22, 22
3271, 125, 18, 18
3272, 125, 20, 19
3273, 125, 23, 22
3274, 125, 17, 17
3275, 125, 16, 16
3276, 125, 18, 16
3277, 125, 24, 24
3278, 125, 17, 17
3279, 125, 15, 15
3280, 125, 19, 19
3281, 125, 14, 15
3282, 125, 15, 16
3283, 125, 24, 22
3284, 125, 19, 17
3285, 125, 14, 15
3286, 125, 18, 18
3287, 125, 12, 10
3288, 125, 19, 20
3289, 125, 22, 21
3290, 125, 25, 23
3291, 125, 17, 16
3292, 125, 16, 16
3293, 125, 16, 16
3294, 125, 17, 18
3295, 125, 17, 16
3296, 125, 19, 20
3297, 125, 18, 18
3298, 125, 19, 19
3299, 125, 16, 20
3300, 125, 16, 16
3301, 125, 22, 23
3302, 125, 28, 27
3303, 125, 19, 17
3304, 125, 20, 20
3305, 125, 11, 11
3306, 125, 12, 12
3307, 125, 19, 19
3308, 125, 19, 19
3309, 125, 19, 19
3310, 125, 11, 11
3311, 125, 26, 27
3312, 125, 12, 13
3313, 125, 10, 10
3314, 125, 19, 19
3315, 125, 16, 16
3316, 125, 11, 9
3317, 125, 13, 14
3318, 125, 16, 18
3319, 125, 17, 17
3320, 125, 18, 19
3321, 125, 16, 17
3322, 125, 21, 18
3323, 125, 18, 18
3324, 125, 25, 30
3325, 125, 9, 10
3326, 125, 18, 18
3327, 125, 14, 14
3328, 125, 23, 22
3329, 125, 13, 12
3330, 125, 15, 15
3331, 125, 14, 15
3332, 125, 19, 19
3333, 125, 24, 23
3334, 125, 19, 18
3335, 125, 16, 16
3336, 125, 18, 19
3337, 125, 12, 12
3338, 125, 17, 16
3339, 125, 14, 15
3340, 125, 12, 12
3341, 125, 27, 25
3342, 125, 14, 14
3343, 125, 15, 14
3344, 125, 13, 12
3345, 125, 18, 18
3346, 125, 9, 11
3347, 125, 21, 20
3348, 125, 14, 14
3349, 125, 18, 17
3350, 125, 17, 16
3351, 125, 24, 25
3352, 125, 10, 10
3353, 125, 19, 18
3354, 125, 18, 18
3355, 125, 20, 21
3356, 125, 18, 18
3357, 125, 19, 16
3358, 125, 14, 15
3359, 125, 19, 17
3360, 125, 14, 14
3361, 125, 15, 14
3362, 125, 14, 14
3363, 125, 22, 21
3364, 125, 25, 26
3365, 125, 17, 18
3366, 125, 18, 18
3367, 125, 16, 17
3368, 125, 24, 22
3369, 125, 19, 18
3370, 125, 14, 14
3371, 125, 16, 15
3372, 125, 29, 27
3373, 125, 14, 14
3374, 125, 16, 16
3375, 125, 25, 24
3376, 125, 27, 28
3377, 125, 16, 16
3378, 125, 17, 17
3379, 125, 26, 24
3380, 125, 20, 21
3381, 125, 14, 14
3382, 125, 22, 23
3383, 125, 20, 19
3384, 125, 15, 16
3385, 125, 17, 16
3386, 125, 16, 17
3387, 125, 17, 17
3388, 125, 20, 18
3389, 125, 17, 17
3390, 125, 11, 10
3391, 125, 20, 21
3392, 125, 13, 15
3393, 125, 19, 20
3394, 125, 16, 17
3395, 125, 20, 20
3396, 125, 19, 20
3397, 125, 17, 16
3398, 125, 13, 13
3399, 125, 20, 21
3400, 125, 17, 18
3401, 125, 12, 13
3402, 125, 17, 18
3403, 125, 17, 17
3404, 125, 17, 17
3405, 125, 14, 13
3406, 125, 17, 17
3407, 125, 12, 12
3408, 125, 18, 18
3409, 125, 18, 20
3410, 125, 16, 16
3411, 125, 18, 18
3412, 125, 18, 17
3413, 125, 11, 12
3414, 125, 15, 16
3415, 125, 13, 13
3416, 125, 13, 12
3417, 125, 16, 17
3418, 125, 12, 13
3419, 125, 23, 22
3420, 125, 12, 12
3421, 125, 10, 10
3422, 125, 16, 18
3423, 125, 9, 9
3424, 125, 17, 17
3425, 125, 23, 23
3426, 125, 21, 20
3427, 125, 12, 13
3428, 125, 11, 11
3429, 125, 16, 16
3430, 125, 13, 16
3431, 125, 7, 9
3432, 125, 21, 20
3433, 125, 15, 15
3434, 125, 13, 12
3435, 125, 17, 17
3436, 125, 12, 11
3437, 125, 22, 19
3438, 125, 18, 20
3439, 125, 18, 18
3440, 125, 17, 17
3441, 125, 18, 17
3442, 125, 6, 6
3443, 125, 18, 18
3444, 125, 17, 17
3445, 125, 12, 12
3446, 125, 17, 18
3447, 125, 22, 24
3448, 125, 25, 25
3449, 125, 18, 16
3450, 125, 13, 11
3451, 125, 19, 18
3452, 125, 22, 21
3453, 125, 22, 22
3454, 125, 11, 11
3455, 125, 18, 18
3456, 125, 15, 15
3457, 125, 22, 21
3458, 125, 11, 11
3459, 125, 19, 20
3460, 125, 14, 14
3461, 125, 15, 15
3462, 125, 23, 23
3463, 125, 22, 21
3464, 125, 13, 13
3465, 125, 19, 18
3466, 125, 18, 20
3467, 125, 16, 17
3468, 125, 10, 11
3469, 125, 21, 20
3470, 125, 17, 16
3471, 125, 15, 15
3472, 125, 15, 15
3473, 125, 14, 13
3474, 125, 17, 18
3475, 125, 21, 23
3476, 125, 11, 11
3477, 125, 19, 19
3478, 125, 18, 17
3479, 125, 19, 19
3480, 125, 23, 23
3481, 125, 17, 16
3482, 125, 20, 19
3483, 125, 14, 14
3484, 125, 22, 21
3485, 125, 23, 19
3486, 125, 17, 15
3487, 125, 16, 17
3488, 125, 11, 8
3489, 125, 17, 17
3490, 125, 26, 27
3491, 125, 16, 15
3492, 125, 9, 9
3493, 125, 10, 11
3494, 125, 25, 26
3495, 125, 19, 18
3496, 125, 14, 12
3497, 125, 17, 18
3498, 125, 16, 16
3499, 125, 18, 19
3500, 125, 11, 12
3501, 125, 14, 16
3502, 125, 26, 22
3503, 125, 22, 21
3504, 125, 18, 19
3505, 125, 13, 12
3506, 125, 20, 17
3507, 125, 18, 19
3508, 125, 12, 14
3509, 125, 13, 13
3510, 125, 18, 17
3511, 125, 18, 18
3512, 125, 20, 19
3513, 125, 16, 16
3514, 125, 11, 11
3515, 125, 18, 18
3516, 125, 16, 16
3517, 125, 26, 27
3518, 125, 21, 19
3519, 125, 12, 12
3520, 125, 21, 20
3521, 125, 20, 20
3522, 125, 13, 12
3523, 125, 25, 25
3524, 125, 8, 10
3525, 125, 20, 19
3526, 125, 13, 11
3527, 125, 18, 19
3528, 125, 16, 16
3529, 125, 15, 14
3530, 125, 15, 16
3531, 125, 23, 21
3532, 125, 22, 20
3533, 125, 15, 14
3534, 125, 12, 14
3535, 125, 23, 23
3536, 125, 13, 13
3537, 125, 18, 19
3538, 125, 18, 18
3539, 125, 21, 20
3540, 125, 11, 12
3541, 125, 18, 20
3542, 125, 12, 11
3543, 125, 18, 17
3544, 125, 23, 22
3545, 125, 24, 22
3546, 125, 14, 12
3547, 125, 15, 16
3548, 125, 8, 8
3549, 125, 17, 20
3550, 125, 17, 17
3551, 125, 15, 15
3552, 125, 12, 13
3553, 125, 10, 10
3554, 125, 17, 18
3555, 125, 14, 14
3556, 125, 15, 16
3557, 125, 16, 16
3558, 125, 22, 21
3559, 125, 19, 20
3560, 125, 21, 21
3561, 125, 17, 16
3562, 125, 16, 16
3563, 125, 16, 17
3564, 125, 15, 15
3565, 125, 17, 20
3566, 125, 12, 12
3567, 125, 13, 13
3568, 125, 13, 13
3569, 125, 13, 14
3570, 125, 12, 11
3571, 125, 17, 18
3572, 125, 20, 19
3573, 125, 14, 13
3574, 125, 13, 15
3575, 125, 12, 14
3576, 125, 20, 21
3577, 125, 9, 9
3578, 125, 23, 23
3579, 125, 17, 17
3580, 125, 21, 22
3581, 125, 17, 15
3582, 125, 19, 18
3583, 125, 21, 19
3584, 125, 25, 24
3585, 125, 21, 21
3586, 125, 18, 20
3587, 125, 15, 15
3588, 125, 23, 21
3589, 125, 14, 12
3590, 125, 27, 26
3591, 125, 13, 13
3592, 125, 22, 19
3593, 125, 16, 16
3594, 125, 20, 20
3595, 125, 12, 14
3596, 125, 18, 18
3597, 125, 25, 23
3598, 125, 19, 20
3599, 125, 12, 12
3600, 125, 23, 21
3601, 125, 20, 19
3602, 125, 22, 23
3603, 125, 25, 21
3604, 125, 13, 12
3605, 125, 15, 16
3606, 125, 16, 14
3607, 125, 29, 26
3608, 125, 21, 21
3609, 125, 20, 21
3610, 125, 18, 18
3611, 125, 20, 20
3612, 125, 18, 18
3613, 125, 26, 25
3614, 125, 20, 18
3615, 125, 13, 13
3616, 125, 13, 13
3617, 125, 16, 16
3618, 125, 18, 17
3619, 125, 12, 12
3620, 125, 20, 22
3621, 125, 23, 23
3622, 125, 20, 20
3623, 125, 21, 22
3624, 125, 10, 11
3625, 125, 18, 17
3626, 125, 13, 13
3627, 125, 12, 12
3628, 125, 11, 12
3629, 125, 12, 12
3630, 125, 13, 12
3631, 125, 27, 27
3632, 125, 20, 20
3633, 125, 19, 17
3634, 125, 10, 10
3635, 125, 20, 20
3636, 125, 19, 20
3637, 125, 22, 21
3638, 125, 19, 19
3639, 125, 15, 17
3640, 125, 12, 12
3641, 125, 21, 21
3642, 125, 20, 21
3643, 125, 18, 18
3644, 125, 16, 16
3645, 125, 18, 18
3646, 125, 26, 23
3647, 125, 17, 17
3648, 125, 20, 19
3649, 125, 25, 24
3650, 125, 17, 16
3651, 125, 27, 25
3652, 125, 19, 18
3653, 125, 21, 21
3654, 125, 10, 11
3655, 125, 16, 17
3656, 125, 17, 17
3657, 125, 24, 23
3658, 125, 21, 18
3659, 125, 20, 21
3660, 125, 26, 26
3661, 125, 20, 20
3662, 125, 22, 21
3663, 125, 18, 18
3664, 125, 15, 15
3665, 125, 24, 21
3666, 125, 16, 15
3667, 125, 21, 23
3668, 125, 16, 16
3669, 125, 16, 15
3670, 125, 16, 15
3671, 125, 16, 15
3672, 125, 25, 25
3673, 125, 21, 20
3674, 125, 15, 14
3675, 125, 15, 15
3676, 125, 21, 20
3677, 125, 18, 17
3678, 125, 21, 18
3679, 125, 14, 12
3680, 125, 24, 24
3681, 125, 19, 18
3682, 125, 14, 13
3683, 125, 15, 15
3684, 125, 20, 20
3685, 125, 13, 12
3686, 125, 17, 19
3687, 125, 17, 18
3688, 125, 13, 13
3689, 125, 20, 20
3690, 125, 15, 16
3691, 125, 14, 14
3692, 125, 18, 16
3693, 125, 17, 17
3694, 125, 12, 12
3695, 125, 13, 14
3696, 125, 8, 9
3697, 125, 22, 24
3698, 125, 18, 18
3699, 125, 24, 21
3700, 125, 16, 19
3701, 125, 16, 16
3702, 125, 20, 18
3703, 125, 15, 16
3704, 125, 17, 18
3705, 125, 15, 16
3706, 125, 20, 20
3707, 125, 26, 26
3708, 125, 21, 22
3709, 125, 10, 11
3710, 125, 24, 25
3711, 125, 10, 8
3712, 125, 13, 13
3713, 125, 31, 29
3714, 125, 10, 11
3715, 125, 14, 14
3716, 125, 20, 20
3717, 125, 19, 19
3718, 125, 14, 14
3719, 125, 17, 17
3720, 125, 15, 15
3721, 125, 13, 13
3722, 125, 10, 10
3723, 125, 16, 17
3724, 125, 10, 10
3725, 125, 16, 16
3726, 125, 12, 13
3727, 125, 11, 11
3728, 125, 21, 22
3729, 125, 15, 14
3730, 125, 18, 16
3731, 125, 18, 17
3732, 125, 19, 18
3733, 125, 18, 18
3734, 125, 24, 22
3735, 125, 18, 17
3736, 125, 17, 18
3737, 125, 22, 21
3738, 125, 19, 20
3739, 125, 10, 12
3740, 125, 17, 17
3741, 125, 19, 19
3742, 125, 22, 22
3743, 125, 16, 18
3744, 125, 19, 19
3745, 125, 18, 18
3746, 125, 13, 12
3747, 125, 13, 14
3748, 125, 13, 14
3749, 125, 16, 17
3750, 125, 25, 24
3751, 125, 16, 15
3752, 125, 19, 19
3753, 125, 17, 16
3754, 125, 14, 13
3755, 125, 24, 23
3756, 125, 12, 15
3757, 125, 21, 20
3758, 125, 21, 18
3759, 125, 25, 23
3760, 125, 15, 15
3761, 125, 21, 21
3762, 125, 19, 19
3763, 125, 14, 14
3764, 125, 18, 16
3765, 125, 20, 20
3766, 125, 13, 12
3767, 125, 17, 17
3768, 125, 13, 13
3769, 125, 20, 22
3770, 125, 12, 12
3771, 125, 19, 21
3772, 125, 18, 16
3773, 125, 13, 13
3774, 125, 22, 22
3775, 125, 27, 27
3776, 125, 11, 12
3777, 125, 21, 21
3778, 125, 15, 14
3779, 125, 15, 13
3780, 125, 19, 19
3781, 125, 12, 13
3782, 125, 20, 20
3783, 125, 25, 23
3784, 125, 11, 12
3785, 125, 23, 22
3786, 125, 16, 15
3787, 125, 16, 16
3788, 125, 12, 12
3789, 125, 18, 17
3790, 125, 13, 14
3791, 125, 12, 12
3792, 125, 33, 33
3793, 125, 21, 20
3794, 125, 24, 23
3795, 125, 18, 18
3796, 125, 20, 20
3797, 125, 20, 20
3798, 125, 23, 20
3799, 125, 20, 20
3800, 125, 25, 23
3801, 125, 18, 18
3802, 125, 13, 13
3803, 125, 19, 18
3804, 125, 18, 18
3805, 125, 16, 16
3806, 125, 13, 13
3807, 125, 11, 13
3808, 125, 14, 12
3809, 125, 21, 19
3810, 125, 24, 25
3811, 125, 24, 21
3812, 125, 12, 14
3813, 125, 18, 16
3814, 125, 15, 16
3815, 125, 18, 19
3816, 125, 18, 18
3817, 125, 17, 16
3818, 125, 14, 16
3819, 125, 13, 12
3820, 125, 14, 16
3821, 125, 16, 19
3822, 125, 11, 10
3823, 125, 13, 14
3824, 125, 15, 15
3825, 125, 18, 17
3826, 125, 22, 21
3827, 125, 21, 21
3828, 125, 16, 17
3829, 125, 29, 31
3830, 125, 13, 13
3831, 125, 13, 14
3832, 125, 15, 15
3833, 125, 18, 19
3834, 125, 16, 15
3835, 125, 13, 12
3836, 125, 12, 14
3837, 125, 13, 14
3838, 125, 23, 21
3839, 125, 19, 22
3840, 125, 20, 20
3841, 125, 11, 12
3842, 125, 16, 16
3843, 125, 8, 7
3844, 125, 18, 16
3845, 125, 18, 18
3846, 125, 23, 21
3847, 125, 16, 18
3848, 125, 23, 23
3849, 125, 17, 18
3850, 125, 19, 19
3851, 125, 20, 20
3852, 125, 19, 19
3853, 125, 15, 14
3854, 125, 18, 18
3855, 125, 16, 16
3856, 125, 16, 15
3857, 125, 12, 12
3858, 125, 24, 23
3859, 125, 10, 10
3860, 125, 22, 21
3861, 125, 16, 18
3862, 125, 9, 9
3863, 125, 18, 21
3864, 125, 19, 20
3865, 125, 23, 25
3866, 125, 17, 16
3867, 125, 21, 21
3868, 125, 20, 20
3869, 125, 13, 13
3870, 125, 16, 16
3871, 125, 16, 17
3872, 125, 16, 17
3873, 125, 14, 14
3874, 125, 29, 27
3875, 125, 10, 11
3876, 125, 16, 16
3877, 125, 15, 16
3878, 125, 25, 22
3879, 125, 15, 16
3880, 125, 14, 13
3881, 125, 21, 19
3882, 125, 17, 17
3883, 125, 27, 26
3884, 125, 9, 9
3885, 125, 25, 23
3886, 125, 9, 10
3887, 125, 16, 16
3888, 125, 23, 22
3889, 125, 17, 17
3890, 125, 16, 17
3891, 125, 20, 18
3892, 125, 26, 23
3893, 125, 27, 27
3894, 125, 16, 15
3895, 125, 31, 29
3896, 125, 16, 15
3897, 125, 20, 20
3898, 125, 8, 8
3899, 125, 14, 14
3900, 125, 15, 12
3901, 125, 15, 17
3902, 125, 15, 18
3903, 125, 11, 11
3904, 125, 19, 19
3905, 125, 18, 17
3906, 125, 24, 24
3907, 125, 22, 21
3908, 125, 18, 17
3909, 125, 20, 18
3910, 125, 15, 16
3911, 125, 22, 22
3912, 125, 12, 11
3913, 125, 21, 22
3914, 125, 19, 19
3915, 125, 17, 15
3916, 125, 14, 14
3917, 125, 19, 17
3918, 125, 25, 23
3919, 125, 21, 22
3920, 125, 14, 15
3921, 125, 9, 9
3922, 125, 8, 9
3923, 125, 11, 12
3924, 125, 11, 12
3925, 125, 14, 14
3926, 125, 26, 25
3927, 125, 14, 13
3928, 125, 23, 25
3929, 125, 18, 17
3930, 125, 14, 14
3931, 125, 19, 19
3932, 125, 14, 14
3933, 125, 24, 22
3934, 125, 15, 15
3935, 125, 17, 18
3936, 125, 14, 14
3937, 125, 19, 19
3938, 125, 15, 15
3939, 125, 23, 22
3940, 125, 16, 16
3941, 125, 11, 11
3942, 125, 17, 17
3943, 125, 21, 21
3944, 125, 15, 17
3945, 125, 17, 17
3946, 125, 10, 11
3947, 125, 13, 12
3948, 125, 17, 17
3949, 125, 23, 22
3950, 125, 20, 18
3951, 125, 22, 22
3952, 125, 18, 18
3953, 125, 23, 21
3954, 125, 13, 13
3955, 125, 19, 19
3956, 125, 20, 20
3957, 125, 22, 21
3958, 125, 20, 21
3959, 125, 20, 21
3960, 125, 22, 23
3961, 125, 11, 12
3962, 125, 21, 20
3963, 125, 16, 16
3964, 125, 16, 14
3965, 125, 21, 22
3966, 125, 13, 11
3967, 125, 18, 20
3968, 125, 20, 19
3969, 125, 13, 12
3970, 125, 13, 14
3971, 125, 16, 17
3972, 125, 21, 22
3973, 125, 11, 9
3974, 125, 13, 13
3975, 125, 13, 14
3976, 125, 15, 17
3977, 125, 25, 26
3978, 125, 17, 18
3979, 125, 13, 14
3980, 125, 24, 22
3981, 125, 15, 15
3982, 125, 19, 20
3983, 125, 16, 18
3984, 125, 16, 15
3985, 125, 19, 19
3986, 125, 11, 11
3987, 125, 16, 15
3988, 125, 20, 20
3989, 125, 17, 20
3990, 125, 21, 19
3991, 125, 16, 17
3992, 125, 16, 14
3993, 125, 25, 24
3994, 125, 18, 17
3995, 125, 16, 14
3996, 125, 17, 17
3997, 125, 15, 15
3998, 125, 17, 17
3999, 125, 15, 15
4000, 125, 18, 18
