example/20230707_214956.csv
Validator,Stake,Reward,Sortition
1, 1000, 54, 53
2, 1000, 41, 41
3, 1000, 44, 47
4, 1000, 56, 56
5, 1000, 44, 45
6, 1000, 43, 44
7, 1000, 54, 54
8, 1000, 47, 48
9, 1000, 45, 45
10, 1000, 41, 41
11, 1000, 43, 45
12, 1000, 53, 52
13, 1000, 54, 56
14, 1000, 64, 63
15, 1000, 44, 43
16, 1000, 46, 44
17, 1000, 37, 37
18, 1000, 53, 55
19, 1000, 51, 49
20, 1000, 47, 47
21, 1000, 48, 49
22, 1000, 48, 51
23, 1000, 44, 43
24, 1000, 50, 51
25, 1000, 64, 62
26, 1000, 59, 60
27, 1000, 52, 52
28, 1000, 48, 49
29, 1000, 41, 44
30, 1000, 52, 50
31, 1000, 36, 36
32, 1000, 43, 44
33, 1000, 41, 40
34, 1000, 49, 47
35, 1000, 52, 51
36, 1000, 50, 49
37, 1000, 46, 45
38, 1000, 63, 61
39, 1000, 40, 38
40, 1000, 49, 48
41, 1000, 35, 35
42, 1000, 47, 47
43, 1000, 34, 36
44, 1000, 40, 40
45, 1000, 61, 58
46, 1000, 42, 41
47, 1000, 51, 51
48, 1000, 44, 43
49, 1000, 47, 47
50, 1000, 52, 51
51, 1000, 50, 51
52, 1000, 35, 35
53, 1000, 37, 39
54, 1000, 34, 36
55, 1000, 47, 47
56, 1000, 42, 43
57, 1000, 53, 54
58, 1000, 49, 50
59, 1000, 46, 45
60, 1000, 41, 42
61, 1000, 42, 43
62, 1000, 39, 38
63, 1000, 57, 58
64, 1000, 42, 43
65, 1000, 46, 47
66, 1000, 54, 51
67, 1000, 50, 52
68, 1000, 44, 45
69, 1000, 43, 43
70, 1000, 56, 52
71, 1000, 33, 34
72, 1000, 59, 58
73, 1000, 47, 45
74, 1000, 45, 46
75, 1000, 45, 45
76, 1000, 48, 49
77, 1000, 47, 50
78, 1000, 51, 50
79, 1000, 47, 49
80, 1000, 45, 45
81, 1000, 56, 56
82, 1000, 44, 45
83, 1000, 47, 47
84, 1000, 41, 43
85, 1000, 44, 45
86, 1000, 42, 42
87, 1000, 31, 31
88, 1000, 38, 39
89, 1000, 70, 68
90, 1000, 44, 42
91, 1000, 42, 42
92, 1000, 53, 53
93, 1000, 54, 56
94, 1000, 37, 37
95, 1000, 43, 44
96, 1000, 49, 51
97, 1000, 50, 52
98, 1000, 46, 47
99, 1000, 51, 53
100, 1000, 42, 43
101, 1000, 57, 54
102, 1000, 43, 43
103, 1000, 50, 52
104, 1000, 39, 40
105, 1000, 54, 52
106, 1000, 44, 44
107, 1000, 48, 46
108, 1000, 47, 45
109, 1000, 48, 49
110, 1000, 47, 49
111, 1000, 45, 46
112, 1000, 45, 47
113, 1000, 61, 61
114, 1000, 43, 41
115, 1000, 37, 38
116, 1000, 52, 54
117, 1000, 69, 69
118, 1000, 43, 43
119, 1000, 56, 57
120, 1000, 49, 50
121, 1000, 54, 54
122, 1000, 49, 49
123, 1000, 53, 49
124, 1000, 39, 38
125, 1000, 46, 45
126, 1000, 46, 45
127, 1000, 34, 35
128, 1000, 43, 44
129, 1000, 39, 38
130, 1000, 50, 46
131, 1000, 52, 53
132, 1000, 54, 51
133, 1000, 40, 41
134, 1000, 52, 50
135, 1000, 40, 38
136, 1000, 51, 51
137, 1000, 47, 48
138, 1000, 50, 50
139, 1000, 34, 34
140, 1000, 59, 59
141, 1000, 54, 55
142, 1000, 52, 51
143, 1000, 46, 47
144, 1000, 53, 54
145, 1000, 38, 38
146, 1000, 43, 44
147, 1000, 53, 51
148, 1000, 56, 55
149, 1000, 33, 33
150, 1000, 48, 49
151, 1000, 43, 42
152, 1000, 35, 35
153, 1000, 47, 47
154, 1000, 42, 42
155, 1000, 58, 59
156, 1000, 37, 38
157, 1000, 49, 48
158, 1000, 48, 48
159, 1000, 50, 50
160, 1000, 43, 45
161, 1000, 50, 50
162, 1000, 42, 43
163, 1000, 46, 48
164, 1000, 46, 48
165, 1000, 55, 52
166, 1000, 44, 45
167, 1000, 47, 46
168, 1000, 42, 44
169, 1000, 43, 43
170, 1000, 50, 49
171, 1000, 49, 51
172, 1000, 55, 57
173, 1000, 42, 44
174, 1000, 43, 45
175, 1000, 48, 48
176, 1000, 54, 51
177, 1000, 32, 34
178, 1000, 42, 42
179, 1000, 52, 53
180, 1000, 50, 49
181, 1000, 51, 49
182, 1000, 53, 53
183, 1000, 38, 39
184, 1000, 43, 45
185, 1000, 52, 52
186, 1000, 45, 44
187, 1000, 41, 42
188, 1000, 41, 42
189, 1000, 50, 51
190, 1000, 45, 45
191, 1000, 60, 58
192, 1000, 49, 49
193, 1000, 46, 47
194, 1000, 50, 49
195, 1000, 38, 41
196, 1000, 38, 39
197, 1000, 44, 45
198, 1000, 53, 53
199, 1000, 49, 46
200, 1000, 44, 45
201, 1000, 47, 46
202, 1000, 42, 43
203, 1000, 29, 30
204, 1000, 48, 44
205, 1000, 54, 56
206, 1000, 42, 41
207, 1000, 39, 39
208, 1000, 56, 55
209, 1000, 41, 40
210, 1000, 50, 50
211, 1000, 36, 35
212, 1000, 45, 49
213, 1000, 51, 52
214, 1000, 44, 45
215, 1000, 42, 43
216, 1000, 51, 53
217, 1000, 47, 45
218, 1000, 44, 44
219, 1000, 49, 50
220, 1000, 39, 43
221, 1000, 52, 53
222, 1000, 42, 44
223, 1000, 48, 49
224, 1000, 41, 43
225, 1000, 34, 35
226, 1000, 48, 48
227, 1000, 49, 50
228, 1000, 40, 39
229, 1000, 47, 47
230, 1000, 56, 58
231, 1000, 42, 43
232, 1000, 53, 51
233, 1000, 53, 55
234, 1000, 54, 55
235, 1000, 57, 54
236, 1000, 40, 41
237, 1000, 41, 41
238, 1000, 56, 55
239, 1000, 34, 34
240, 1000, 40, 39
241, 1000, 46, 46
242, 1000, 49, 49
243, 1000, 40, 42
244, 1000, 43, 44
245, 1000, 40, 41
246, 1000, 49, 49
247, 1000, 44, 42
248, 1000, 39, 39
249, 1000, 55, 57
250, 1000, 45, 43
251, 1000, 31, 30
252, 1000, 38, 38
253, 1000, 44, 48
254, 1000, 37, 37
255, 1000, 32, 32
256, 1000, 44, 48
257, 1000, 45, 43
258, 1000, 40, 40
259, 1000, 51, 50
260, 1000, 51, 51
261, 1000, 45, 47
262, 1000, 45, 44
263, 1000, 45, 45
264, 1000, 45, 45
265, 1000, 60, 59
266, 1000, 60, 60
267, 1000, 45, 47
268, 1000, 33, 33
269, 1000, 53, 56
270, 1000, 36, 38
271, 1000, 41, 40
272, 1000, 51, 51
273, 1000, 49, 48
274, 1000, 36, 36
275, 1000, 59, 59
276, 1000, 46, 46
277, 1000, 53, 54
278, 1000, 43, 42
279, 1000, 54, 54
280, 1000, 39, 40
281, 1000, 47, 47
282, 1000, 30, 29
283, 1000, 47, 49
284, 1000, 42, 41
285, 1000, 51, 52
286, 1000, 42, 42
287, 1000, 51, 49
288, 1000, 55, 54
289, 1000, 42, 42
290, 1000, 39, 39
291, 1000, 35, 34
292, 1000, 48, 48
293, 1000, 42, 40
294, 1000, 42, 43
295, 1000, 50, 48
296, 1000, 53, 53
297, 1000, 55, 56
298, 1000, 40, 41
299, 1000, 46, 47
300, 1000, 37, 38
301, 1000, 43, 43
302, 1000, 54, 50
303, 1000, 41, 40
304, 1000, 56, 54
305, 1000, 50, 50
306, 1000, 33, 35
307, 1000, 42, 42
308, 1000, 46, 47
309, 1000, 42, 45
310, 1000, 51, 51
311, 1000, 38, 40
312, 1000, 44, 43
313, 1000, 47, 47
314, 1000, 43, 44
315, 1000, 46, 46
316, 1000, 41, 39
317, 1000, 42, 40
318, 1000, 39, 40
319, 1000, 51, 53
320, 1000, 39, 39
321, 1000, 53, 55
322, 1000, 40, 39
323, 1000, 41, 41
324, 1000, 53, 52
325, 1000, 52, 49
326, 1000, 56, 56
327, 1000, 41, 43
328, 1000, 45, 47
329, 1000, 31, 33
330, 1000, 48, 46
331, 1000, 37, 38
332, 1000, 47, 47
333, 1000, 47, 47
334, 1000, 50, 53
335, 1000, 42, 43
336, 1000, 46, 47
337, 1000, 44, 42
338, 1000, 45, 45
339, 1000, 49, 51
340, 1000, 50, 51
341, 1000, 46, 48
342, 1000, 39, 40
343, 1000, 34, 33
344, 1000, 42, 41
345, 1000, 45, 44
346, 1000, 47, 48
347, 1000, 46, 44
348, 1000, 39, 39
349, 1000, 49, 50
350, 1000, 49, 47
351, 1000, 38, 38
352, 1000, 34, 35
353, 1000, 45, 46
354, 1000, 59, 65
355, 1000, 53, 55
356, 1000, 50, 50
357, 1000, 40, 38
358, 1000, 43, 42
359, 1000, 55, 51
360, 1000, 47, 48
361, 1000, 43, 43
362, 1000, 49, 49
363, 1000, 50, 51
364, 1000, 38, 38
365, 1000, 48, 46
366, 1000, 41, 40
367, 1000, 45, 45
368, 1000, 44, 45
369, 1000, 45, 42
370, 1000, 62, 61
371, 1000, 46, 47
372, 1000, 57, 57
373, 1000, 38, 39
374, 1000, 54, 54
375, 1000, 48, 49
376, 1000, 43, 42
377, 1000, 43, 41
378, 1000, 42, 41
379, 1000, 47, 50
380, 1000, 49, 51
381, 1000, 62, 62
382, 1000, 44, 44
383, 1000, 37, 38
384, 1000, 38, 40
385, 1000, 43, 43
386, 1000, 41, 42
387, 1000, 39, 41
388, 1000, 47, 48
389, 1000, 38, 38
390, 1000, 48, 47
391, 1000, 43, 44
392, 1000, 38, 37
393, 1000, 44, 44
394, 1000, 49, 51
395, 1000, 46, 45
396, 1000, 43, 42
397, 1000, 43, 44
398, 1000, 41, 40
399, 1000, 48, 46
400, 1000, 46, 46
401, 1000, 53, 54
402, 1000, 46, 47
403, 1000, 49, 49
404, 1000, 35, 35
405, 1000, 42, 42
406, 1000, 45, 45
407, 1000, 30, 32
408, 1000, 38, 38
409, 1000, 34, 34
410, 1000, 43, 43
411, 1000, 38, 39
412, 1000, 52, 54
413, 1000, 40, 40
414, 1000, 47, 48
415, 1000, 35, 35
416, 1000, 41, 41
417, 1000, 39, 41
418, 1000, 50, 51
419, 1000, 42, 40
420, 1000, 50, 49
421, 1000, 37, 36
422, 1000, 39, 38
423, 1000, 63, 60
424, 1000, 47, 48
425, 1000, 53, 51
426, 1000, 47, 47
427, 1000, 54, 53
428, 1000, 51, 53
429, 1000, 54, 55
430, 1000, 56, 56
431, 1000, 33, 33
432, 1000, 46, 47
433, 1000, 50, 49
434, 1000, 57, 59
435, 1000, 46, 47
436, 1000, 34, 34
437, 1000, 46, 46
438, 1000, 49, 49
439, 1000, 38, 40
440, 1000, 46, 48
441, 1000, 39, 37
442, 1000, 50, 49
443, 1000, 39, 39
444, 1000, 48, 48
445, 1000, 49, 49
446, 1000, 48, 47
447, 1000, 40, 40
448, 1000, 47, 48
449, 1000, 47, 45
450, 1000, 47, 45
451, 1000, 52, 52
452, 1000, 54, 51
453, 1000, 46, 47
454, 1000, 48, 49
455, 1000, 37, 38
456, 1000, 40, 41
457, 1000, 41, 41
458, 1000, 39, 39
459, 1000, 42, 44
460, 1000, 41, 41
461, 1000, 48, 47
462, 1000, 50, 51
463, 1000, 48, 49
464, 1000, 43, 44
465, 1000, 36, 35
466, 1000, 43, 42
467, 1000, 47, 48
468, 1000, 57, 58
469, 1000, 44, 44
470, 1000, 41, 42
471, 1000, 45, 47
472, 1000, 41, 40
473, 1000, 57, 57
474, 1000, 40, 39
475, 1000, 46, 46
476, 1000, 37, 37
477, 1000, 54, 51
478, 1000, 39, 38
479, 1000, 37, 37
480, 1000, 59, 56
481, 1000, 42, 40
482, 1000, 47, 46
483, 1000, 45, 44
484, 1000, 45, 46
485, 1000, 59, 57
486, 1000, 44, 44
487, 1000, 51, 52
488, 1000, 43, 44
489, 1000, 51, 50
490, 1000, 50, 49
491, 1000, 53, 54
492, 1000, 37, 39
493, 1000, 52, 51
494, 1000, 44, 43
495, 1000, 32, 34
496, 1000, 51, 51
497, 1000, 44, 45
498, 1000, 39, 40
499, 1000, 48, 52
500, 1000, 37, 38
501, 1000, 53, 56
502, 1000, 45, 43
503, 1000, 42, 43
504, 1000, 36, 37
505, 1000, 60, 60
506, 1000, 38, 40
507, 1000, 41, 41
508, 1000, 50, 52
509, 1000, 39, 43
510, 1000, 42, 42
511, 1000, 46, 48
512, 1000, 44, 48
513, 1000, 48, 45
514, 1000, 49, 50
515, 1000, 68, 67
516, 1000, 47, 49
517, 1000, 49, 47
518, 1000, 43, 44
519, 1000, 42, 41
520, 1000, 56, 59
521, 1000, 45, 45
522, 1000, 50, 49
523, 1000, 45, 47
524, 1000, 53, 54
525, 1000, 38, 35
526, 1000, 55, 56
527, 1000, 44, 44
528, 1000, 43, 44
529, 1000, 49, 48
530, 1000, 41, 42
531, 1000, 49, 50
532, 1000, 37, 37
533, 1000, 46, 45
534, 1000, 51, 53
535, 1000, 37, 39
536, 1000, 49, 49
537, 1000, 53, 54
538, 1000, 51, 53
539, 1000, 45, 46
540, 1000, 39, 41
541, 1000, 54, 53
542, 1000, 37, 37
543, 1000, 46, 45
544, 1000, 49, 48
545, 1000, 46, 46
546, 1000, 42, 43
547, 1000, 49, 48
548, 1000, 45, 45
549, 1000, 49, 48
550, 1000, 48, 49
551, 1000, 44, 46
552, 1000, 46, 45
553, 1000, 53, 53
554, 1000, 45, 46
555, 1000, 37, 38
556, 1000, 39, 39
557, 1000, 44, 45
558, 1000, 44, 46
559, 1000, 43, 45
560, 1000, 35, 36
561, 1000, 52, 52
562, 1000, 43, 42
563, 1000, 47, 45
564, 1000, 52, 52
565, 1000, 39, 39
566, 1000, 42, 44
567, 1000, 45, 45
568, 1000, 37, 37
569, 1000, 52, 49
570, 1000, 33, 33
571, 1000, 40, 41
572, 1000, 39, 41
573, 1000, 57, 56
574, 1000, 55, 54
575, 1000, 49, 50
576, 1000, 54, 53
577, 1000, 48, 46
578, 1000, 49, 49
579, 1000, 47, 46
580, 1000, 34, 35
581, 1000, 48, 48
582, 1000, 51, 52
583, 1000, 53, 53
584, 1000, 51, 49
585, 1000, 44, 48
586, 1000, 54, 53
587, 1000, 43, 42
588, 1000, 44, 47
589, 1000, 46, 45
590, 1000, 49, 47
591, 1000, 62, 60
592, 1000, 46, 45
593, 1000, 40, 40
594, 1000, 51, 54
595, 1000, 43, 42
596, 1000, 38, 40
597, 1000, 48, 50
598, 1000, 39, 42
599, 1000, 45, 47
600, 1000, 49, 47
601, 1000, 55, 55
602, 1000, 37, 38
603, 1000, 42, 43
604, 1000, 52, 50
605, 1000, 42, 44
606, 1000, 41, 41
607, 1000, 43, 43
608, 1000, 52, 51
609, 1000, 49, 48
610, 1000, 44, 43
611, 1000, 57, 57
612, 1000, 42, 41
613, 1000, 50, 53
614, 1000, 39, 40
615, 1000, 42, 43
616, 1000, 47, 47
617, 1000, 53, 56
618, 1000, 48, 48
619, 1000, 33, 33
620, 1000, 48, 46
621, 1000, 51, 49
622, 1000, 42, 40
623, 1000, 51, 53
624, 1000, 55, 54
625, 1000, 58, 59
626, 1000, 50, 48
627, 1000, 38, 37
628, 1000, 47, 47
629, 1000, 45, 45
630, 1000, 52, 53
631, 1000, 59, 58
632, 1000, 41, 43
633, 1000, 41, 40
634, 1000, 49, 50
635, 1000, 47, 48
636, 1000, 54, 54
637, 1000, 60, 61
638, 1000, 38, 37
639, 1000, 53, 55
640, 1000, 52, 54
641, 1000, 51, 51
642, 1000, 59, 60
643, 1000, 38, 39
644, 1000, 52, 54
645, 1000, 51, 50
646, 1000, 54, 54
647, 1000, 39, 40
648, 1000, 38, 39
649, 1000, 36, 39
650, 1000, 48, 48
651, 1000, 52, 53
652, 1000, 46, 46
653, 1000, 45, 45
654, 1000, 56, 58
655, 1000, 38, 38
656, 1000, 42, 43
657, 1000, 64, 65
658, 1000, 46, 48
659, 1000, 59, 61
660, 1000, 48, 49
661, 1000, 46, 44
662, 1000, 53, 55
663, 1000, 44, 46
664, 1000, 48, 50
665, 1000, 55, 52
666, 1000, 47, 47
667, 1000, 43, 45
668, 1000, 30, 30
669, 1000, 45, 46
670, 1000, 39, 40
671, 1000, 32, 33
672, 1000, 29, 29
673, 1000, 45, 48
674, 1000, 44, 45
675, 1000, 43, 47
676, 1000, 66, 67
677, 1000, 48, 53
678, 1000, 50, 49
679, 1000, 53, 51
680, 1000, 41, 42
681, 1000, 52, 54
682, 1000, 51, 52
683, 1000, 44, 44
684, 1000, 47, 47
685, 1000, 33, 33
686, 1000, 46, 47
687, 1000, 47, 46
688, 1000, 47, 49
689, 1000, 45, 46
690, 1000, 40, 41
691, 1000, 37, 41
692, 1000, 46, 47
693, 1000, 51, 50
694, 1000, 43, 48
695, 1000, 37, 37
696, 1000, 58, 60
697, 1000, 56, 58
698, 1000, 51, 50
699, 1000, 47, 47
700, 1000, 43, 43
701, 1000, 44, 42
702, 1000, 55, 54
703, 1000, 44, 44
704, 1000, 50, 50
705, 1000, 49, 51
706, 1000, 37, 38
707, 1000, 51, 49
708, 1000, 44, 45
709, 1000, 49, 49
710, 1000, 54, 58
711, 1000, 34, 34
712, 1000, 47, 49
713, 1000, 39, 40
714, 1000, 43, 44
715, 1000, 45, 45
716, 1000, 39, 38
717, 1000, 45, 45
718, 1000, 46, 46
719, 1000, 49, 53
720, 1000, 48, 46
721, 1000, 45, 44
722, 1000, 45, 45
723, 1000, 48, 49
724, 1000, 38, 37
725, 1000, 41, 40
726, 1000, 46, 44
727, 1000, 46, 51
728, 1000, 43, 42
729, 1000, 53, 57
730, 1000, 44, 44
731, 1000, 45, 45
732, 1000, 56, 53
733, 1000, 54, 55
734, 1000, 43, 42
735, 1000, 47, 48
736, 1000, 40, 38
737, 1000, 40, 42
738, 1000, 43, 42
739, 1000, 49, 49
740, 1000, 39, 38
741, 1000, 40, 40
742, 1000, 44, 44
743, 1000, 47, 45
744, 1000, 45, 44
745, 1000, 43, 43
746, 1000, 39, 40
747, 1000, 44, 43
748, 1000, 54, 54
749, 1000, 57, 58
750, 1000, 47, 47
751, 1000, 57, 56
752, 1000, 46, 46
753, 1000, 44, 43
754, 1000, 39, 39
755, 1000, 45, 46
756, 1000, 50, 51
757, 1000, 52, 52
758, 1000, 46, 46
759, 1000, 38, 39
760, 1000, 38, 38
761, 1000, 47, 46
762, 1000, 46, 48
763, 1000, 42, 44
764, 1000, 43, 45
765, 1000, 51, 52
766, 1000, 37, 37
767, 1000, 37, 38
768, 1000, 44, 44
769, 1000, 34, 34
770, 1000, 44, 44
771, 1000, 54, 54
772, 1000, 43, 43
773, 1000, 42, 44
774, 1000, 48, 48
775, 1000, 50, 50
776, 1000, 54, 55
777, 1000, 47, 45
778, 1000, 59, 60
779, 1000, 44, 45
780, 1000, 41, 42
781, 1000, 36, 37
782, 1000, 43, 43
783, 1000, 42, 42
784, 1000, 52, 54
785, 1000, 39, 41
786, 1000, 51, 50
787, 1000, 40, 39
788, 1000, 47, 50
789, 1000, 60, 60
790, 1000, 46, 47
791, 1000, 56, 57
792, 1000, 46, 49
793, 1000, 48, 49
794, 1000, 50, 49
795, 1000, 52, 51
796, 1000, 31, 33
797, 1000, 41, 42
798, 1000, 43, 43
799, 1000, 52, 51
800, 1000, 45, 46
801, 1000, 41, 40
802, 1000, 65, 62
803, 1000, 49, 46
804, 1000, 52, 54
805, 1000, 53, 53
806, 1000, 47, 46
807, 1000, 52, 51
808, 1000, 50, 51
809, 1000, 49, 49
810, 1000, 41, 41
811, 1000, 38, 39
812, 1000, 36, 34
813, 1000, 32, 33
814, 1000, 60, 61
815, 1000, 43, 42
816, 1000, 32, 33
817, 1000, 41, 43
818, 1000, 47, 47
819, 1000, 51, 55
820, 1000, 38, 37
821, 1000, 44, 45
822, 1000, 39, 39
823, 1000, 50, 49
824, 1000, 49, 50
825, 1000, 38, 39
826, 1000, 40, 40
827, 1000, 46, 44
828, 1000, 43, 44
829, 1000, 50, 49
830, 1000, 46, 46
831, 1000, 37, 36
832, 1000, 50, 52
833, 1000, 50, 50
834, 1000, 52, 53
835, 1000, 46, 46
836, 1000, 52, 49
837, 1000, 39, 40
838, 1000, 41, 40
839, 1000, 48, 48
840, 1000, 57, 59
841, 1000, 48, 47
842, 1000, 52, 52
843, 1000, 61, 62
844, 1000, 47, 46
845, 1000, 53, 51
846, 1000, 53, 55
847, 1000, 48, 47
848, 1000, 45, 45
849, 1000, 39, 41
850, 1000, 44, 42
851, 1000, 50, 50
852, 1000, 39, 38
853, 1000, 50, 51
854, 1000, 52, 52
855, 1000, 44, 44
856, 1000, 49, 47
857, 1000, 52, 52
858, 1000, 45, 48
859, 1000, 51, 51
860, 1000, 45, 44
861, 1000, 34, 35
862, 1000, 51, 50
863, 1000, 35, 36
864, 1000, 40, 40
865, 1000, 35, 38
866, 1000, 41, 42
867, 1000, 40, 39
868, 1000, 48, 50
869, 1000, 49, 49
870, 1000, 51, 51
871, 1000, 47, 49
872, 1000, 59, 55
873, 1000, 53, 53
874, 1000, 35, 35
875, 1000, 58, 58
876, 1000, 48, 50
877, 1000, 51, 51
878, 1000, 51, 51
879, 1000, 43, 45
880, 1000, 41, 44
881, 1000, 39, 38
882, 1000, 38, 39
883, 1000, 63, 63
884, 1000, 48, 48
885, 1000, 45, 46
886, 1000, 39, 41
887, 1000, 54, 55
888, 1000, 53, 52
889, 1000, 34, 34
890, 1000, 61, 59
891, 1000, 32, 34
892, 1000, 37, 38
893, 1000, 46, 46
894, 1000, 47, 48
895, 1000, 41, 42
896, 1000, 48, 46
897, 1000, 49, 52
898, 1000, 48, 46
899, 1000, 42, 46
900, 1000, 37, 39
901, 1000, 56, 57
902, 1000, 33, 33
903, 1000, 40, 40
904, 1000, 57, 57
905, 1000, 50, 53
906, 1000, 38, 39
907, 1000, 44, 46
908, 1000, 46, 47
909, 1000, 48, 50
910, 1000, 46, 43
911, 1000, 58, 55
912, 1000, 30, 30
913, 1000, 43, 41
914, 1000, 47, 46
915, 1000, 60, 59
916, 1000, 41, 40
917, 1000, 45, 44
918, 1000, 54, 53
919, 1000, 44, 43
920, 1000, 47, 49
921, 1000, 53, 56
922, 1000, 48, 49
923, 1000, 45, 47
924, 1000, 39, 38
925, 1000, 49, 48
926, 1000, 38, 38
927, 1000, 46, 46
928, 1000, 42, 40
929, 1000, 39, 39
930, 1000, 48, 49
931, 1000, 43, 43
932, 1000, 57, 57
933, 1000, 56, 58
934, 1000, 38, 39
935, 1000, 59, 57
936, 1000, 44, 44
937, 1000, 35, 33
938, 1000, 53, 54
939, 1000, 52, 52
940, 1000, 41, 42
941, 1000, 54, 55
942, 1000, 44, 42
943, 1000, 58, 59
944, 1000, 43, 45
945, 1000, 48, 50
946, 1000, 41, 40
947, 1000, 52, 55
948, 1000, 50, 51
949, 1000, 46, 47
950, 1000, 53, 53
951, 1000, 34, 34
952, 1000, 37, 37
953, 1000, 50, 51
954, 1000, 32, 31
955, 1000, 46, 47
956, 1000, 46, 48
957, 1000, 41, 41
958, 1000, 41, 39
959, 1000, 47, 47
960, 1000, 44, 43
961, 1000, 47, 47
962, 1000, 40, 40
963, 1000, 36, 37
964, 1000, 56, 58
965, 1000, 50, 50
966, 1000, 49, 49
967, 1000, 48, 48
968, 1000, 47, 48
969, 1000, 55, 54
970, 1000, 33, 34
971, 1000, 48, 47
972, 1000, 42, 40
973, 1000, 37, 38
974, 1000, 45, 44
975, 1000, 48, 48
976, 1000, 37, 36
977, 1000, 48, 48
978, 1000, 45, 44
979, 1000, 45, 46
980, 1000, 46, 48
981, 1000, 40, 40
982, 1000, 48, 48
983, 1000, 43, 47
984, 1000, 53, 51
985, 1000, 41, 44
986, 1000, 44, 42
987, 1000, 39, 38
988, 1000, 44, 43
989, 1000, 42, 42
990, 1000, 46, 45
991, 1000, 35, 38
992, 1000, 45, 43
993, 1000, 50, 51
994, 1000, 38, 41
995, 1000, 43, 44
996, 1000, 47, 47
997, 1000, 62, 62
998, 1000, 46, 46
999, 1000, 53, 53
1000, 1000, 47, 48
1001, 500, 18, 20
1002, 500, 23, 23
1003, 500, 18, 18
1004, 500, 23, 22
1005, 500, 25, 25
1006, 500, 28, 26
1007, 500, 24, 24
1008, 500, 26, 25
1009, 500, 23, 23
1010, 500, 33, 33
1011, 500, 26, 26
1012, 500, 30, 31
1013, 500, 21, 21
1014, 500, 25, 25
1015, 500, 15, 15
1016, 500, 20, 20
1017, 500, 36, 37
1018, 500, 18, 18
1019, 500, 22, 21
1020, 500, 17, 19
1021, 500, 18, 19
1022, 500, 36, 34
1023, 500, 26, 27
1024, 500, 24, 24
1025, 500, 23, 25
1026, 500, 22, 21
1027, 500, 22, 22
1028, 500, 31, 32
1029, 500, 27, 26
1030, 500, 24, 24
1031, 500, 21, 21
1032, 500, 23, 23
1033, 500, 30, 30
1034, 500, 16, 15
1035, 500, 20, 19
1036, 500, 29, 28
1037, 500, 19, 20
1038, 500, 20, 21
1039, 500, 17, 16
1040, 500, 25, 25
1041, 500, 20, 20
1042, 500, 22, 24
1043, 500, 18, 18
1044, 500, 23, 23
1045, 500, 27, 25
1046, 500, 33, 33
1047, 500, 20, 20
1048, 500, 21, 20
1049, 500, 22, 20
1050, 500, 21, 19
1051, 500, 25, 24
1052, 500, 20, 20
1053, 500, 29, 28
1054, 500, 22, 23
1055, 500, 22, 23
1056, 500, 25, 25
1057, 500, 32, 32
1058, 500, 28, 27
1059, 500, 27, 27
1060, 500, 25, 26
1061, 500, 23, 23
1062, 500, 21, 21
1063, 500, 21, 20
1064, 500, 19, 19
1065, 500, 19, 19
1066, 500, 20, 21
1067, 500, 14, 15
1068, 500, 32, 31
1069, 500, 22, 21
1070, 500, 21, 21
1071, 500, 25, 26
1072, 500, 22, 23
1073, 500, 25, 24
1074, 500, 26, 26
1075, 500, 19, 20
1076, 500, 23, 24
1077, 500, 24, 25
1078, 500, 19, 21
1079, 500, 31, 30
1080, 500, 31, 33
1081, 500, 24, 23
1082, 500, 24, 24
1083, 500, 24, 23
1084, 500, 31, 29
1085, 500, 30, 29
1086, 500, 29, 30
1087, 500, 20, 20
1088, 500, 25, 25
1089, 500, 23, 23
1090, 500, 18, 18
1091, 500, 34, 32
1092, 500, 25, 24
1093, 500, 21, 21
1094, 500, 26, 27
1095, 500, 22, 22
1096, 500, 30, 31
1097, 500, 29, 30
1098, 500, 24, 22
1099, 500, 25, 25
1100, 500, 26, 25
1101, 500, 18, 19
1102, 500, 19, 20
1103, 500, 24, 24
1104, 500, 27, 27
1105, 500, 24, 25
1106, 500, 21, 22
1107, 500, 28, 28
1108, 500, 30, 30
1109, 500, 21, 19
1110, 500, 21, 21
1111, 500, 35, 36
1112, 500, 17, 18
1113, 500, 16, 16
1114, 500, 26, 26
1115, 500, 20, 20
1116, 500, 14, 14
1117, 500, 22, 22
1118, 500, 25, 25
1119, 500, 25, 25
1120, 500, 21, 21
1121, 500, 25, 25
1122, 500, 18, 19
1123, 500, 21, 21
1124, 500, 25, 26
1125, 500, 25, 24
1126, 500, 28, 29
1127, 500, 20, 21
1128, 500, 24, 24
1129, 500, 26, 26
1130, 500, 24, 23
1131, 500, 19, 21
1132, 500, 20, 20
1133, 500, 23, 24
1134, 500, 19, 19
1135, 500, 20, 20
1136, 500, 25, 25
1137, 500, 24, 25
1138, 500, 22, 22
1139, 500, 27, 28
1140, 500, 26, 26
1141, 500, 25, 25
1142, 500, 22, 20
1143, 500, 20, 20
1144, 500, 18, 18
1145, 500, 21, 21
1146, 500, 18, 18
1147, 500, 15, 16
1148, 500, 21, 21
1149, 500, 28, 28
1150, 500, 30, 30
1151, 500, 26, 26
1152, 500, 24, 24
1153, 500, 19, 18
1154, 500, 17, 17
1155, 500, 18, 19
1156, 500, 21, 24
1157, 500, 29, 29
1158, 500, 23, 22
1159, 500, 17, 18
1160, 500, 21, 22
1161, 500, 28, 28
1162, 500, 25, 26
1163, 500, 26, 26
1164, 500, 20, 20
1165, 500, 20, 20
1166, 500, 25, 25
1167, 500, 23, 24
1168, 500, 31, 30
1169, 500, 25, 24
1170, 500, 22, 22
1171, 500, 18, 18
1172, 500, 22, 24
1173, 500, 23, 24
1174, 500, 20, 19
1175, 500, 24, 25
1176, 500, 32, 31
1177, 500, 20, 23
1178, 500, 19, 20
1179, 500, 20, 21
1180, 500, 24, 24
1181, 500, 24, 24
1182, 500, 21, 22
1183, 500, 21, 21
1184, 500, 24, 23
1185, 500, 19, 19
1186, 500, 19, 20
1187, 500, 17, 17
1188, 500, 27, 26
1189, 500, 25, 25
1190, 500, 18, 19
1191, 500, 33, 32
1192, 500, 24, 23
1193, 500, 25, 26
1194, 500, 26, 24
1195, 500, 15, 14
1196, 500, 20, 21
1197, 500, 21, 21
1198, 500, 30, 30
1199, 500, 26, 27
1200, 500, 33, 34
1201, 500, 13, 13
1202, 500, 26, 27
1203, 500, 18, 18
1204, 500, 20, 20
1205, 500, 16, 18
1206, 500, 27, 28
1207, 500, 25, 25
1208, 500, 28, 27
1209, 500, 31, 32
1210, 500, 22, 22
1211, 500, 20, 20
1212, 500, 24, 24
1213, 500, 29, 30
1214, 500, 29, 29
1215, 500, 16, 16
1216, 500, 16, 16
1217, 500, 24, 23
1218, 500, 27, 27
1219, 500, 33, 33
1220, 500, 21, 21
1221, 500, 29, 30
1222, 500, 20, 19
1223, 500, 27, 27
1224, 500, 18, 18
1225, 500, 25, 24
1226, 500, 20, 19
1227, 500, 29, 27
1228, 500, 36, 36
1229, 500, 22, 22
1230, 500, 21, 21
1231, 500, 25, 23
1232, 500, 26, 26
1233, 500, 26, 26
1234, 500, 18, 17
1235, 500, 30, 30
1236, 500, 24, 24
1237, 500, 20, 21
1238, 500, 19, 20
1239, 500, 27, 26
1240, 500, 22, 20
1241, 500, 20, 21
1242, 500, 21, 20
1243, 500, 23, 23
1244, 500, 24, 23
1245, 500, 21, 21
1246, 500, 18, 18
1247, 500, 26, 25
1248, 500, 23, 23
1249, 500, 23, 24
1250, 500, 23, 23
1251, 500, 15, 14
1252, 500, 27, 27
1253, 500, 34, 33
1254, 500, 21, 21
1255, 500, 21, 21
1256, 500, 19, 19
1257, 500, 23, 26
1258, 500, 23, 24
1259, 500, 19, 19
1260, 500, 20, 19
1261, 500, 32, 32
1262, 500, 29, 32
1263, 500, 24, 24
1264, 500, 26, 26
1265, 500, 16, 16
1266, 500, 26, 26
1267, 500, 18, 18
1268, 500, 16, 16
1269, 500, 18, 19
1270, 500, 29, 27
1271, 500, 21, 22
1272, 500, 18, 19
1273, 500, 27, 27
1274, 500, 17, 16
1275, 500, 23, 22
1276, 500, 33, 34
1277, 500, 19, 19
1278, 500, 24, 24
1279, 500, 22, 22
1280, 500, 13, 12
1281, 500, 24, 24
1282, 500, 24, 24
1283, 500, 21, 23
1284, 500, 25, 25
1285, 500, 29, 29
1286, 500, 15, 15
1287, 500, 15, 15
1288, 500, 32, 31
1289, 500, 19, 18
1290, 500, 25, 25
1291, 500, 25, 25
1292, 500, 22, 22
1293, 500, 19, 19
1294, 500, 28, 28
1295, 500, 23, 25
1296, 500, 21, 21
1297, 500, 17, 18
1298, 500, 22, 22
1299, 500, 19, 19
1300, 500, 16, 16
1301, 500, 26, 25
1302, 500, 27, 26
1303, 500, 31, 30
1304, 500, 25, 26
1305, 500, 22, 23
1306, 500, 27, 27
1307, 500, 25, 27
1308, 500, 24, 23
1309, 500, 23, 23
1310, 500, 33, 33
1311, 500, 21, 23
1312, 500, 13, 12
1313, 500, 20, 20
1314, 500, 22, 22
1315, 500, 23, 22
1316, 500, 34, 32
1317, 500, 19, 19
1318, 500, 25, 24
1319, 500, 40, 38
1320, 500, 26, 26
1321, 500, 28, 29
1322, 500, 25, 25
1323, 500, 26, 24
1324, 500, 17, 18
1325, 500, 27, 27
1326, 500, 18, 20
1327, 500, 37, 33
1328, 500, 23, 23
1329, 500, 23, 23
1330, 500, 24, 24
1331, 500, 16, 16
1332, 500, 27, 27
1333, 500, 20, 20
1334, 500, 27, 27
1335, 500, 28, 27
1336, 500, 31, 30
1337, 500, 20, 20
1338, 500, 21, 20
1339, 500, 26, 26
1340, 500, 18, 18
1341, 500, 21, 21
1342, 500, 20, 20
1343, 500, 23, 24
1344, 500, 25, 25
1345, 500, 33, 33
1346, 500, 21, 20
1347, 500, 20, 19
1348, 500, 18, 17
1349, 500, 21, 22
1350, 500, 26, 24
1351, 500, 19, 21
1352, 500, 24, 24
1353, 500, 20, 19
1354, 500, 17, 17
1355, 500, 29, 30
1356, 500, 23, 22
1357, 500, 23, 23
1358, 500, 23, 23
1359, 500, 27, 26
1360, 500, 30, 29
1361, 500, 21, 20
1362, 500, 17, 17
1363, 500, 22, 23
1364, 500, 22, 22
1365, 500, 20, 20
1366, 500, 31, 33
1367, 500, 19, 19
1368, 500, 24, 23
1369, 500, 20, 22
1370, 500, 24, 24
1371, 500, 25, 24
1372, 500, 21, 21
1373, 500, 30, 30
1374, 500, 27, 28
1375, 500, 21, 21
1376, 500, 11, 11
1377, 500, 24, 24
1378, 500, 27, 30
1379, 500, 20, 21
1380, 500, 16, 17
1381, 500, 23, 24
1382, 500, 24, 24
1383, 500, 23, 24
1384, 500, 19, 19
1385, 500, 27, 29
1386, 500, 20, 20
1387, 500, 20, 22
1388, 500, 26, 26
1389, 500, 21, 20
1390, 500, 24, 25
1391, 500, 33, 32
1392, 500, 20, 21
1393, 500, 16, 16
1394, 500, 25, 28
1395, 500, 16, 17
1396, 500, 23, 23
1397, 500, 23, 25
1398, 500, 21, 20
1399, 500, 24, 24
1400, 500, 24, 24
1401, 500, 26, 26
1402, 500, 20, 21
1403, 500, 21, 21
1404, 500, 15, 15
1405, 500, 27, 25
1406, 500, 27, 28
1407, 500, 26, 27
1408, 500, 23, 24
1409, 500, 30, 28
1410, 500, 23, 22
1411, 500, 26, 26
1412, 500, 31, 29
1413, 500, 23, 23
1414, 500, 21, 21
1415, 500, 27, 26
1416, 500, 25, 26
1417, 500, 15, 16
1418, 500, 36, 36
1419, 500, 23, 23
1420, 500, 20, 20
1421, 500, 21, 20
1422, 500, 30, 31
1423, 500, 28, 26
1424, 500, 24, 25
1425, 500, 17, 17
1426, 500, 20, 20
1427, 500, 20, 21
1428, 500, 23, 23
1429, 500, 20, 21
1430, 500, 21, 21
1431, 500, 27, 29
1432, 500, 22, 22
1433, 500, 22, 23
1434, 500, 33, 35
1435, 500, 27, 27
1436, 500, 16, 16
1437, 500, 28, 28
1438, 500, 24, 24
1439, 500, 21, 21
1440, 500, 25, 26
1441, 500, 21, 20
1442, 500, 25, 24
1443, 500, 17, 16
1444, 500, 19, 19
1445, 500, 22, 22
1446, 500, 21, 19
1447, 500, 20, 19
1448, 500, 30, 29
1449, 500, 32, 31
1450, 500, 23, 23
1451, 500, 20, 20
1452, 500, 18, 19
1453, 500, 27, 28
1454, 500, 19, 18
1455, 500, 34, 33
1456, 500, 20, 20
1457, 500, 28, 28
1458, 500, 22, 22
1459, 500, 28, 27
1460, 500, 26, 25
1461, 500, 19, 19
1462, 500, 21, 21
1463, 500, 16, 16
1464, 500, 19, 20
1465, 500, 33, 31
1466, 500, 22, 23
1467, 500, 15, 15
1468, 500, 27, 27
1469, 500, 22, 22
1470, 500, 17, 17
1471, 500, 22, 22
1472, 500, 16, 17
1473, 500, 19, 18
1474, 500, 28, 27
1475, 500, 21, 22
1476, 500, 22, 23
1477, 500, 18, 18
1478, 500, 15, 15
1479, 500, 26, 26
1480, 500, 27, 28
1481, 500, 19, 19
1482, 500, 32, 32
1483, 500, 34, 32
1484, 500, 21, 22
1485, 500, 20, 20
1486, 500, 18, 17
1487, 500, 22, 22
1488, 500, 24, 25
1489, 500, 15, 15
1490, 500, 19, 20
1491, 500, 28, 25
1492, 500, 25, 24
1493, 500, 21, 21
1494, 500, 31, 31
1495, 500, 26, 26
1496, 500, 30, 29
1497, 500, 21, 22
1498, 500, 20, 20
1499, 500, 21, 21
1500, 500, 29, 32
1501, 500, 25, 25
1502, 500, 21, 21
1503, 500, 20, 20
1504, 500, 21, 21
1505, 500, 19, 20
1506, 500, 26, 28
1507, 500, 22, 22
1508, 500, 19, 20
1509, 500, 18, 18
1510, 500, 23, 22
1511, 500, 29, 29
1512, 500, 25, 25
1513, 500, 29, 27
1514, 500, 19, 19
1515, 500, 33, 31
1516, 500, 17, 17
1517, 500, 23, 24
1518, 500, 21, 20
1519, 500, 25, 26
1520, 500, 27, 26
1521, 500, 19, 19
1522, 500, 23, 23
1523, 500, 26, 26
1524, 500, 26, 27
1525, 500, 28, 29
1526, 500, 22, 22
1527, 500, 18, 19
1528, 500, 22, 22
1529, 500, 17, 18
1530, 500, 22, 23
1531, 500, 19, 20
1532, 500, 26, 26
1533, 500, 26, 25
1534, 500, 30, 30
1535, 500, 19, 19
1536, 500, 26, 26
1537, 500, 32, 31
1538, 500, 15, 15
1539, 500, 19, 19
1540, 500, 28, 27
1541, 500, 22, 22
1542, 500, 16, 16
1543, 500, 39, 35
1544, 500, 27, 26
1545, 500, 22, 21
1546, 500, 16, 16
1547, 500, 24, 23
1548, 500, 34, 35
1549, 500, 21, 21
1550, 500, 22, 22
1551, 500, 22, 22
1552, 500, 21, 21
1553, 500, 30, 31
1554, 500, 26, 26
1555, 500, 23, 23
1556, 500, 26, 25
1557, 500, 23, 24
1558, 500, 20, 20
1559, 500, 31, 30
1560, 500, 29, 27
1561, 500, 23, 23
1562, 500, 18, 18
1563, 500, 21, 22
1564, 500, 21, 20
1565, 500, 20, 21
1566, 500, 25, 25
1567, 500, 24, 24
1568, 500, 30, 30
1569, 500, 19, 18
1570, 500, 23, 23
1571, 500, 29, 29
1572, 500, 25, 24
1573, 500, 21, 21
1574, 500, 31, 30
1575, 500, 22, 22
1576, 500, 15, 15
1577, 500, 23, 22
1578, 500, 24, 26
1579, 500, 22, 22
1580, 500, 26, 26
1581, 500, 24, 24
1582, 500, 23, 23
1583, 500, 27, 27
1584, 500, 27, 27
1585, 500, 25, 27
1586, 500, 16, 16
1587, 500, 21, 21
1588, 500, 21, 22
1589, 500, 21, 23
1590, 500, 21, 20
1591, 500, 37, 37
1592, 500, 30, 29
1593, 500, 19, 18
1594, 500, 20, 21
1595, 500, 29, 29
1596, 500, 23, 24
1597, 500, 25, 24
1598, 500, 29, 27
1599, 500, 23, 25
1600, 500, 34, 33
1601, 500, 19, 20
1602, 500, 23, 22
1603, 500, 16, 16
1604, 500, 18, 18
1605, 500, 28, 28
1606, 500, 29, 27
1607, 500, 26, 26
1608, 500, 24, 24
1609, 500, 18, 19
1610, 500, 25, 24
1611, 500, 24, 25
1612, 500, 40, 39
1613, 500, 19, 19
1614, 500, 26, 26
1615, 500, 19, 18
1616, 500, 30, 30
1617, 500, 16, 16
1618, 500, 36, 36
1619, 500, 21, 21
1620, 500, 20, 21
1621, 500, 27, 27
1622, 500, 22, 21
1623, 500, 27, 25
1624, 500, 30, 31
1625, 500, 22, 21
1626, 500, 13, 13
1627, 500, 29, 29
1628, 500, 28, 28
1629, 500, 18, 17
1630, 500, 23, 22
1631, 500, 21, 21
1632, 500, 27, 29
1633, 500, 20, 21
1634, 500, 26, 28
1635, 500, 28, 29
1636, 500, 21, 21
1637, 500, 30, 30
1638, 500, 25, 24
1639, 500, 15, 15
1640, 500, 28, 28
1641, 500, 22, 22
1642, 500, 26, 26
1643, 500, 34, 31
1644, 500, 26, 26
1645, 500, 20, 20
1646, 500, 22, 20
1647, 500, 22, 24
1648, 500, 32, 32
1649, 500, 19, 19
1650, 500, 22, 22
1651, 500, 20, 20
1652, 500, 27, 28
1653, 500, 11, 12
1654, 500, 28, 27
1655, 500, 18, 18
1656, 500, 25, 25
1657, 500, 17, 16
1658, 500, 17, 18
1659, 500, 17, 18
1660, 500, 18, 18
1661, 500, 19, 19
1662, 500, 21, 21
1663, 500, 11, 12
1664, 500, 25, 26
1665, 500, 16, 17
1666, 500, 25, 26
1667, 500, 23, 23
1668, 500, 19, 19
1669, 500, 26, 26
1670, 500, 22, 23
1671, 500, 22, 22
1672, 500, 12, 15
1673, 500, 22, 24
1674, 500, 24, 24
1675, 500, 16, 16
1676, 500, 27, 26
1677, 500, 20, 19
1678, 500, 28, 29
1679, 500, 28, 28
1680, 500, 27, 27
1681, 500, 21, 21
1682, 500, 22, 22
1683, 500, 18, 18
1684, 500, 22, 21
1685, 500, 21, 21
1686, 500, 25, 25
1687, 500, 26, 25
1688, 500, 23, 24
1689, 500, 17, 17
1690, 500, 22, 23
1691, 500, 19, 21
1692, 500, 31, 32
1693, 500, 23, 24
1694, 500, 25, 25
1695, 500, 23, 22
1696, 500, 19, 19
1697, 500, 27, 26
1698, 500, 26, 26
1699, 500, 20, 22
1700, 500, 20, 20
1701, 500, 15, 15
1702, 500, 17, 17
1703, 500, 21, 22
1704, 500, 21, 21
1705, 500, 23, 23
1706, 500, 17, 17
1707, 500, 19, 18
1708, 500, 24, 24
1709, 500, 25, 24
1710, 500, 21, 21
1711, 500, 20, 19
1712, 500, 28, 29
1713, 500, 29, 31
1714, 500, 18, 17
1715, 500, 29, 29
1716, 500, 30, 29
1717, 500, 26, 26
1718, 500, 26, 26
1719, 500, 20, 20
1720, 500, 19, 19
1721, 500, 17, 17
1722, 500, 23, 23
1723, 500, 14, 12
1724, 500, 22, 23
1725, 500, 21, 21
1726, 500, 17, 18
1727, 500, 19, 19
1728, 500, 22, 21
1729, 500, 23, 23
1730, 500, 26, 24
1731, 500, 25, 25
1732, 500, 34, 35
1733, 500, 27, 28
1734, 500, 21, 20
1735, 500, 28, 29
1736, 500, 16, 16
1737, 500, 21, 20
1738, 500, 33, 33
1739, 500, 23, 22
1740, 500, 20, 21
1741, 500, 19, 19
1742, 500, 16, 16
1743, 500, 19, 19
1744, 500, 29, 28
1745, 500, 18, 20
1746, 500, 24, 24
1747, 500, 19, 19
1748, 500, 22, 22
1749, 500, 21, 21
1750, 500, 20, 20
1751, 500, 21, 21
1752, 500, 21, 22
1753, 500, 30, 33
1754, 500, 18, 18
1755, 500, 22, 21
1756, 500, 19, 19
1757, 500, 24, 24
1758, 500, 20, 21
1759, 500, 18, 20
1760, 500, 25, 26
1761, 500, 32, 32
1762, 500, 22, 23
1763, 500, 21, 21
1764, 500, 29, 28
1765, 500, 25, 23
1766, 500, 23, 25
1767, 500, 32, 32
1768, 500, 15, 16
1769, 500, 17, 16
1770, 500, 18, 19
1771, 500, 33, 35
1772, 500, 23, 24
1773, 500, 20, 20
1774, 500, 20, 19
1775, 500, 30, 29
1776, 500, 16, 19
1777, 500, 22, 23
1778, 500, 21, 21
1779, 500, 29, 29
1780, 500, 17, 16
1781, 500, 20, 20
1782, 500, 16, 16
1783, 500, 22, 22
1784, 500, 20, 20
1785, 500, 25, 25
1786, 500, 25, 24
1787, 500, 17, 20
1788, 500, 24, 24
1789, 500, 21, 23
1790, 500, 29, 31
1791, 500, 19, 19
1792, 500, 25, 24
1793, 500, 23, 24
1794, 500, 30, 32
1795, 500, 22, 21
1796, 500, 20, 21
1797, 500, 21, 21
1798, 500, 15, 15
1799, 500, 23, 24
1800, 500, 24, 24
1801, 500, 23, 23
1802, 500, 19, 19
1803, 500, 30, 29
1804, 500, 24, 24
1805, 500, 22, 23
1806, 500, 28, 28
1807, 500, 32, 30
1808, 500, 27, 27
1809, 500, 22, 21
1810, 500, 24, 24
1811, 500, 22, 22
1812, 500, 19, 20
1813, 500, 25, 26
1814, 500, 24, 25
1815, 500, 22, 22
1816, 500, 25, 23
1817, 500, 18, 17
1818, 500, 25, 27
1819, 500, 18, 18
1820, 500, 21, 20
1821, 500, 23, 23
1822, 500, 21, 22
1823, 500, 21, 20
1824, 500, 14, 15
1825, 500, 27, 27
1826, 500, 18, 19
1827, 500, 25, 26
1828, 500, 19, 18
1829, 500, 26, 26
1830, 500, 20, 21
1831, 500, 21, 21
1832, 500, 17, 16
1833, 500, 21, 21
1834, 500, 25, 25
1835, 500, 23, 23
1836, 500, 28, 28
1837, 500, 23, 22
1838, 500, 27, 25
1839, 500, 35, 36
1840, 500, 15, 15
1841, 500, 37, 37
1842, 500, 26, 26
1843, 500, 25, 26
1844, 500, 18, 20
1845, 500, 23, 23
1846, 500, 24, 25
1847, 500, 19, 19
1848, 500, 29, 29
1849, 500, 16, 15
1850, 500, 24, 24
1851, 500, 19, 18
1852, 500, 23, 22
1853, 500, 29, 28
1854, 500, 26, 25
1855, 500, 16, 17
1856, 500, 31, 31
1857, 500, 27, 27
1858, 500, 20, 20
1859, 500, 26, 25
1860, 500, 12, 11
1861, 500, 17, 17
1862, 500, 23, 23
1863, 500, 23, 23
1864, 500, 34, 34
1865, 500, 23, 23
1866, 500, 17, 18
1867, 500, 29, 32
1868, 500, 24, 24
1869, 500, 28, 27
1870, 500, 21, 21
1871, 500, 23, 24
1872, 500, 19, 20
1873, 500, 29, 29
1874, 500, 19, 19
1875, 500, 27, 26
1876, 500, 26, 25
1877, 500, 22, 22
1878, 500, 32, 33
1879, 500, 27, 28
1880, 500, 24, 24
1881, 500, 24, 24
1882, 500, 15, 15
1883, 500, 24, 24
1884, 500, 19, 19
1885, 500, 26, 25
1886, 500, 22, 22
1887, 500, 19, 19
1888, 500, 18, 19
1889, 500, 24, 22
1890, 500, 16, 16
1891, 500, 17, 17
1892, 500, 25, 25
1893, 500, 19, 20
1894, 500, 22, 21
1895, 500, 32, 30
1896, 500, 25, 25
1897, 500, 20, 20
1898, 500, 25, 26
1899, 500, 24, 24
1900, 500, 25, 25
1901, 500, 15, 15
1902, 500, 26, 27
1903, 500, 24, 25
1904, 500, 22, 21
1905, 500, 34, 33
1906, 500, 21, 21
1907, 500, 20, 20
1908, 500, 31, 31
1909, 500, 21, 21
1910, 500, 32, 32
1911, 500, 23, 25
1912, 500, 19, 19
1913, 500, 25, 25
1914, 500, 30, 30
1915, 500, 19, 21
1916, 500, 23, 23
1917, 500, 25, 25
1918, 500, 17, 17
1919, 500, 22, 23
1920, 500, 20, 21
1921, 500, 20, 21
1922, 500, 22, 23
1923, 500, 27, 28
1924, 500, 21, 19
1925, 500, 22, 22
1926, 500, 23, 22
1927, 500, 30, 29
1928, 500, 19, 21
1929, 500, 25, 26
1930, 500, 15, 17
1931, 500, 22, 22
1932, 500, 17, 18
1933, 500, 17, 18
1934, 500, 18, 18
1935, 500, 19, 21
1936, 500, 33, 33
1937, 500, 25, 25
1938, 500, 24, 24
1939, 500, 25, 23
1940, 500, 32, 32
1941, 500, 27, 28
1942, 500, 18, 18
1943, 500, 15, 15
1944, 500, 19, 17
1945, 500, 22, 23
1946, 500, 20, 20
1947, 500, 19, 20
1948, 500, 19, 19
1949, 500, 21, 21
1950, 500, 20, 21
1951, 500, 21, 22
1952, 500, 21, 22
1953, 500, 17, 18
1954, 500, 26, 27
1955, 500, 31, 29
1956, 500, 21, 20
1957, 500, 17, 17
1958, 500, 19, 19
1959, 500, 17, 16
1960, 500, 20, 20
1961, 500, 25, 25
1962, 500, 20, 20
1963, 500, 29, 32
1964, 500, 13, 13
1965, 500, 31, 28
1966, 500, 24, 26
1967, 500, 34, 34
1968, 500, 19, 20
1969, 500, 27, 26
1970, 500, 21, 21
1971, 500, 27, 27
1972, 500, 30, 31
1973, 500, 13, 14
1974, 500, 22, 21
1975, 500, 27, 28
1976, 500, 25, 26
1977, 500, 35, 34
1978, 500, 29, 29
1979, 500, 27, 27
1980, 500, 14, 15
1981, 500, 13, 13
1982, 500, 20, 20
1983, 500, 26, 24
1984, 500, 17, 17
1985, 500, 21, 20
1986, 500, 24, 24
1987, 500, 20, 20
1988, 500, 21, 20
1989, 500, 7, 8
1990, 500, 24, 22
1991, 500, 23, 22
1992, 500, 27, 26
1993, 500, 31, 31
1994, 500, 14, 14
1995, 500, 23, 23
1996, 500, 29, 28
1997, 500, 23, 22
1998, 500, 17, 17
1999, 500, 21, 22
2000, 500, 24, 23
2001, 250, 11, 10
2002, 250, 9, 9
2003, 250, 9, 9
2004, 250, 7, 7
2005, 250, 14, 15
2006, 250, 9, 10
2007, 250, 12, 11
2008, 250, 10, 10
2009, 250, 10, 10
2010, 250, 15, 15
2011, 250, 4, 4
2012, 250, 14, 14
2013, 250, 9, 9
2014, 250, 12, 12
2015, 250, 12, 12
2016, 250, 10, 11
2017, 250, 11, 11
2018, 250, 23, 23
2019, 250, 13, 13
2020, 250, 10, 10
2021, 250, 15, 15
2022, 250, 10, 10
2023, 250, 5, 5
2024, 250, 11, 11
2025, 250, 15, 15
2026, 250, 10, 11
2027, 250, 13, 13
2028, 250, 8, 8
2029, 250, 11, 10
2030, 250, 13, 13
2031, 250, 15, 16
2032, 250, 9, 10
2033, 250, 13, 13
2034, 250, 15, 15
2035, 250, 13, 12
2036, 250, 12, 12
2037, 250, 15, 14
2038, 250, 16, 15
2039, 250, 12, 12
2040, 250, 12, 12
2041, 250, 7, 7
2042, 250, 10, 11
2043, 250, 13, 13
2044, 250, 13, 12
2045, 250, 8, 8
2046, 250, 13, 13
2047, 250, 7, 7
2048, 250, 20, 20
2049, 250, 11, 10
2050, 250, 12, 12
2051, 250, 8, 9
2052, 250, 12, 12
2053, 250, 10, 11
2054, 250, 13, 12
2055, 250, 9, 8
2056, 250, 14, 14
2057, 250, 17, 15
2058, 250, 8, 8
2059, 250, 10, 9
2060, 250, 13, 13
2061, 250, 12, 12
2062, 250, 15, 14
2063, 250, 13, 13
2064, 250, 8, 8
2065, 250, 18, 18
2066, 250, 14, 12
2067, 250, 17, 17
2068, 250, 11, 12
2069, 250, 9, 9
2070, 250, 11, 11
2071, 250, 15, 15
2072, 250, 16, 16
2073, 250, 7, 7
2074, 250, 14, 14
2075, 250, 19, 19
2076, 250, 12, 13
2077, 250, 15, 14
2078, 250, 9, 9
2079, 250, 8, 8
2080, 250, 12, 12
2081, 250, 12, 13
2082, 250, 8, 8
2083, 250, 12, 11
2084, 250, 12, 12
2085, 250, 11, 11
2086, 250, 6, 6
2087, 250, 8, 8
2088, 250, 10, 10
2089, 250, 7, 7
2090, 250, 10, 10
2091, 250, 7, 6
2092, 250, 13, 11
2093, 250, 12, 12
2094, 250, 12, 12
2095, 250, 7, 7
2096, 250, 20, 20
2097, 250, 12, 12
2098, 250, 19, 19
2099, 250, 12, 12
2100, 250, 7, 6
2101, 250, 9, 9
2102, 250, 11, 11
2103, 250, 8, 7
2104, 250, 12, 12
2105, 250, 16, 15
2106, 250, 13, 12
2107, 250, 15, 15
2108, 250, 10, 10
2109, 250, 17, 17
2110, 250, 10, 9
2111, 250, 16, 16
2112, 250, 11, 11
2113, 250, 13, 13
2114, 250, 11, 11
2115, 250, 10, 10
2116, 250, 11, 12
2117, 250, 9, 9
2118, 250, 10, 9
2119, 250, 13, 11
2120, 250, 17, 17
2121, 250, 11, 11
2122, 250, 14, 15
2123, 250, 9, 8
2124, 250, 18, 16
2125, 250, 14, 14
2126, 250, 9, 10
2127, 250, 11, 11
2128, 250, 13, 13
2129, 250, 13, 13
2130, 250, 4, 4
2131, 250, 8, 8
2132, 250, 16, 15
2133, 250, 8, 8
2134, 250, 12, 10
2135, 250, 16, 16
2136, 250, 14, 13
2137, 250, 8, 8
2138, 250, 15, 15
2139, 250, 8, 8
2140, 250, 8, 7
2141, 250, 4, 3
2142, 250, 11, 11
2143, 250, 10, 10
2144, 250, 17, 15
2145, 250, 13, 13
2146, 250, 14, 13
2147, 250, 12, 12
2148, 250, 11, 11
2149, 250, 16, 15
2150, 250, 10, 10
2151, 250, 6, 6
2152, 250, 17, 15
2153, 250, 14, 13
2154, 250, 10, 10
2155, 250, 19, 18
2156, 250, 11, 12
2157, 250, 10, 10
2158, 250, 11, 10
2159, 250, 15, 16
2160, 250, 6, 7
2161, 250, 17, 16
2162, 250, 7, 7
2163, 250, 10, 10
2164, 250, 13, 14
2165, 250, 10, 10
2166, 250, 12, 13
2167, 250, 13, 13
2168, 250, 11, 11
2169, 250, 8, 8
2170, 250, 14, 14
2171, 250, 9, 8
2172, 250, 11, 11
2173, 250, 10, 10
2174, 250, 16, 16
2175, 250, 9, 9
2176, 250, 15, 15
2177, 250, 19, 19
2178, 250, 11, 11
2179, 250, 7, 8
2180, 250, 10, 11
2181, 250, 9, 9
2182, 250, 14, 14
2183, 250, 13, 13
2184, 250, 14, 14
2185, 250, 6, 6
2186, 250, 9, 9
2187, 250, 11, 11
2188, 250, 8, 8
2189, 250, 12, 12
2190, 250, 17, 17
2191, 250, 16, 15
2192, 250, 14, 14
2193, 250, 13, 13
2194, 250, 11, 12
2195, 250, 9, 9
2196, 250, 10, 10
2197, 250, 5, 5
2198, 250, 9, 9
2199, 250, 10, 9
2200, 250, 12, 12
2201, 250, 17, 16
2202, 250, 9, 9
2203, 250, 2, 2
2204, 250, 18, 18
2205, 250, 10, 10
2206, 250, 11, 11
2207, 250, 15, 15
2208, 250, 18, 18
2209, 250, 23, 22
2210, 250, 7, 7
2211, 250, 11, 11
2212, 250, 7, 7
2213, 250, 12, 13
2214, 250, 17, 17
2215, 250, 14, 15
2216, 250, 8, 7
2217, 250, 15, 15
2218, 250, 9, 10
2219, 250, 11, 11
2220, 250, 16, 16
2221, 250, 15, 14
2222, 250, 5, 5
2223, 250, 15, 15
2224, 250, 14, 14
2225, 250, 9, 9
2226, 250, 19, 18
2227, 250, 11, 11
2228, 250, 7, 8
2229, 250, 13, 13
2230, 250, 13, 14
2231, 250, 15, 15
2232, 250, 11, 11
2233, 250, 7, 7
2234, 250, 10, 10
2235, 250, 9, 10
2236, 250, 9, 9
2237, 250, 7, 7
2238, 250, 6, 6
2239, 250, 9, 8
2240, 250, 17, 15
2241, 250, 11, 11
2242, 250, 9, 9
2243, 250, 14, 14
2244, 250, 8, 9
2245, 250, 15, 15
2246, 250, 11, 11
2247, 250, 15, 16
2248, 250, 16, 16
2249, 250, 11, 11
2250, 250, 7, 6
2251, 250, 13, 13
2252, 250, 8, 8
2253, 250, 11, 11
2254, 250, 21, 20
2255, 250, 9, 9
2256, 250, 11, 11
2257, 250, 14, 14
2258, 250, 13, 13
2259, 250, 13, 13
2260, 250, 9, 9
2261, 250, 16, 13
2262, 250, 9, 9
2263, 250, 11, 11
2264, 250, 21, 20
2265, 250, 11, 10
2266, 250, 10, 10
2267, 250, 12, 13
2268, 250, 6, 6
2269, 250, 11, 11
2270, 250, 15, 15
2271, 250, 10, 10
2272, 250, 10, 10
2273, 250, 8, 8
2274, 250, 5, 5
2275, 250, 13, 13
2276, 250, 8, 8
2277, 250, 10, 10
2278, 250, 9, 9
2279, 250, 19, 18
2280, 250, 7, 7
2281, 250, 12, 12
2282, 250, 15, 15
2283, 250, 15, 15
2284, 250, 13, 13
2285, 250, 10, 10
2286, 250, 14, 15
2287, 250, 17, 18
2288, 250, 12, 13
2289, 250, 12, 12
2290, 250, 11, 12
2291, 250, 11, 10
2292, 250, 8, 8
2293, 250, 10, 12
2294, 250, 7, 7
2295, 250, 13, 12
2296, 250, 6, 7
2297, 250, 9, 9
2298, 250, 8, 9
2299, 250, 8, 8
2300, 250, 11, 10
2301, 250, 19, 18
2302, 250, 13, 13
2303, 250, 16, 17
2304, 250, 10, 10
2305, 250, 14, 13
2306, 250, 10, 11
2307, 250, 11, 12
2308, 250, 17, 17
2309, 250, 13, 13
2310, 250, 15, 15
2311, 250, 8, 8
2312, 250, 5, 7
2313, 250, 9, 9
2314, 250, 9, 9
2315, 250, 11, 12
2316, 250, 19, 19
2317, 250, 11, 11
2318, 250, 7, 7
2319, 250, 11, 11
2320, 250, 9, 9
2321, 250, 6, 7
2322, 250, 9, 10
2323, 250, 11, 11
2324, 250, 11, 11
2325, 250, 9, 9
2326, 250, 8, 9
2327, 250, 15, 15
2328, 250, 11, 13
2329, 250, 11, 11
2330, 250, 12, 12
2331, 250, 17, 16
2332, 250, 11, 11
2333, 250, 6, 6
2334, 250, 11, 13
2335, 250, 13, 14
2336, 250, 10, 10
2337, 250, 10, 10
2338, 250, 13, 12
2339, 250, 8, 9
2340, 250, 16, 15
2341, 250, 17, 16
2342, 250, 8, 6
2343, 250, 13, 13
2344, 250, 10, 11
2345, 250, 15, 14
2346, 250, 10, 9
2347, 250, 18, 18
2348, 250, 14, 14
2349, 250, 9, 9
2350, 250, 13, 13
2351, 250, 16, 17
2352, 250, 9, 8
2353, 250, 11, 11
2354, 250, 17, 17
2355, 250, 8, 8
2356, 250, 17, 18
2357, 250, 11, 11
2358, 250, 10, 10
2359, 250, 12, 12
2360, 250, 14, 14
2361, 250, 10, 11
2362, 250, 12, 12
2363, 250, 10, 10
2364, 250, 10, 10
2365, 250, 13, 14
2366, 250, 10, 11
2367, 250, 9, 10
2368, 250, 13, 13
2369, 250, 15, 16
2370, 250, 10, 10
2371, 250, 13, 13
2372, 250, 4, 4
2373, 250, 17, 17
2374, 250, 15, 15
2375, 250, 17, 18
2376, 250, 9, 9
2377, 250, 10, 10
2378, 250, 11, 11
2379, 250, 14, 13
2380, 250, 10, 11
2381, 250, 12, 11
2382, 250, 9, 10
2383, 250, 14, 14
2384, 250, 11, 10
2385, 250, 13, 13
2386, 250, 19, 18
2387, 250, 8, 8
2388, 250, 17, 17
2389, 250, 13, 13
2390, 250, 15, 15
2391, 250, 15, 15
2392, 250, 14, 14
2393, 250, 11, 11
2394, 250, 17, 18
2395, 250, 16, 16
2396, 250, 13, 13
2397, 250, 12, 12
2398, 250, 17, 16
2399, 250, 13, 13
2400, 250, 11, 11
2401, 250, 15, 15
2402, 250, 10, 11
2403, 250, 7, 6
2404, 250, 14, 14
2405, 250, 10, 10
2406, 250, 11, 11
2407, 250, 16, 15
2408, 250, 16, 15
2409, 250, 16, 14
2410, 250, 13, 13
2411, 250, 10, 10
2412, 250, 5, 5
2413, 250, 12, 12
2414, 250, 9, 9
2415, 250, 11, 11
2416, 250, 12, 12
2417, 250, 14, 14
2418, 250, 6, 6
2419, 250, 8, 8
2420, 250, 9, 9
2421, 250, 14, 14
2422, 250, 15, 14
2423, 250, 11, 11
2424, 250, 12, 12
2425, 250, 11, 10
2426, 250, 9, 9
2427, 250, 11, 11
2428, 250, 16, 16
2429, 250, 9, 9
2430, 250, 12, 12
2431, 250, 18, 18
2432, 250, 17, 17
2433, 250, 18, 18
2434, 250, 10, 10
2435, 250, 12, 12
2436, 250, 13, 13
2437, 250, 14, 13
2438, 250, 10, 10
2439, 250, 9, 9
2440, 250, 16, 16
2441, 250, 5, 6
2442, 250, 13, 12
2443, 250, 13, 13
2444, 250, 7, 6
2445, 250, 9, 9
2446, 250, 6, 6
2447, 250, 18, 18
2448, 250, 7, 6
2449, 250, 12, 12
2450, 250, 7, 7
2451, 250, 12, 12
2452, 250, 9, 9
2453, 250, 6, 6
2454, 250, 10, 10
2455, 250, 11, 10
2456, 250, 10, 11
2457, 250, 9, 9
2458, 250, 10, 10
2459, 250, 18, 18
2460, 250, 9, 10
2461, 250, 11, 11
2462, 250, 11, 11
2463, 250, 8, 8
2464, 250, 9, 9
2465, 250, 9, 9
2466, 250, 14, 14
2467, 250, 6, 6
2468, 250, 16, 15
2469, 250, 15, 17
2470, 250, 23, 22
2471, 250, 5, 5
2472, 250, 9, 9
2473, 250, 13, 13
2474, 250, 14, 13
2475, 250, 11, 11
2476, 250, 19, 20
2477, 250, 7, 7
2478, 250, 9, 8
2479, 250, 11, 11
2480, 250, 11, 11
2481, 250, 9, 9
2482, 250, 7, 6
2483, 250, 12, 12
2484, 250, 12, 12
2485, 250, 12, 12
2486, 250, 9, 9
2487, 250, 6, 6
2488, 250, 8, 8
2489, 250, 12, 12
2490, 250, 7, 7
2491, 250, 11, 12
2492, 250, 13, 12
2493, 250, 14, 13
2494, 250, 14, 13
2495, 250, 14, 12
2496, 250, 16, 15
2497, 250, 12, 12
2498, 250, 9, 9
2499, 250, 12, 12
2500, 250, 16, 15
2501, 250, 11, 11
2502, 250, 12, 12
2503, 250, 10, 10
2504, 250, 12, 13
2505, 250, 11, 11
2506, 250, 16, 17
2507, 250, 11, 11
2508, 250, 15, 15
2509, 250, 13, 13
2510, 250, 10, 10
2511, 250, 16, 15
2512, 250, 12, 12
2513, 250, 13, 14
2514, 250, 14, 13
2515, 250, 14, 14
2516, 250, 15, 14
2517, 250, 7, 6
2518, 250, 9, 9
2519, 250, 6, 6
2520, 250, 8, 8
2521, 250, 14, 14
2522, 250, 18, 18
2523, 250, 17, 17
2524, 250, 13, 13
2525, 250, 15, 14
2526, 250, 9, 9
2527, 250, 14, 14
2528, 250, 12, 12
2529, 250, 15, 15
2530, 250, 9, 9
2531, 250, 9, 9
2532, 250, 10, 10
2533, 250, 19, 19
2534, 250, 11, 10
2535, 250, 16, 16
2536, 250, 12, 11
2537, 250, 10, 9
2538, 250, 12, 12
2539, 250, 10, 10
2540, 250, 18, 18
2541, 250, 6, 6
2542, 250, 6, 7
2543, 250, 13, 13
2544, 250, 10, 9
2545, 250, 10, 10
2546, 250, 12, 12
2547, 250, 13, 14
2548, 250, 13, 13
2549, 250, 11, 11
2550, 250, 13, 13
2551, 250, 11, 11
2552, 250, 4, 4
2553, 250, 8, 9
2554, 250, 12, 12
2555, 250, 9, 9
2556, 250, 7, 7
2557, 250, 5, 5
2558, 250, 11, 11
2559, 250, 11, 11
2560, 250, 10, 10
2561, 250, 11, 11
2562, 250, 12, 12
2563, 250, 11, 11
2564, 250, 12, 12
2565, 250, 5, 5
2566, 250, 8, 8
2567, 250, 8, 8
2568, 250, 9, 11
2569, 250, 13, 13
2570, 250, 9, 10
2571, 250, 10, 9
2572, 250, 9, 9
2573, 250, 11, 11
2574, 250, 14, 14
2575, 250, 15, 15
2576, 250, 12, 12
2577, 250, 14, 13
2578, 250, 11, 11
2579, 250, 6, 6
2580, 250, 15, 15
2581, 250, 14, 14
2582, 250, 8, 8
2583, 250, 12, 12
2584, 250, 11, 11
2585, 250, 14, 13
2586, 250, 11, 11
2587, 250, 5, 5
2588, 250, 12, 12
2589, 250, 8, 7
2590, 250, 13, 13
2591, 250, 8, 8
2592, 250, 9, 9
2593, 250, 18, 18
2594, 250, 18, 17
2595, 250, 13, 12
2596, 250, 13, 13
2597, 250, 20, 22
2598, 250, 12, 11
2599, 250, 16, 16
2600, 250, 13, 14
2601, 250, 10, 10
2602, 250, 11, 11
2603, 250, 13, 13
2604, 250, 12, 12
2605, 250, 10, 10
2606, 250, 20, 19
2607, 250, 12, 11
2608, 250, 11, 11
2609, 250, 13, 11
2610, 250, 11, 11
2611, 250, 12, 13
2612, 250, 12, 12
2613, 250, 11, 12
2614, 250, 11, 10
2615, 250, 10, 11
2616, 250, 8, 8
2617, 250, 7, 7
2618, 250, 12, 11
2619, 250, 9, 8
2620, 250, 9, 9
2621, 250, 10, 10
2622, 250, 14, 14
2623, 250, 16, 16
2624, 250, 12, 11
2625, 250, 7, 7
2626, 250, 13, 14
2627, 250, 12, 12
2628, 250, 11, 12
2629, 250, 8, 8
2630, 250, 14, 15
2631, 250, 7, 9
2632, 250, 11, 11
2633, 250, 10, 10
2634, 250, 12, 12
2635, 250, 7, 7
2636, 250, 17, 17
2637, 250, 9, 9
2638, 250, 11, 12
2639, 250, 11, 11
2640, 250, 9, 9
2641, 250, 11, 11
2642, 250, 13, 13
2643, 250, 12, 12
2644, 250, 8, 8
2645, 250, 12, 12
2646, 250, 18, 17
2647, 250, 15, 15
2648, 250, 10, 10
2649, 250, 7, 7
2650, 250, 11, 11
2651, 250, 9, 10
2652, 250, 9, 9
2653, 250, 10, 10
2654, 250, 17, 17
2655, 250, 8, 8
2656, 250, 13, 14
2657, 250, 16, 17
2658, 250, 11, 11
2659, 250, 5, 5
2660, 250, 7, 6
2661, 250, 18, 18
2662, 250, 9, 8
2663, 250, 10, 11
2664, 250, 11, 11
2665, 250, 11, 11
2666, 250, 9, 9
2667, 250, 15, 15
2668, 250, 12, 12
2669, 250, 13, 13
2670, 250, 17, 18
2671, 250, 11, 11
2672, 250, 7, 7
2673, 250, 13, 12
2674, 250, 15, 15
2675, 250, 13, 13
2676, 250, 8, 8
2677, 250, 14, 14
2678, 250, 11, 10
2679, 250, 16, 16
2680, 250, 12, 11
2681, 250, 14, 14
2682, 250, 17, 16
2683, 250, 5, 5
2684, 250, 18, 18
2685, 250, 10, 10
2686, 250, 11, 11
2687, 250, 10, 9
2688, 250, 8, 8
2689, 250, 13, 11
2690, 250, 8, 8
2691, 250, 7, 6
2692, 250, 12, 11
2693, 250, 8, 8
2694, 250, 8, 9
2695, 250, 12, 11
2696, 250, 11, 10
2697, 250, 9, 8
2698, 250, 10, 10
2699, 250, 8, 8
2700, 250, 12, 12
2701, 250, 9, 10
2702, 250, 10, 10
2703, 250, 7, 7
2704, 250, 8, 8
2705, 250, 16, 17
2706, 250, 11, 11
2707, 250, 20, 20
2708, 250, 13, 13
2709, 250, 12, 12
2710, 250, 14, 13
2711, 250, 12, 12
2712, 250, 12, 12
2713, 250, 14, 14
2714, 250, 15, 15
2715, 250, 14, 14
2716, 250, 6, 7
2717, 250, 10, 11
2718, 250, 12, 12
2719, 250, 9, 8
2720, 250, 14, 12
2721, 250, 13, 13
2722, 250, 17, 19
2723, 250, 11, 11
2724, 250, 12, 12
2725, 250, 7, 7
2726, 250, 15, 15
2727, 250, 13, 14
2728, 250, 16, 17
2729, 250, 15, 15
2730, 250, 9, 9
2731, 250, 11, 11
2732, 250, 8, 8
2733, 250, 10, 10
2734, 250, 17, 16
2735, 250, 8, 8
2736, 250, 14, 13
2737, 250, 6, 6
2738, 250, 14, 15
2739, 250, 10, 10
2740, 250, 10, 10
2741, 250, 12, 12
2742, 250, 12, 12
2743, 250, 12, 11
2744, 250, 8, 7
2745, 250, 10, 11
2746, 250, 9, 10
2747, 250, 6, 6
2748, 250, 11, 10
2749, 250, 13, 12
2750, 250, 14, 13
2751, 250, 6, 6
2752, 250, 9, 9
2753, 250, 6, 6
2754, 250, 12, 12
2755, 250, 11, 10
2756, 250, 8, 7
2757, 250, 11, 11
2758, 250, 11, 11
2759, 250, 11, 11
2760, 250, 12, 12
2761, 250, 5, 5
2762, 250, 10, 10
2763, 250, 11, 10
2764, 250, 15, 15
2765, 250, 12, 11
2766, 250, 12, 12
2767, 250, 8, 8
2768, 250, 15, 14
2769, 250, 7, 7
2770, 250, 11, 11
2771, 250, 11, 12
2772, 250, 7, 8
2773, 250, 14, 14
2774, 250, 15, 15
2775, 250, 9, 9
2776, 250, 8, 8
2777, 250, 13, 13
2778, 250, 7, 7
2779, 250, 12, 12
2780, 250, 15, 14
2781, 250, 11, 11
2782, 250, 14, 13
2783, 250, 14, 14
2784, 250, 13, 12
2785, 250, 13, 13
2786, 250, 10, 10
2787, 250, 10, 10
2788, 250, 11, 11
2789, 250, 7, 7
2790, 250, 10, 10
2791, 250, 15, 15
2792, 250, 11, 10
2793, 250, 9, 9
2794, 250, 6, 7
2795, 250, 13, 12
2796, 250, 16, 14
2797, 250, 11, 11
2798, 250, 15, 14
2799, 250, 17, 17
2800, 250, 16, 16
2801, 250, 14, 14
2802, 250, 16, 16
2803, 250, 9, 9
2804, 250, 8, 8
2805, 250, 13, 13
2806, 250, 12, 12
2807, 250, 10, 9
2808, 250, 15, 14
2809, 250, 6, 6
2810, 250, 16, 14
2811, 250, 6, 6
2812, 250, 7, 7
2813, 250, 14, 14
2814, 250, 15, 14
2815, 250, 7, 7
2816, 250, 12, 12
2817, 250, 11, 12
2818, 250, 19, 18
2819, 250, 6, 6
2820, 250, 13, 12
2821, 250, 14, 14
2822, 250, 16, 15
2823, 250, 17, 17
2824, 250, 13, 13
2825, 250, 10, 10
2826, 250, 15, 15
2827, 250, 11, 11
2828, 250, 13, 13
2829, 250, 7, 7
2830, 250, 6, 7
2831, 250, 15, 14
2832, 250, 7, 7
2833, 250, 9, 10
2834, 250, 12, 12
2835, 250, 10, 10
2836, 250, 11, 11
2837, 250, 21, 21
2838, 250, 11, 12
2839, 250, 11, 12
2840, 250, 12, 12
2841, 250, 13, 13
2842, 250, 13, 12
2843, 250, 11, 13
2844, 250, 12, 12
2845, 250, 13, 14
2846, 250, 10, 10
2847, 250, 8, 8
2848, 250, 8, 8
2849, 250, 12, 13
2850, 250, 11, 11
2851, 250, 16, 16
2852, 250, 7, 8
2853, 250, 8, 8
2854, 250, 13, 13
2855, 250, 16, 15
2856, 250, 10, 10
2857, 250, 7, 7
2858, 250, 12, 12
2859, 250, 12, 12
2860, 250, 13, 13
2861, 250, 13, 13
2862, 250, 8, 8
2863, 250, 13, 13
2864, 250, 10, 11
2865, 250, 17, 18
2866, 250, 14, 14
2867, 250, 10, 11
2868, 250, 15, 15
2869, 250, 13, 13
2870, 250, 10, 10
2871, 250, 7, 7
2872, 250, 8, 9
2873, 250, 14, 14
2874, 250, 13, 12
2875, 250, 14, 14
2876, 250, 11, 11
2877, 250, 17, 18
2878, 250, 14, 14
2879, 250, 11, 11
2880, 250, 16, 17
2881, 250, 15, 14
2882, 250, 9, 9
2883, 250, 10, 12
2884, 250, 8, 8
2885, 250, 8, 8
2886, 250, 8, 9
2887, 250, 5, 5
2888, 250, 12, 12
2889, 250, 16, 16
2890, 250, 15, 15
2891, 250, 8, 8
2892, 250, 12, 10
2893, 250, 9, 9
2894, 250, 10, 11
2895, 250, 11, 11
2896, 250, 14, 14
2897, 250, 12, 11
2898, 250, 14, 14
2899, 250, 11, 12
2900, 250, 9, 10
2901, 250, 14, 14
2902, 250, 10, 10
2903, 250, 16, 16
2904, 250, 10, 10
2905, 250, 14, 15
2906, 250, 15, 14
2907, 250, 23, 22
2908, 250, 11, 12
2909, 250, 11, 12
2910, 250, 10, 9
2911, 250, 6, 7
2912, 250, 13, 14
2913, 250, 17, 16
2914, 250, 10, 10
2915, 250, 12, 12
2916, 250, 13, 13
2917, 250, 6, 6
2918, 250, 14, 15
2919, 250, 9, 10
2920, 250, 7, 7
2921, 250, 8, 8
2922, 250, 7, 7
2923, 250, 13, 12
2924, 250, 4, 4
2925, 250, 14, 14
2926, 250, 11, 11
2927, 250, 10, 10
2928, 250, 11, 12
2929, 250, 11, 11
2930, 250, 5, 5
2931, 250, 6, 6
2932, 250, 10, 10
2933, 250, 9, 9
2934, 250, 10, 10
2935, 250, 13, 12
2936, 250, 10, 11
2937, 250, 12, 12
2938, 250, 13, 13
2939, 250, 13, 13
2940, 250, 9, 9
2941, 250, 10, 10
2942, 250, 11, 11
2943, 250, 12, 12
2944, 250, 13, 12
2945, 250, 13, 13
2946, 250, 17, 16
2947, 250, 14, 13
2948, 250, 13, 13
2949, 250, 10, 10
2950, 250, 11, 13
2951, 250, 17, 16
2952, 250, 12, 12
2953, 250, 10, 11
2954, 250, 17, 16
2955, 250, 6, 6
2956, 250, 15, 15
2957, 250, 15, 14
2958, 250, 9, 9
2959, 250, 11, 11
2960, 250, 11, 11
2961, 250, 12, 12
2962, 250, 11, 11
2963, 250, 14, 15
2964, 250, 13, 13
2965, 250, 11, 11
2966, 250, 6, 7
2967, 250, 10, 10
2968, 250, 11, 11
2969, 250, 10, 10
2970, 250, 14, 14
2971, 250, 8, 8
2972, 250, 11, 11
2973, 250, 13, 12
2974, 250, 12, 12
2975, 250, 9, 10
2976, 250, 13, 13
2977, 250, 22, 22
2978, 250, 11, 11
2979, 250, 5, 5
2980, 250, 9, 9
2981, 250, 9, 9
2982, 250, 10, 9
2983, 250, 13, 13
2984, 250, 13, 13
2985, 250, 15, 14
2986, 250, 11, 11
2987, 250, 13, 12
2988, 250, 12, 12
2989, 250, 9, 9
2990, 250, 11, 14
2991, 250, 14, 15
2992, 250, 13, 13
2993, 250, 9, 9
2994, 250, 8, 8
2995, 250, 10, 10
2996, 250, 12, 12
2997, 250, 9, 9
2998, 250, 12, 12
2999, 250, 13, 13
3000, 250, 14, 14
3001, 125, 0, 0
3002, 125, 5, 5
3003, 125, 6, 6
3004, 125, 10, 9
3005, 125, 5, 5
3006, 125, 4, 4
3007, 125, 9, 9
3008, 125, 4, 4
3009, 125, 6, 6
3010, 125, 4, 4
3011, 125, 6, 6
3012, 125, 8, 8
3013, 125, 6, 7
3014, 125, 10, 12
3015, 125, 7, 7
3016, 125, 4, 4
3017, 125, 6, 6
3018, 125, 7, 6
3019, 125, 4, 4
3020, 125, 7, 7
3021, 125, 7, 7
3022, 125, 7, 7
3023, 125, 8, 8
3024, 125, 5, 5
3025, 125, 6, 6
3026, 125, 8, 9
3027, 125, 5, 5
3028, 125, 8, 8
3029, 125, 8, 8
3030, 125, 5, 5
3031, 125, 7, 7
3032, 125, 8, 9
3033, 125, 5, 5
3034, 125, 8, 8
3035, 125, 7, 7
3036, 125, 4, 3
3037, 125, 7, 7
3038, 125, 5, 5
3039, 125, 4, 4
3040, 125, 6, 6
3041, 125, 7, 8
3042, 125, 4, 4
3043, 125, 10, 10
3044, 125, 3, 3
3045, 125, 5, 5
3046, 125, 0, 0
3047, 125, 6, 6
3048, 125, 8, 7
3049, 125, 8, 7
3050, 125, 5, 5
3051, 125, 6, 6
3052, 125, 7, 7
3053, 125, 1, 1
3054, 125, 4, 4
3055, 125, 3, 3
3056, 125, 8, 8
3057, 125, 6, 6
3058, 125, 11, 11
3059, 125, 5, 5
3060, 125, 8, 7
3061, 125, 5, 5
3062, 125, 6, 6
3063, 125, 5, 5
3064, 125, 9, 9
3065, 125, 3, 3
3066, 125, 5, 5
3067, 125, 4, 4
3068, 125, 9, 9
3069, 125, 7, 7
3070, 125, 5, 5
3071, 125, 9, 9
3072, 125, 3, 3
3073, 125, 8, 8
3074, 125, 9, 9
3075, 125, 7, 7
3076, 125, 6, 6
3077, 125, 5, 5
3078, 125, 2, 2
3079, 125, 6, 5
3080, 125, 8, 8
3081, 125, 4, 4
3082, 125, 7, 7
3083, 125, 6, 7
3084, 125, 10, 10
3085, 125, 2, 1
3086, 125, 5, 5
3087, 125, 2, 2
3088, 125, 7, 7
3089, 125, 3, 3
3090, 125, 7, 7
3091, 125, 2, 2
3092, 125, 4, 4
3093, 125, 5, 5
3094, 125, 4, 4
3095, 125, 7, 6
3096, 125, 5, 5
3097, 125, 8, 8
3098, 125, 10, 10
3099, 125, 9, 9
3100, 125, 3, 3
3101, 125, 5, 4
3102, 125, 6, 6
3103, 125, 6, 6
3104, 125, 6, 6
3105, 125, 6, 6
3106, 125, 5, 7
3107, 125, 7, 7
3108, 125, 8, 8
3109, 125, 11, 11
3110, 125, 6, 7
3111, 125, 6, 6
3112, 125, 2, 2
3113, 125, 8, 8
3114, 125, 3, 3
3115, 125, 7, 7
3116, 125, 6, 7
3117, 125, 4, 4
3118, 125, 6, 6
3119, 125, 3, 3
3120, 125, 7, 7
3121, 125, 4, 4
3122, 125, 7, 7
3123, 125, 8, 8
3124, 125, 8, 7
3125, 125, 5, 5
3126, 125, 7, 6
3127, 125, 5, 5
3128, 125, 5, 5
3129, 125, 2, 3
3130, 125, 8, 8
3131, 125, 5, 5
3132, 125, 3, 3
3133, 125, 3, 3
3134, 125, 3, 3
3135, 125, 3, 3
3136, 125, 4, 4
3137, 125, 9, 9
3138, 125, 9, 9
3139, 125, 4, 4
3140, 125, 4, 4
3141, 125, 9, 8
3142, 125, 11, 11
3143, 125, 6, 6
3144, 125, 4, 4
3145, 125, 5, 6
3146, 125, 5, 5
3147, 125, 6, 7
3148, 125, 7, 7
3149, 125, 3, 3
3150, 125, 6, 6
3151, 125, 12, 13
3152, 125, 6, 6
3153, 125, 10, 10
3154, 125, 3, 3
3155, 125, 2, 3
3156, 125, 6, 5
3157, 125, 10, 9
3158, 125, 4, 4
3159, 125, 6, 5
3160, 125, 7, 7
3161, 125, 5, 5
3162, 125, 4, 4
3163, 125, 6, 6
3164, 125, 1, 1
3165, 125, 14, 14
3166, 125, 13, 13
3167, 125, 13, 13
3168, 125, 6, 6
3169, 125, 14, 14
3170, 125, 2, 2
3171, 125, 5, 5
3172, 125, 8, 8
3173, 125, 5, 5
3174, 125, 4, 4
3175, 125, 4, 4
3176, 125, 7, 7
3177, 125, 7, 7
3178, 125, 6, 6
3179, 125, 7, 7
3180, 125, 5, 5
3181, 125, 4, 4
3182, 125, 6, 7
3183, 125, 5, 5
3184, 125, 10, 9
3185, 125, 2, 2
3186, 125, 7, 7
3187, 125, 6, 5
3188, 125, 3, 3
3189, 125, 9, 8
3190, 125, 4, 4
3191, 125, 4, 4
3192, 125, 6, 6
3193, 125, 5, 5
3194, 125, 3, 3
3195, 125, 8, 8
3196, 125, 8, 8
3197, 125, 6, 7
3198, 125, 8, 8
3199, 125, 7, 6
3200, 125, 2, 2
3201, 125, 2, 2
3202, 125, 9, 9
3203, 125, 3, 4
3204, 125, 5, 5
3205, 125, 7, 7
3206, 125, 3, 3
3207, 125, 6, 6
3208, 125, 4, 4
3209, 125, 4, 4
3210, 125, 2, 2
3211, 125, 6, 6
3212, 125, 6, 5
3213, 125, 5, 5
3214, 125, 7, 7
3215, 125, 6, 5
3216, 125, 3, 3
3217, 125, 6, 6
3218, 125, 3, 3
3219, 125, 9, 9
3220, 125, 5, 5
3221, 125, 6, 6
3222, 125, 4, 4
3223, 125, 4, 4
3224, 125, 4, 4
3225, 125, 7, 7
3226, 125, 5, 5
3227, 125, 5, 4
3228, 125, 7, 7
3229, 125, 7, 6
3230, 125, 9, 9
3231, 125, 6, 5
3232, 125, 7, 7
3233, 125, 12, 13
3234, 125, 5, 5
3235, 125, 10, 9
3236, 125, 10, 9
3237, 125, 5, 5
3238, 125, 4, 4
3239, 125, 8, 8
3240, 125, 6, 6
3241, 125, 5, 5
3242, 125, 10, 9
3243, 125, 6, 6
3244, 125, 3, 3
3245, 125, 4, 4
3246, 125, 3, 3
3247, 125, 10, 10
3248, 125, 5, 6
3249, 125, 6, 6
3250, 125, 13, 12
3251, 125, 5, 5
3252, 125, 5, 5
3253, 125, 4, 4
3254, 125, 5, 5
3255, 125, 8, 8
3256, 125, 10, 10
3257, 125, 6, 6
3258, 125, 3, 3
3259, 125, 3, 3
3260, 125, 4, 3
3261, 125, 7, 7
3262, 125, 6, 5
3263, 125, 5, 5
3264, 125, 5, 5
3265, 125, 4, 4
3266, 125, 6, 6
3267, 125, 7, 7
3268, 125, 5, 4
3269, 125, 11, 10
3270, 125, 6, 6
3271, 125, 3, 3
3272, 125, 5, 7
3273, 125, 12, 12
3274, 125, 5, 5
3275, 125, 5, 5
3276, 125, 7, 7
3277, 125, 2, 2
3278, 125, 4, 4
3279, 125, 6, 7
3280, 125, 6, 6
3281, 125, 5, 6
3282, 125, 5, 4
3283, 125, 7, 7
3284, 125, 5, 5
3285, 125, 6, 6
3286, 125, 3, 3
3287, 125, 3, 4
3288, 125, 2, 2
3289, 125, 4, 4
3290, 125, 4, 4
3291, 125, 12, 11
3292, 125, 7, 8
3293, 125, 4, 4
3294, 125, 11, 11
3295, 125, 8, 7
3296, 125, 3, 3
3297, 125, 1, 1
3298, 125, 6, 6
3299, 125, 4, 4
3300, 125, 3, 3
3301, 125, 5, 5
3302, 125, 4, 4
3303, 125, 5, 5
3304, 125, 7, 7
3305, 125, 9, 9
3306, 125, 7, 7
3307, 125, 1, 1
3308, 125, 3, 3
3309, 125, 3, 3
3310, 125, 1, 2
3311, 125, 7, 7
3312, 125, 2, 2
3313, 125, 5, 5
3314, 125, 10, 10
3315, 125, 6, 6
3316, 125, 7, 7
3317, 125, 7, 7
3318, 125, 7, 7
3319, 125, 11, 12
3320, 125, 6, 6
3321, 125, 7, 6
3322, 125, 8, 8
3323, 125, 4, 4
3324, 125, 4, 4
3325, 125, 6, 6
3326, 125, 4, 5
3327, 125, 6, 5
3328, 125, 4, 4
3329, 125, 3, 3
3330, 125, 7, 6
3331, 125, 7, 7
3332, 125, 7, 7
3333, 125, 6, 6
3334, 125, 8, 8
3335, 125, 4, 4
3336, 125, 5, 5
3337, 125, 7, 7
3338, 125, 5, 7
3339, 125, 8, 8
3340, 125, 4, 4
3341, 125, 5, 5
3342, 125, 4, 4
3343, 125, 4, 5
3344, 125, 6, 6
3345, 125, 4, 4
3346, 125, 7, 7
3347, 125, 7, 8
3348, 125, 8, 8
3349, 125, 4, 4
3350, 125, 7, 7
3351, 125, 11, 10
3352, 125, 1, 2
3353, 125, 8, 9
3354, 125, 4, 4
3355, 125, 11, 11
3356, 125, 6, 6
3357, 125, 6, 6
3358, 125, 8, 7
3359, 125, 13, 13
3360, 125, 3, 4
3361, 125, 3, 3
3362, 125, 1, 1
3363, 125, 3, 4
3364, 125, 8, 7
3365, 125, 8, 8
3366, 125, 11, 10
3367, 125, 7, 7
3368, 125, 6, 6
3369, 125, 8, 8
3370, 125, 3, 3
3371, 125, 7, 7
3372, 125, 2, 2
3373, 125, 8, 9
3374, 125, 10, 9
3375, 125, 5, 5
3376, 125, 4, 4
3377, 125, 9, 9
3378, 125, 3, 3
3379, 125, 5, 5
3380, 125, 3, 4
3381, 125, 3, 3
3382, 125, 4, 3
3383, 125, 3, 3
3384, 125, 13, 14
3385, 125, 7, 7
3386, 125, 3, 3
3387, 125, 8, 8
3388, 125, 5, 5
3389, 125, 5, 5
3390, 125, 4, 3
3391, 125, 10, 10
3392, 125, 4, 4
3393, 125, 3, 3
3394, 125, 10, 9
3395, 125, 1, 1
3396, 125, 11, 11
3397, 125, 10, 10
3398, 125, 8, 8
3399, 125, 3, 4
3400, 125, 3, 3
3401, 125, 5, 5
3402, 125, 6, 6
3403, 125, 6, 6
3404, 125, 3, 3
3405, 125, 7, 7
3406, 125, 5, 4
3407, 125, 7, 7
3408, 125, 4, 4
3409, 125, 4, 4
3410, 125, 7, 7
3411, 125, 3, 3
3412, 125, 1, 1
3413, 125, 10, 10
3414, 125, 3, 4
3415, 125, 7, 7
3416, 125, 6, 6
3417, 125, 7, 7
3418, 125, 6, 7
3419, 125, 8, 8
3420, 125, 8, 8
3421, 125, 10, 10
3422, 125, 6, 6
3423, 125, 3, 3
3424, 125, 8, 8
3425, 125, 8, 8
3426, 125, 4, 4
3427, 125, 8, 7
3428, 125, 6, 6
3429, 125, 4, 4
3430, 125, 6, 6
3431, 125, 4, 4
3432, 125, 7, 7
3433, 125, 5, 5
3434, 125, 4, 4
3435, 125, 5, 5
3436, 125, 4, 4
3437, 125, 5, 5
3438, 125, 4, 5
3439, 125, 2, 2
3440, 125, 4, 3
3441, 125, 8, 8
3442, 125, 0, 0
3443, 125, 5, 5
3444, 125, 4, 4
3445, 125, 7, 7
3446, 125, 3, 3
3447, 125, 6, 6
3448, 125, 7, 7
3449, 125, 3, 3
3450, 125, 5, 6
3451, 125, 3, 3
3452, 125, 5, 5
3453, 125, 1, 1
3454, 125, 3, 3
3455, 125, 7, 7
3456, 125, 8, 7
3457, 125, 6, 6
3458, 125, 5, 5
3459, 125, 4, 4
3460, 125, 6, 6
3461, 125, 5, 4
3462, 125, 3, 3
3463, 125, 6, 6
3464, 125, 8, 7
3465, 125, 8, 9
3466, 125, 9, 9
3467, 125, 7, 7
3468, 125, 4, 4
3469, 125, 12, 12
3470, 125, 6, 6
3471, 125, 4, 4
3472, 125, 3, 3
3473, 125, 8, 8
3474, 125, 3, 3
3475, 125, 9, 9
3476, 125, 8, 8
3477, 125, 8, 8
3478, 125, 5, 5
3479, 125, 7, 7
3480, 125, 5, 5
3481, 125, 6, 6
3482, 125, 5, 5
3483, 125, 7, 8
3484, 125, 7, 7
3485, 125, 3, 3
3486, 125, 4, 5
3487, 125, 6, 6
3488, 125, 9, 8
3489, 125, 6, 6
3490, 125, 3, 4
3491, 125, 4, 4
3492, 125, 2, 2
3493, 125, 4, 4
3494, 125, 8, 8
3495, 125, 5, 5
3496, 125, 7, 7
3497, 125, 3, 3
3498, 125, 6, 6
3499, 125, 4, 4
3500, 125, 9, 9
3501, 125, 7, 7
3502, 125, 5, 5
3503, 125, 3, 3
3504, 125, 7, 7
3505, 125, 2, 2
3506, 125, 4, 4
3507, 125, 7, 7
3508, 125, 8, 7
3509, 125, 11, 11
3510, 125, 9, 9
3511, 125, 7, 7
3512, 125, 10, 10
3513, 125, 10, 11
3514, 125, 6, 6
3515, 125, 6, 6
3516, 125, 6, 6
3517, 125, 5, 5
3518, 125, 2, 2
3519, 125, 2, 2
3520, 125, 8, 8
3521, 125, 10, 9
3522, 125, 7, 7
3523, 125, 4, 4
3524, 125, 9, 8
3525, 125, 3, 4
3526, 125, 9, 8
3527, 125, 6, 6
3528, 125, 6, 6
3529, 125, 10, 11
3530, 125, 13, 13
3531, 125, 8, 7
3532, 125, 8, 7
3533, 125, 5, 5
3534, 125, 4, 3
3535, 125, 6, 6
3536, 125, 11, 9
3537, 125, 8, 8
3538, 125, 7, 7
3539, 125, 6, 5
3540, 125, 8, 8
3541, 125, 5, 5
3542, 125, 5, 5
3543, 125, 7, 7
3544, 125, 4, 5
3545, 125, 8, 8
3546, 125, 1, 1
3547, 125, 7, 6
3548, 125, 5, 5
3549, 125, 3, 3
3550, 125, 4, 4
3551, 125, 5, 5
3552, 125, 6, 6
3553, 125, 4, 4
3554, 125, 3, 3
3555, 125, 5, 6
3556, 125, 7, 7
3557, 125, 3, 3
3558, 125, 5, 5
3559, 125, 5, 7
3560, 125, 2, 2
3561, 125, 5, 5
3562, 125, 6, 7
3563, 125, 14, 14
3564, 125, 5, 5
3565, 125, 11, 11
3566, 125, 9, 10
3567, 125, 10, 10
3568, 125, 7, 7
3569, 125, 1, 1
3570, 125, 7, 7
3571, 125, 3, 3
3572, 125, 3, 3
3573, 125, 5, 5
3574, 125, 7, 7
3575, 125, 3, 4
3576, 125, 4, 3
3577, 125, 5, 6
3578, 125, 3, 3
3579, 125, 11, 11
3580, 125, 1, 1
3581, 125, 6, 6
3582, 125, 4, 4
3583, 125, 5, 5
3584, 125, 6, 5
3585, 125, 8, 8
3586, 125, 6, 6
3587, 125, 8, 8
3588, 125, 11, 9
3589, 125, 5, 5
3590, 125, 5, 5
3591, 125, 5, 5
3592, 125, 6, 6
3593, 125, 5, 5
3594, 125, 5, 5
3595, 125, 3, 3
3596, 125, 7, 6
3597, 125, 5, 6
3598, 125, 9, 9
3599, 125, 8, 8
3600, 125, 4, 4
3601, 125, 4, 5
3602, 125, 3, 3
3603, 125, 7, 7
3604, 125, 5, 5
3605, 125, 0, 0
3606, 125, 5, 5
3607, 125, 9, 9
3608, 125, 13, 12
3609, 125, 10, 9
3610, 125, 1, 1
3611, 125, 6, 6
3612, 125, 5, 5
3613, 125, 11, 10
3614, 125, 6, 6
3615, 125, 1, 1
3616, 125, 6, 6
3617, 125, 4, 4
3618, 125, 6, 6
3619, 125, 6, 6
3620, 125, 3, 3
3621, 125, 7, 6
3622, 125, 4, 4
3623, 125, 6, 6
3624, 125, 6, 6
3625, 125, 4, 5
3626, 125, 6, 6
3627, 125, 12, 11
3628, 125, 4, 4
3629, 125, 5, 5
3630, 125, 5, 5
3631, 125, 9, 10
3632, 125, 11, 10
3633, 125, 3, 4
3634, 125, 5, 5
3635, 125, 4, 4
3636, 125, 1, 1
3637, 125, 8, 8
3638, 125, 5, 5
3639, 125, 5, 6
3640, 125, 4, 4
3641, 125, 7, 7
3642, 125, 10, 9
3643, 125, 4, 4
3644, 125, 5, 6
3645, 125, 6, 6
3646, 125, 7, 7
3647, 125, 8, 7
3648, 125, 2, 2
3649, 125, 6, 6
3650, 125, 4, 4
3651, 125, 6, 6
3652, 125, 3, 3
3653, 125, 8, 8
3654, 125, 2, 2
3655, 125, 6, 7
3656, 125, 5, 5
3657, 125, 3, 3
3658, 125, 6, 6
3659, 125, 6, 6
3660, 125, 4, 4
3661, 125, 4, 4
3662, 125, 1, 1
3663, 125, 3, 4
3664, 125, 7, 7
3665, 125, 4, 4
3666, 125, 5, 6
3667, 125, 6, 6
3668, 125, 5, 4
3669, 125, 5, 5
3670, 125, 7, 8
3671, 125, 1, 1
3672, 125, 5, 5
3673, 125, 10, 10
3674, 125, 6, 6
3675, 125, 6, 6
3676, 125, 2, 2
3677, 125, 7, 6
3678, 125, 4, 5
3679, 125, 6, 6
3680, 125, 9, 9
3681, 125, 9, 9
3682, 125, 4, 4
3683, 125, 4, 4
3684, 125, 11, 11
3685, 125, 9, 9
3686, 125, 6, 6
3687, 125, 1, 1
3688, 125, 4, 4
3689, 125, 5, 6
3690, 125, 5, 5
3691, 125, 2, 2
3692, 125, 4, 4
3693, 125, 5, 4
3694, 125, 8, 8
3695, 125, 11, 11
3696, 125, 4, 4
3697, 125, 3, 3
3698, 125, 8, 8
3699, 125, 6, 6
3700, 125, 1, 1
3701, 125, 7, 7
3702, 125, 4, 4
3703, 125, 8, 8
3704, 125, 3, 3
3705, 125, 9, 9
3706, 125, 8, 8
3707, 125, 4, 3
3708, 125, 4, 4
3709, 125, 8, 8
3710, 125, 8, 8
3711, 125, 5, 4
3712, 125, 3, 3
3713, 125, 6, 6
3714, 125, 6, 6
3715, 125, 5, 6
3716, 125, 8, 9
3717, 125, 5, 5
3718, 125, 5, 5
3719, 125, 3, 3
3720, 125, 6, 6
3721, 125, 4, 4
3722, 125, 2, 2
3723, 125, 7, 6
3724, 125, 4, 4
3725, 125, 6, 6
3726, 125, 4, 4
3727, 125, 4, 4
3728, 125, 13, 13
3729, 125, 5, 5
3730, 125, 4, 4
3731, 125, 4, 4
3732, 125, 7, 7
3733, 125, 6, 6
3734, 125, 3, 4
3735, 125, 4, 4
3736, 125, 4, 4
3737, 125, 8, 8
3738, 125, 4, 5
3739, 125, 5, 5
3740, 125, 9, 9
3741, 125, 10, 12
3742, 125, 5, 5
3743, 125, 6, 6
3744, 125, 6, 6
3745, 125, 3, 3
3746, 125, 7, 8
3747, 125, 5, 5
3748, 125, 7, 7
3749, 125, 6, 6
3750, 125, 7, 6
3751, 125, 3, 3
3752, 125, 7, 7
3753, 125, 5, 5
3754, 125, 3, 3
3755, 125, 9, 9
3756, 125, 8, 8
3757, 125, 7, 7
3758, 125, 6, 6
3759, 125, 3, 4
3760, 125, 3, 3
3761, 125, 1, 1
3762, 125, 7, 7
3763, 125, 5, 5
3764, 125, 6, 6
3765, 125, 5, 5
3766, 125, 5, 5
3767, 125, 3, 3
3768, 125, 9, 10
3769, 125, 11, 10
3770, 125, 4, 4
3771, 125, 6, 7
3772, 125, 5, 5
3773, 125, 6, 6
3774, 125, 4, 5
3775, 125, 8, 8
3776, 125, 5, 5
3777, 125, 3, 3
3778, 125, 2, 2
3779, 125, 4, 4
3780, 125, 10, 9
3781, 125, 6, 6
3782, 125, 11, 10
3783, 125, 10, 10
3784, 125, 7, 7
3785, 125, 5, 5
3786, 125, 7, 7
3787, 125, 6, 6
3788, 125, 5, 5
3789, 125, 4, 4
3790, 125, 6, 6
3791, 125, 5, 4
3792, 125, 8, 8
3793, 125, 10, 10
3794, 125, 6, 6
3795, 125, 4, 4
3796, 125, 7, 7
3797, 125, 2, 2
3798, 125, 4, 4
3799, 125, 6, 6
3800, 125, 9, 9
3801, 125, 7, 7
3802, 125, 4, 3
3803, 125, 5, 5
3804, 125, 7, 7
3805, 125, 5, 5
3806, 125, 1, 1
3807, 125, 6, 6
3808, 125, 6, 6
3809, 125, 4, 4
3810, 125, 7, 7
3811, 125, 6, 5
3812, 125, 5, 5
3813, 125, 5, 5
3814, 125, 9, 9
3815, 125, 3, 4
3816, 125, 8, 8
3817, 125, 4, 4
3818, 125, 3, 3
3819, 125, 4, 4
3820, 125, 12, 12
3821, 125, 7, 7
3822, 125, 9, 9
3823, 125, 10, 10
3824, 125, 4, 4
3825, 125, 8, 8
3826, 125, 4, 4
3827, 125, 4, 4
3828, 125, 7, 6
3829, 125, 2, 2
3830, 125, 6, 6
3831, 125, 2, 2
3832, 125, 0, 0
3833, 125, 5, 5
3834, 125, 6, 6
3835, 125, 8, 8
3836, 125, 5, 4
3837, 125, 4, 4
3838, 125, 5, 6
3839, 125, 2, 2
3840, 125, 3, 3
3841, 125, 2, 2
3842, 125, 11, 12
3843, 125, 3, 3
3844, 125, 7, 7
3845, 125, 4, 4
3846, 125, 7, 7
3847, 125, 11, 12
3848, 125, 4, 4
3849, 125, 6, 6
3850, 125, 3, 4
3851, 125, 5, 5
3852, 125, 5, 5
3853, 125, 7, 7
3854, 125, 7, 7
3855, 125, 9, 9
3856, 125, 10, 10
3857, 125, 10, 10
3858, 125, 9, 10
3859, 125, 6, 6
3860, 125, 9, 9
3861, 125, 6, 6
3862, 125, 7, 7
3863, 125, 8, 8
3864, 125, 3, 2
3865, 125, 7, 5
3866, 125, 7, 7
3867, 125, 6, 6
3868, 125, 6, 7
3869, 125, 2, 2
3870, 125, 4, 3
3871, 125, 7, 7
3872, 125, 6, 6
3873, 125, 8, 8
3874, 125, 6, 6
3875, 125, 2, 2
3876, 125, 8, 8
3877, 125, 7, 7
3878, 125, 6, 6
3879, 125, 7, 7
3880, 125, 6, 6
3881, 125, 9, 9
3882, 125, 6, 6
3883, 125, 6, 6
3884, 125, 3, 3
3885, 125, 4, 4
3886, 125, 8, 8
3887, 125, 4, 4
3888, 125, 6, 6
3889, 125, 5, 5
3890, 125, 4, 4
3891, 125, 5, 5
3892, 125, 2, 2
3893, 125, 4, 4
3894, 125, 2, 2
3895, 125, 5, 5
3896, 125, 9, 9
3897, 125, 4, 4
3898, 125, 4, 4
3899, 125, 9, 9
3900, 125, 8, 8
3901, 125, 8, 8
3902, 125, 5, 5
3903, 125, 7, 6
3904, 125, 3, 3
3905, 125, 6, 6
3906, 125, 4, 4
3907, 125, 6, 6
3908, 125, 4, 4
3909, 125, 3, 3
3910, 125, 7, 7
3911, 125, 7, 7
3912, 125, 6, 6
3913, 125, 4, 6
3914, 125, 5, 5
3915, 125, 3, 3
3916, 125, 8, 8
3917, 125, 11, 12
3918, 125, 6, 6
3919, 125, 2, 2
3920, 125, 8, 8
3921, 125, 6, 6
3922, 125, 4, 5
3923, 125, 4, 4
3924, 125, 6, 6
3925, 125, 5, 6
3926, 125, 5, 5
3927, 125, 2, 2
3928, 125, 8, 8
3929, 125, 8, 8
3930, 125, 6, 6
3931, 125, 5, 5
3932, 125, 8, 7
3933, 125, 7, 7
3934, 125, 8, 5
3935, 125, 5, 5
3936, 125, 6, 6
3937, 125, 1, 1
3938, 125, 4, 4
3939, 125, 4, 4
3940, 125, 8, 8
3941, 125, 4, 4
3942, 125, 3, 3
3943, 125, 6, 6
3944, 125, 12, 12
3945, 125, 5, 5
3946, 125, 4, 4
3947, 125, 9, 9
3948, 125, 6, 6
3949, 125, 8, 8
3950, 125, 5, 5
3951, 125, 2, 2
3952, 125, 6, 6
3953, 125, 7, 7
3954, 125, 4, 5
3955, 125, 2, 2
3956, 125, 3, 3
3957, 125, 6, 6
3958, 125, 6, 6
3959, 125, 11, 11
3960, 125, 7, 8
3961, 125, 5, 5
3962, 125, 11, 12
3963, 125, 8, 9
3964, 125, 5, 5
3965, 125, 1, 1
3966, 125, 6, 6
3967, 125, 7, 7
3968, 125, 14, 12
3969, 125, 6, 6
3970, 125, 2, 2
3971, 125, 7, 7
3972, 125, 9, 8
3973, 125, 8, 8
3974, 125, 9, 9
3975, 125, 8, 8
3976, 125, 5, 5
3977, 125, 7, 7
3978, 125, 8, 8
3979, 125, 7, 8
3980, 125, 8, 9
3981, 125, 5, 5
3982, 125, 8, 7
3983, 125, 3, 3
3984, 125, 5, 5
3985, 125, 6, 6
3986, 125, 4, 4
3987, 125, 6, 6
3988, 125, 7, 7
3989, 125, 7, 7
3990, 125, 5, 5
3991, 125, 5, 5
3992, 125, 7, 8
3993, 125, 2, 2
3994, 125, 11, 11
3995, 125, 3, 3
3996, 125, 6, 8
3997, 125, 11, 10
3998, 125, 4, 4
3999, 125, 0, 0
4000, 125, 8, 9
